cve_id,cve_href,cwe_id,vuln_type,publish_date,update_date,score,acces_level,access,complexity,authentication,confidentiality,integrity,availability,summary,refs
CVE-1999-1084,https://www.cvedetails.com/cve/CVE-1999-1084/,,,1999-12-31,2018-10-12,4.6,None,Local,Low,Not required,Partial,Partial,Partial,"The ""AEDebug"" registry key is installed with insecure permissions, which allows local users to modify the key to specify a Trojan Horse debugger which is automatically executed on a system crash.","{'http://www.securityfocus.com/bid/1044', 'https://support.microsoft.com/support/kb/articles/q103/8/61.asp', 'https://docs.microsoft.com/en-us/security-updates/securitybulletins/2000/ms00-008', 'http://www.ciac.org/ciac/bulletins/k-029.shtml', 'https://marc.info/?l=ntbugtraq&m=90222453431604&w=2'}"
CVE-1999-1083,https://www.cvedetails.com/cve/CVE-1999-1083/,,Dir. Trav.,1999-10-08,2016-10-18,5.0,None,Remote,Low,Not required,Partial,None,None,Directory traversal vulnerability in Jana proxy web server 1.45 allows remote attackers to ready arbitrary files via a .. (dot dot) attack.,"{'http://www.securityfocus.com/bid/699', 'https://marc.info/?l=bugtraq&m=95730430727064&w=2'}"
CVE-1999-1082,https://www.cvedetails.com/cve/CVE-1999-1082/,,Dir. Trav.,1999-10-08,2016-10-18,5.0,None,Remote,Low,Not required,Partial,None,None,"Directory traversal vulnerability in Jana proxy web server 1.40 allows remote attackers to ready arbitrary files via a ""......"" (modified dot dot) attack.","{'http://www.securityfocus.com/bid/699', 'https://marc.info/?l=bugtraq&m=93941794201059&w=2'}"
CVE-1999-1079,https://www.cvedetails.com/cve/CVE-1999-1079/,,+Priv,1999-05-06,2016-10-18,4.6,None,Local,Low,Not required,Partial,Partial,Partial,Vulnerability in ptrace in AIX 4.3 allows local users to gain privileges by attaching to a setgid program.,"{'http://www.securityfocus.com/bid/439', 'https://marc.info/?l=bugtraq&m=92601792420088&w=2', 'http://www-1.ibm.com/servlet/support/manager?rs=0&rt=0&org=apars&doc=08E0B1A1B85472A1852567C90031BB36', 'https://marc.info/?l=bugtraq&m=93587956513233&w=2'}"
CVE-1999-1078,https://www.cvedetails.com/cve/CVE-1999-1078/,,+Priv,1999-07-29,2008-09-05,7.5,None,Remote,Low,Not required,Partial,Partial,Partial,"WS_FTP Pro 6.0 uses weak encryption for passwords in its initialization files, which allows remote attackers to easily decrypt the passwords and gain privileges.","{'http://www.ntbugtraq.com/default.asp?pid=36&sid=1&A2=ind9907&L=ntbugtraq&D=0&P=10370&F=P', 'http://www.securityfocus.com/bid/547'}"
CVE-1999-1077,https://www.cvedetails.com/cve/CVE-1999-1077/,,Bypass,1999-11-01,2016-10-18,4.6,None,Local,Low,Not required,Partial,Partial,Partial,"Idle locking function in MacOS 9 allows local attackers to bypass the password protection of idled sessions via the programmer's switch or CMD-PWR keyboard sequence, which brings up a debugger that the attacker can use to disable the lock.","{'https://marc.info/?l=bugtraq&m=94149318124548&w=2', 'http://www.securityfocus.com/bid/756'}"
CVE-1999-1076,https://www.cvedetails.com/cve/CVE-1999-1076/,,Bypass,1999-10-26,2016-10-18,4.6,None,Local,Low,Not required,Partial,Partial,Partial,"Idle locking function in MacOS 9 allows local users to bypass the password protection of idled sessions by selecting the ""Log Out"" option and selecting a ""Cancel"" option in the dialog box for an application that attempts to verify that the user wants to log out, which returns the attacker into the locked session.","{'http://www.securityfocus.com/bid/745', 'https://marc.info/?l=bugtraq&m=94096348604173&w=2'}"
CVE-1999-1074,https://www.cvedetails.com/cve/CVE-1999-1074/,,+Priv,1999-12-31,2008-09-09,7.5,None,Remote,Low,Not required,Partial,Partial,Partial,"Webmin before 0.5 does not restrict the number of invalid passwords that are entered for a valid username, which could allow remote attackers to gain privileges via brute force password cracking.","{'http://www.securityfocus.com/bid/98', 'http://www.securityfocus.com/archive/1/9138', 'http://www.webmin.com/webmin/changes.html'}"
CVE-1999-1066,https://www.cvedetails.com/cve/CVE-1999-1066/,,,1999-12-22,2016-10-18,5.0,None,Remote,Low,Not required,None,None,Partial,"Quake 1 server responds to an initial UDP game connection request with a large amount of traffic, which allows remote attackers to use the server as an amplifier in a ""Smurf"" style attack on another host, by spoofing the connection request.",{'https://marc.info/?l=bugtraq&m=94589559631535&w=2'}
CVE-1999-1065,https://www.cvedetails.com/cve/CVE-1999-1065/,,DoS Exec Code,1999-11-04,2016-10-18,7.5,None,Remote,Low,Not required,Partial,Partial,Partial,"Palm Pilot HotSync Manager 3.0.4 in Windows 98 allows remote attackers to cause a denial of service, and possibly execute arbitrary commands, via a long string to port 14238 while the manager is in network mode.",{'https://marc.info/?l=bugtraq&m=94175465525422&w=2'}
CVE-1999-1064,https://www.cvedetails.com/cve/CVE-1999-1064/,,DoS Exec Code Overflow,1999-08-22,2016-10-18,10.0,None,Remote,Low,Not required,Complete,Complete,Complete,Multiple buffer overflows in WindowMaker 0.52 through 0.60.0 allow attackers to cause a denial of service and possibly execute arbitrary commands by executing WindowMaker with a long program name (argv[0]).,"{'http://www.securityfocus.com/bid/596', 'https://marc.info/?l=bugtraq&m=93582070508957&w=2', 'https://marc.info/?l=bugtraq&m=93555317429630&w=2'}"
CVE-1999-1063,https://www.cvedetails.com/cve/CVE-1999-1063/,,Exec Code,1999-06-01,2017-12-19,10.0,None,Remote,Low,Not required,Complete,Complete,Complete,CDomain whois_raw.cgi whois CGI script allows remote attackers to execute arbitrary commands via shell metacharacters in the fqdn parameter.,"{'http://www.securityfocus.com/archive/1/14019', 'https://exchange.xforce.ibmcloud.com/vulnerabilities/2251', 'http://www.securityfocus.com/bid/304'}"
CVE-1999-1060,https://www.cvedetails.com/cve/CVE-1999-1060/,,DoS Exec Code Overflow,1999-02-17,2016-10-18,5.0,None,Remote,Low,Not required,None,None,Partial,Buffer overflow in Tetrix TetriNet daemon 1.13.16 allows remote attackers to cause a denial of service and possibly execute arbitrary commands by connecting to port 31457 from a host with a long DNS hostname.,"{'https://marc.info/?l=bugtraq&m=91937090211855&w=2', 'http://www.securityfocus.com/bid/340'}"
CVE-1999-1058,https://www.cvedetails.com/cve/CVE-1999-1058/,,DoS Exec Code Overflow,1999-11-22,2017-12-19,7.5,None,Remote,Low,Not required,Partial,Partial,Partial,"Buffer overflow in Vermillion FTP Daemon VFTPD 1.23 allows remote attackers to cause a denial of service, and possibly execute arbitrary commands, via several long CWD commands.","{'http://www.securityfocus.com/bid/818', 'https://marc.info/?l=ntbugtraq&m=94337185023159&w=2', 'https://exchange.xforce.ibmcloud.com/vulnerabilities/3543', 'https://marc.info/?l=bugtraq&m=94329968617085&w=2'}"
CVE-1999-1055,https://www.cvedetails.com/cve/CVE-1999-1055/,,Exec Code,1999-12-31,2018-10-12,7.5,None,Remote,Low,Not required,Partial,Partial,Partial,"Microsoft Excel 97 does not warn the user before executing worksheet functions, which could allow attackers to execute arbitrary commands by using the CALL function to execute a malicious DLL, aka the Excel ""CALL Vulnerability.""","{'https://exchange.xforce.ibmcloud.com/vulnerabilities/1737', 'https://docs.microsoft.com/en-us/security-updates/securitybulletins/1998/ms98-018', 'http://www.securityfocus.com/bid/179'}"
CVE-1999-1053,https://www.cvedetails.com/cve/CVE-1999-1053/,,Exec Code,1999-09-13,2008-09-05,7.5,None,Remote,Low,Not required,Partial,Partial,Partial,"guestbook.pl cleanses user-inserted SSI commands by removing text between ""<!--"" and ""-->"" separators, which allows remote attackers to execute arbitrary commands when guestbook.pl is run on Apache 1.3.9 and possibly other versions, since Apache allows other closing sequences besides ""-->"".","{'http://www.securityfocus.com/archive/82/27296', 'http://www.securityfocus.com/archive/82/27560', 'http://www.securityfocus.com/bid/776', 'http://www.securityfocus.com/archive/1/33674'}"
CVE-1999-1052,https://www.cvedetails.com/cve/CVE-1999-1052/,,,1999-08-24,2016-10-18,5.0,None,Remote,Low,Not required,Partial,None,None,"Microsoft FrontPage stores form results in a default location in /_private/form_results.txt, which is world-readable and accessible in the document root, which allows remote attackers to read possibly sensitive information submitted by other users.",{'https://marc.info/?l=bugtraq&m=93582550911564&w=2'}
CVE-1999-1051,https://www.cvedetails.com/cve/CVE-1999-1051/,,,1999-11-16,2008-09-05,5.0,None,Remote,Low,Not required,Partial,None,None,"Default configuration in Matt Wright FormHandler.cgi script allows arbitrary directories to be used for attachments, and only restricts access to the /etc/ directory, which allows remote attackers to read arbitrary files via the reply_message_attach attachment parameter.",{'http://www.securityfocus.com/archive/1/34939'}
CVE-1999-1050,https://www.cvedetails.com/cve/CVE-1999-1050/,,Dir. Trav.,1999-11-12,2017-12-19,5.0,None,Remote,Low,Not required,Partial,None,None,"Directory traversal vulnerability in Matt Wright FormHandler.cgi script allows remote attackers to read arbitrary files via (1) a .. (dot dot) in the reply_message_attach attachment parameter, or (2) by specifying the filename as a template.","{'http://www.securityfocus.com/archive/1/34939', 'https://exchange.xforce.ibmcloud.com/vulnerabilities/3550', 'http://www.securityfocus.com/bid/798', 'http://www.securityfocus.com/archive/1/34600', 'http://www.securityfocus.com/bid/799'}"
CVE-1999-1049,https://www.cvedetails.com/cve/CVE-1999-1049/,,,1999-02-21,2021-04-07,10.0,None,Remote,Low,Not required,Complete,Complete,Complete,"ARCserve NT agents use weak encryption (XOR) for passwords, which allows remote attackers to sniff the authentication request to port 6050 and decrypt the password.",{'https://marc.info/?l=bugtraq&m=91972006211238&w=2'}
CVE-1999-1047,https://www.cvedetails.com/cve/CVE-1999-1047/,,Bypass,1999-10-18,2016-10-18,7.5,None,Remote,Low,Not required,Partial,Partial,Partial,"When BSDI patches for Gauntlet 5.0 BSDI are installed in a particular order, Gauntlet allows remote attackers to bypass firewall access restrictions, and does not log the activities.","{'https://marc.info/?l=bugtraq&m=94026690521279&w=2', 'https://marc.info/?l=bugtraq&m=94036662326185&w=2', 'http://www.iss.net/security_center/static/3397.php'}"
CVE-1999-1046,https://www.cvedetails.com/cve/CVE-1999-1046/,,DoS Exec Code Overflow,1999-03-01,2017-12-19,10.0,None,Remote,Low,Not required,Complete,Complete,Complete,"Buffer overflow in IMonitor in IMail 5.0 allows remote attackers to cause a denial of service, and possibly execute arbitrary commands, via a long string to port 8181.","{'http://www.securityfocus.com/bid/504', 'https://marc.info/?l=bugtraq&m=92038879607336&w=2', 'https://exchange.xforce.ibmcloud.com/vulnerabilities/1897'}"
CVE-1999-1043,https://www.cvedetails.com/cve/CVE-1999-1043/,,DoS,1999-12-31,2020-04-02,5.0,None,Remote,Low,Not required,None,None,Partial,"Microsoft Exchange Server 5.5 and 5.0 does not properly handle (1) malformed NNTP data, or (2) malformed SMTP data, which allows remote attackers to cause a denial of service (application error).",{'https://docs.microsoft.com/en-us/security-updates/securitybulletins/1998/ms98-007'}
CVE-1999-1042,https://www.cvedetails.com/cve/CVE-1999-1042/,,,1999-12-31,2008-09-05,1.2,None,Local,High,Not required,Partial,None,None,"Cisco Resource Manager (CRM) 1.0 and 1.1 creates world-readable log files and temporary files, which may expose sensitive information, to local users such as user IDs, passwords and SNMP community strings.",{'https://www.cisco.com/warp/public/770/crmtmp-pub.shtml'}
CVE-1999-1035,https://www.cvedetails.com/cve/CVE-1999-1035/,,DoS,1999-12-31,2018-10-12,5.0,None,Remote,Low,Not required,None,None,Partial,"IIS 3.0 and 4.0 on x86 and Alpha allows remote attackers to cause a denial of service (hang) via a malformed GET request, aka the IIS ""GET"" vulnerability.","{'https://docs.microsoft.com/en-us/security-updates/securitybulletins/1998/ms98-019', 'https://exchange.xforce.ibmcloud.com/vulnerabilities/1823', 'https://support.microsoft.com/support/kb/articles/q192/2/96.asp'}"
CVE-1999-1033,https://www.cvedetails.com/cve/CVE-1999-1033/,,,1999-05-11,2016-10-18,5.0,None,Remote,Low,Not required,None,None,Partial,"Microsoft Outlook Express before 4.72.3612.1700 allows a malicious user to send a message that contains a .., which can inadvertently cause Outlook to re-enter POP3 command mode and cause the POP3 session to hang.","{'http://www.securityfocus.com/bid/252', 'https://marc.info/?l=bugtraq&m=92663402004275&w=2', 'https://marc.info/?l=bugtraq&m=92647407427342&w=2'}"
CVE-1999-1031,https://www.cvedetails.com/cve/CVE-1999-1031/,,DoS,1999-05-19,2016-10-18,5.0,None,Remote,Low,Not required,None,None,Partial,counter.exe 2.70 allows a remote attacker to cause a denial of service (hang) via a long argument.,"{'https://marc.info/?l=ntbugtraq&m=92707671717292&w=2', 'https://marc.info/?l=bugtraq&m=92713790426690&w=2', 'http://www.securityfocus.com/bid/267'}"
CVE-1999-1030,https://www.cvedetails.com/cve/CVE-1999-1030/,,DoS,1999-05-19,2016-10-18,5.0,None,Remote,Low,Not required,None,None,Partial,"counter.exe 2.70 allows a remote attacker to cause a denial of service (hang) via an HTTP request that ends in %0A (newline), which causes a malformed entry in the counter log that produces an access violation.","{'https://marc.info/?l=ntbugtraq&m=92707671717292&w=2', 'https://marc.info/?l=bugtraq&m=92713790426690&w=2', 'http://www.securityfocus.com/bid/267'}"
CVE-1999-1029,https://www.cvedetails.com/cve/CVE-1999-1029/,,,1999-05-13,2017-12-19,7.5,None,Remote,Low,Not required,Partial,Partial,Partial,"SSH server (sshd2) before 2.0.12 does not properly record login attempts if the connection is closed before the maximum number of tries, allowing a remote attacker to guess the password without showing up in the audit logs.","{'https://exchange.xforce.ibmcloud.com/vulnerabilities/2193', 'https://marc.info/?l=bugtraq&m=92663402004280&w=2', 'http://www.securityfocus.com/bid/277'}"
CVE-1999-1028,https://www.cvedetails.com/cve/CVE-1999-1028/,,DoS,1999-05-28,2016-10-18,5.0,None,Remote,Low,Not required,None,None,Partial,Symantec pcAnywhere 8.0 allows remote attackers to cause a denial of service (CPU utilization) via a large amount of data to port 5631.,"{'http://www.iss.net/security_center/static/2256.php', 'http://www.securityfocus.com/bid/288', 'https://marc.info/?l=ntbugtraq&m=92807524225090&w=2'}"
CVE-1999-1023,https://www.cvedetails.com/cve/CVE-1999-1023/,,,1999-06-10,2018-10-30,4.6,None,Local,Low,Not required,Partial,Partial,Partial,"useradd in Solaris 7.0 does not properly interpret certain date formats as specified in the ""-e"" (expiration date) argument, which could allow users to login after their accounts have expired.","{'https://marc.info/?l=bugtraq&m=92904175406756&w=2', 'http://www.securityfocus.com/bid/426'}"
CVE-1999-1019,https://www.cvedetails.com/cve/CVE-1999-1019/,,,1999-06-23,2016-10-18,7.2,None,Local,Low,Not required,Complete,Complete,Complete,"SpectroSERVER in Cabletron Spectrum Enterprise Manager 5.0 installs a directory tree with insecure permissions, which allows local users to replace a privileged executable (processd) with a Trojan horse, facilitating a root or Administrator compromise.","{'http://www.securityfocus.com/bid/495', 'https://marc.info/?l=bugtraq&m=93024398713491&w=2', 'https://marc.info/?l=bugtraq&m=93024398513475&w=2'}"
CVE-1999-1018,https://www.cvedetails.com/cve/CVE-1999-1018/,,Bypass,1999-07-27,2016-10-18,7.5,None,Remote,Low,Not required,Partial,Partial,Partial,"IPChains in Linux kernels 2.2.10 and earlier does not reassemble IP fragments before checking the header information, which allows a remote attacker to bypass the filtering rules using several fragments with 0 offsets.","{'https://marc.info/?l=bugtraq&m=93312523904591&w=2', 'http://www.securityfocus.com/bid/543'}"
CVE-1999-1017,https://www.cvedetails.com/cve/CVE-1999-1017/,,,1999-07-28,2016-10-18,7.5,None,Remote,Low,Not required,Partial,Partial,Partial,"Seattle Labs Emurl 2.0, and possibly earlier versions, stores e-mail attachments in a specific directory with scripting enabled, which allows a malicious ASP file attachment to execute when the recipient opens the message.","{'http://www.securityfocus.com/bid/544', 'https://marc.info/?l=ntbugtraq&m=93316253431588&w=2'}"
CVE-1999-1016,https://www.cvedetails.com/cve/CVE-1999-1016/,,DoS,1999-08-27,2021-07-22,5.0,None,Remote,Low,Not required,None,None,Partial,"Microsoft HTML control as used in (1) Internet Explorer 5.0, (2) FrontPage Express, (3) Outlook Express 5, and (4) Eudora, and possibly others, allows remote malicious web site or HTML emails to cause a denial of service (100% CPU consumption) via large HTML form fields such as text inputs in a table cell.","{'http://www.securityfocus.com/bid/606', 'https://marc.info/?l=ntbugtraq&m=93578772920970&w=2'}"
CVE-1999-1014,https://www.cvedetails.com/cve/CVE-1999-1014/,,Overflow +Priv,1999-09-13,2018-10-30,4.6,None,Local,Low,Not required,Partial,Partial,Partial,Buffer overflow in mail command in Solaris 2.7 and 2.7 allows local users to gain privileges via a long -m argument.,"{'https://marc.info/?l=bugtraq&m=93727925026476&w=2', 'http://www.securityfocus.com/bid/672', 'https://exchange.xforce.ibmcloud.com/vulnerabilities/3297', 'https://marc.info/?l=bugtraq&m=93846422810162&w=2'}"
CVE-1999-1013,https://www.cvedetails.com/cve/CVE-1999-1013/,,,1999-09-23,2016-10-18,7.2,None,Local,Low,Not required,Complete,Complete,Complete,named-xfer in AIX 4.1.5 and 4.2.1 allows members of the system group to overwrite system files to gain root access via the -f parameter and a malformed zone file.,"{'https://marc.info/?l=bugtraq&m=93837026726954&w=2', 'http://www.securityfocus.com/bid/673'}"
CVE-1999-1012,https://www.cvedetails.com/cve/CVE-1999-1012/,,,1999-05-04,2008-09-05,5.0,None,Remote,Low,Not required,None,None,Partial,"SMTP component of Lotus Domino 4.6.1 on AS/400, and possibly other operating systems, allows a remote attacker to crash the mail server via a long string.","{'http://www.securityfocus.com/archive/1/13527', 'http://www.securityfocus.com/bid/173'}"
CVE-1999-1011,https://www.cvedetails.com/cve/CVE-1999-1011/,CWE-264,Exec Code,1999-07-19,2018-10-15,10.0,None,Remote,Low,Not required,Complete,Complete,Complete,"The Remote Data Service (RDS) DataFactory component of Microsoft Data Access Components (MDAC) in IIS 3.x and 4.x exposes unsafe methods, which allows remote attackers to execute arbitrary commands.","{'http://www.osvdb.org/272', 'https://docs.microsoft.com/en-us/security-updates/securitybulletins/1999/ms99-025', 'https://docs.microsoft.com/en-us/security-updates/securitybulletins/1998/ms98-004', 'http://www.ciac.org/ciac/bulletins/j-054.shtml', 'https://www.securityfocus.com/bid/529'}"
CVE-1999-1010,https://www.cvedetails.com/cve/CVE-1999-1010/,,,1999-12-14,2016-10-18,2.1,None,Local,Low,Not required,Partial,None,None,"An SSH 1.2.27 server allows a client to use the ""none"" cipher, even if it is not allowed by the server policy.",{'https://marc.info/?l=bugtraq&m=94519142415338&w=2'}
CVE-1999-1009,https://www.cvedetails.com/cve/CVE-1999-1009/,,,1999-12-12,2008-09-09,2.6,None,Remote,High,Not required,Partial,None,None,The Disney Go Express Search allows remote attackers to access and modify search information for users by connecting to an HTTP server on the user's system.,set()
CVE-1999-1007,https://www.cvedetails.com/cve/CVE-1999-1007/,,Exec Code Overflow,1999-12-13,2016-10-18,7.6,None,Remote,High,Not required,Complete,Complete,Complete,Buffer overflow in VDO Live Player allows remote attackers to execute commands on the VDO client via a malformed .vdo file.,"{'http://www.securityfocus.com/bid/872', 'https://marc.info/?l=bugtraq&m=94512259331599&w=2'}"
CVE-1999-1006,https://www.cvedetails.com/cve/CVE-1999-1006/,,,1999-12-19,2016-10-18,5.0,None,Remote,Low,Not required,Partial,None,None,Groupwise web server GWWEB.EXE allows remote attackers to determine the real path of the web server via the HELP parameter.,{'https://marc.info/?l=bugtraq&m=94571433731824&w=2'}
CVE-1999-1005,https://www.cvedetails.com/cve/CVE-1999-1005/,,,1999-12-19,2016-10-18,5.0,None,Remote,Low,Not required,Partial,None,None,Groupwise web server GWWEB.EXE allows remote attackers to read arbitrary files with .htm extensions via a .. (dot dot) attack using the HELP parameter.,"{'http://www.osvdb.org/3413', 'http://www.securityfocus.com/bid/879', 'https://marc.info/?l=bugtraq&m=94571433731824&w=2'}"
CVE-1999-1004,https://www.cvedetails.com/cve/CVE-1999-1004/,,Overflow,1999-12-16,2008-09-09,5.0,None,Remote,Low,Not required,None,None,Partial,Buffer overflow in the POP server POProxy for the Norton Anti-Virus protection NAV2000 program via a large USER command.,"{'http://www.osvdb.org/6267', 'http://service1.symantec.com/SUPPORT/nav.nsf/df0a595864594c86852567ac0063608c/6206f660a1f2516a882568660082c930?OpenDocument&Highlight=0,poproxy', 'http://www.securityfocus.com/archive/1/38970', 'http://www.securityfocus.com/archive/1/39194'}"
CVE-1999-1003,https://www.cvedetails.com/cve/CVE-1999-1003/,,DoS,1999-12-13,2008-09-09,5.0,None,Remote,Low,Not required,None,None,Partial,War FTP Daemon 1.70 allows remote attackers to cause a denial of service by flooding it with connections.,set()
CVE-1999-1001,https://www.cvedetails.com/cve/CVE-1999-1001/,,,1999-12-16,2008-09-09,2.6,None,Remote,High,Not required,None,Partial,None,Cisco Cache Engine allows a remote attacker to gain access via a null username and password.,set()
CVE-1999-1000,https://www.cvedetails.com/cve/CVE-1999-1000/,,,1999-12-16,2008-09-09,5.0,None,Remote,Low,Not required,Partial,None,None,The web administration interface for Cisco Cache Engine allows remote attackers to view performance statistics.,set()
CVE-1999-0999,https://www.cvedetails.com/cve/CVE-1999-0999/,CWE-20,DoS,1999-11-19,2018-10-12,4.3,None,Remote,Medium,Not required,None,None,Partial,Microsoft SQL 7.0 server allows a remote attacker to cause a denial of service via a malformed TDS packet.,"{'https://docs.microsoft.com/en-us/security-updates/securitybulletins/1999/ms99-059', 'http://www.securityfocus.com/bid/817', 'https://support.microsoft.com/default.aspx?scid=kb;[LN];Q248749'}"
CVE-1999-0998,https://www.cvedetails.com/cve/CVE-1999-0998/,,,1999-12-16,2008-09-09,5.0,None,Remote,Low,Not required,None,Partial,None,Cisco Cache Engine allows an attacker to replace content in the cache.,set()
CVE-1999-0997,https://www.cvedetails.com/cve/CVE-1999-0997/,,Exec Code,1999-12-20,2008-09-05,7.5,None,Remote,Low,Not required,Partial,Partial,Partial,"wu-ftp with FTP conversion enabled allows an attacker to execute commands via a malformed file name that is interpreted as an argument to the program that does the conversion, e.g. tar or uncompress.",{'https://www.debian.org/security/2003/dsa-377'}
CVE-1999-0996,https://www.cvedetails.com/cve/CVE-1999-0996/,,Exec Code Overflow,1999-12-15,2008-09-09,7.5,None,Remote,Low,Not required,Partial,Partial,Partial,Buffer overflow in Infoseek Ultraseek search engine allows remote attackers to execute commands via a long GET request.,"{'http://www.eeye.com/html/Research/Advisories/AD19991215.html', 'http://www.osvdb.org/6490'}"
CVE-1999-0995,https://www.cvedetails.com/cve/CVE-1999-0995/,CWE-20,DoS,1999-12-16,2018-10-12,7.8,None,Remote,Low,Not required,None,None,Complete,"Windows NT Local Security Authority (LSA) allows remote attackers to cause a denial of service via malformed arguments to the LsaLookupSids function which looks up the SID, aka ""Malformed Security Identifier Request.""","{'https://docs.microsoft.com/en-us/security-updates/securitybulletins/1999/ms99-057', 'https://support.microsoft.com/default.aspx?scid=kb;[LN];Q248185', 'http://www.securityfocus.com/bid/875'}"
CVE-1999-0994,https://www.cvedetails.com/cve/CVE-1999-0994/,CWE-255,,1999-12-16,2018-10-12,5.0,None,Remote,Low,Not required,Partial,None,None,"Windows NT with SYSKEY reuses the keystream that is used for encrypting SAM password hashes, allowing an attacker to crack passwords.","{'http://www.securityfocus.com/bid/873', 'https://docs.microsoft.com/en-us/security-updates/securitybulletins/1999/ms99-056', 'https://support.microsoft.com/default.aspx?scid=kb;[LN];Q248183'}"
CVE-1999-0993,https://www.cvedetails.com/cve/CVE-1999-0993/,CWE-665,,1999-12-13,2020-04-02,7.5,None,Remote,Low,Not required,Partial,Partial,Partial,Modifications to ACLs (Access Control Lists) in Microsoft Exchange  5.5 do not take effect until the directory store cache is refreshed.,set()
CVE-1999-0991,https://www.cvedetails.com/cve/CVE-1999-0991/,,DoS Overflow,1999-12-06,2008-09-09,5.0,None,Remote,Low,Not required,None,None,Partial,Buffer overflow in GoodTech Telnet Server NT allows remote users to cause a denial of service via a long login name.,{'http://www.securityfocus.com/bid/862'}
CVE-1999-0990,https://www.cvedetails.com/cve/CVE-1999-0990/,,,1999-12-05,2008-09-09,2.1,None,Local,Low,Not required,Partial,None,None,Error messages generated by gdm with the VerboseAuth setting allows an attacker to identify valid users on a system.,set()
CVE-1999-0989,https://www.cvedetails.com/cve/CVE-1999-0989/,,Exec Code Overflow,1999-12-06,2008-09-09,7.5,None,Remote,Low,Not required,Partial,Partial,Partial,Buffer overflow in Internet Explorer 5 directshow filter (MSDXM.OCX) allows remote attackers to execute commands via the vnd.ms.radio protocol.,{'http://www.securityfocus.com/bid/861'}
CVE-1999-0988,https://www.cvedetails.com/cve/CVE-1999-0988/,,,1999-12-04,2008-09-09,7.2,None,Local,Low,Not required,Complete,Complete,Complete,UnixWare pkgtrans allows local users to read arbitrary files via a symlink attack.,set()
