cve_id,cve_href,cwe_id,vuln_type,publish_date,update_date,score,acces_level,access,complexity,authentication,confidentiality,integrity,availability,summary,refs
CVE-1999-1469,https://www.cvedetails.com/cve/CVE-1999-1469/,,Exec Code Overflow,1999-09-30,2016-10-18,7.5,None,Remote,Low,Not required,Partial,Partial,Partial,"Buffer overflow in w3-auth CGI program in miniSQL package allows remote attackers to execute arbitrary commands via an HTTP request with (1) a long URL, or (2) a long User-Agent MIME header.",{'https://marc.info/?l=bugtraq&m=93871926821410&w=2'}
CVE-1999-1465,https://www.cvedetails.com/cve/CVE-1999-1465/,,Bypass,1999-12-31,2017-12-19,7.5,None,Remote,Low,Not required,Partial,Partial,Partial,"Vulnerability in Cisco IOS 11.1 through 11.3 with distributed fast switching (DFS) enabled allows remote attackers to bypass certain access control lists when the router switches traffic from a DFS-enabled input interface to an output interface with a logical subinterface, as described by Cisco bug CSCdk43862.","{'http://ciac.llnl.gov/ciac/bulletins/j-016.shtml', 'https://exchange.xforce.ibmcloud.com/vulnerabilities/1401', 'https://www.cisco.com/warp/public/770/iosdfsacl-pub.shtml'}"
CVE-1999-1464,https://www.cvedetails.com/cve/CVE-1999-1464/,,Bypass,1999-12-31,2017-12-19,7.5,None,Remote,Low,Not required,Partial,Partial,Partial,"Vulnerability in Cisco IOS 11.1CC and 11.1CT with distributed fast switching (DFS) enabled allows remote attackers to bypass certain access control lists when the router switches traffic from a DFS-enabled interface to an interface that does not have DFS enabled, as described by Cisco bug CSCdk35564.","{'http://ciac.llnl.gov/ciac/bulletins/j-016.shtml', 'https://exchange.xforce.ibmcloud.com/vulnerabilities/1401', 'https://www.cisco.com/warp/public/770/iosdfsacl-pub.shtml'}"
CVE-1999-1462,https://www.cvedetails.com/cve/CVE-1999-1462/,CWE-200,+Info,1999-12-31,2018-11-29,5.0,None,Remote,Low,Not required,Partial,None,None,Vulnerability in bb-hist.sh CGI History module in Big Brother 1.09b and 1.09c allows remote attackers to read portions of arbitrary files.,"{'http://www.securityfocus.com/bid/142', 'https://exchange.xforce.ibmcloud.com/vulnerabilities/3755', 'http://www.securityfocus.com/archive/1/13440', 'http://bb4.com/README.CHANGES'}"
CVE-1999-1460,https://www.cvedetails.com/cve/CVE-1999-1460/,,,1999-07-13,2016-10-18,7.2,None,Local,Low,Not required,Complete,Complete,Complete,BMC PATROL SNMP Agent before 3.2.07 allows local users to create arbitrary world-writeable files as root by specifying the target file as the second argument to the snmpmagt program.,"{'http://www.securityfocus.com/bid/525', 'https://marc.info/?l=bugtraq&m=93372579004129&w=2', 'https://marc.info/?l=bugtraq&m=93198293132463&w=2'}"
CVE-1999-1458,https://www.cvedetails.com/cve/CVE-1999-1458/,,Overflow +Priv,1999-01-25,2017-12-19,7.2,None,Local,Low,Not required,Complete,Complete,Complete,Buffer overflow in at program in Digital UNIX 4.0 allows local users to gain root privileges via a long command line argument.,"{'https://exchange.xforce.ibmcloud.com/vulnerabilities/3138', 'http://www.securityfocus.com/archive/1/12121', 'http://ftp1.support.compaq.com/public/dunix/v4.0d/ssrt0583u.README'}"
CVE-1999-1457,https://www.cvedetails.com/cve/CVE-1999-1457/,,Exec Code Overflow,1999-11-16,2008-09-10,7.5,None,Remote,Low,Not required,Partial,Partial,Partial,"Buffer overflow in thttpd HTTP server before 2.04-31 allows remote attackers to execute arbitrary commands via a long date string, which is not properly handled by the tdate_parse function.",{'http://www.novell.com/linux/security/advisories/suse_security_announce_30.html'}
CVE-1999-1456,https://www.cvedetails.com/cve/CVE-1999-1456/,,,1999-12-31,2017-10-10,5.0,None,Remote,Low,Not required,Partial,None,None,thttpd HTTP server 2.03 and earlier allows remote attackers to read arbitrary files via a GET request with more than one leading / (slash) character in the filename.,"{'http://www.securityfocus.com/archive/1/10368', 'http://www.acme.com/software/thttpd/thttpd.html#releasenotes', 'https://exchange.xforce.ibmcloud.com/vulnerabilities/1809'}"
CVE-1999-1455,https://www.cvedetails.com/cve/CVE-1999-1455/,,,1999-12-31,2017-10-10,7.5,None,Remote,Low,Not required,Partial,Partial,Partial,"RSH service utility RSHSVC in Windows NT 3.5 through 4.0 does not properly restrict access as specified in the .Rhosts file when a user comes from an authorized host, which could allow unauthorized users to access the service by logging in from an authorized host.","{'https://support.microsoft.com/support/kb/articles/q158/3/20.asp', 'https://exchange.xforce.ibmcloud.com/vulnerabilities/7422'}"
CVE-1999-1454,https://www.cvedetails.com/cve/CVE-1999-1454/,,Bypass,1999-10-04,2016-10-18,4.6,None,Local,Low,Not required,Partial,Partial,Partial,"Macromedia ""The Matrix"" screen saver on Windows 95 with the ""Password protected"" option enabled allows attackers with physical access to the machine to bypass the password prompt by pressing the ESC (Escape) key.",{'https://marc.info/?l=bugtraq&m=93915027622690&w=2'}
CVE-1999-1453,https://www.cvedetails.com/cve/CVE-1999-1453/,,,1999-02-02,2021-07-22,2.6,None,Remote,High,Not required,Partial,None,None,Internet Explorer 4 allows remote attackers (malicious web site operators) to read the contents of the clipboard via the Internet WebBrowser ActiveX object.,"{'https://marc.info/?l=ntbugtraq&m=91979439932341&w=2', 'http://www.securityfocus.com/bid/215'}"
CVE-1999-1452,https://www.cvedetails.com/cve/CVE-1999-1452/,,,1999-12-31,2017-10-10,2.1,None,Local,Low,Not required,Partial,None,None,GINA in Windows NT 4.0 allows attackers with physical access to display a portion of the clipboard of the user who has locked the workstation by pasting (CTRL-V) the contents into the username prompt.,"{'https://marc.info/?l=bugtraq&m=91788829326419&w=2', 'https://marc.info/?l=ntbugtraq&m=91822011021558&w=2', 'https://marc.info/?l=ntbugtraq&m=91764169410814&w=2', 'https://support.microsoft.com/support/kb/articles/q214/8/02.asp', 'https://exchange.xforce.ibmcloud.com/vulnerabilities/1975', 'http://www.securityfocus.com/bid/198'}"
CVE-1999-1451,https://www.cvedetails.com/cve/CVE-1999-1451/,,,1999-12-31,2018-10-12,5.0,None,Remote,Low,Not required,Partial,None,None,The Winmsdp.exe sample file in IIS 4.0 and Site Server 3.0 allows remote attackers to read arbitrary files.,"{'https://exchange.xforce.ibmcloud.com/vulnerabilities/3271', 'https://support.microsoft.com/support/kb/articles/q231/3/68.asp', 'https://docs.microsoft.com/en-us/security-updates/securitybulletins/1999/ms99-013'}"
CVE-1999-1450,https://www.cvedetails.com/cve/CVE-1999-1450/,,+Priv,1999-01-27,2008-09-10,7.5,None,Remote,Low,Not required,Partial,Partial,Partial,"Vulnerability in (1) rlogin daemon rshd and (2) scheme on SCO UNIX OpenServer 5.0.5 and earlier, and SCO UnixWare 7.0.1 and earlier, allows remote attackers to gain privileges.","{'ftp://ftp.sco.COM/SSE/sse020.ltr', 'ftp://ftp.sco.com/SSE/security_bulletins/SB-99.03b', 'ftp://ftp.sco.com/SSE/security_bulletins/SB-99.06b'}"
CVE-1999-1444,https://www.cvedetails.com/cve/CVE-1999-1444/,,,1999-12-31,2008-09-10,5.0,None,Remote,Low,Not required,Partial,None,None,"genkey utility in Alibaba 2.0 generates RSA key pairs with an exponent of 1, which results in transactions that are sent in cleartext.",{'http://catless.ncl.ac.uk/Risks/20.41.html#subj4'}
CVE-1999-1440,https://www.cvedetails.com/cve/CVE-1999-1440/,,,1999-01-01,2016-10-18,5.1,None,Remote,High,Not required,Partial,Partial,Partial,"Win32 ICQ 98a 1.30, and possibly other versions, does not display the entire portion of long filenames, which could allow attackers to send an executable file with a long name that contains so many spaces that the .exe extension is not displayed, which could make the user believe that the file is safe to open from the client.","{'http://www.securityfocus.com/bid/132', 'https://marc.info/?l=bugtraq&m=91522424302962&w=2'}"
CVE-1999-1430,https://www.cvedetails.com/cve/CVE-1999-1430/,,,1999-01-01,2016-10-18,2.1,None,Local,Low,Not required,Partial,None,None,"PIM software for Royal daVinci does not properly password-protext access to data stored in the .mdb (Microsoft Access) file, which allows local users to read the data without a password by directly accessing the files with a different application, such as Access.","{'http://www.securityfocus.com/bid/185', 'https://marc.info/?l=bugtraq&m=91540043723185&w=2'}"
CVE-1999-1422,https://www.cvedetails.com/cve/CVE-1999-1422/,,,1999-01-02,2016-10-18,7.2,None,Local,Low,Not required,Complete,Complete,Complete,"The default configuration of Slackware 3.4, and possibly other versions, includes . (dot, the current directory) in the PATH environmental variable, which could allow local users to create Trojan horse programs that are inadvertently executed by other users.","{'https://marc.info/?l=bugtraq&m=91540043023167&w=2', 'http://www.securityfocus.com/bid/211'}"
CVE-1999-1418,https://www.cvedetails.com/cve/CVE-1999-1418/,,,1999-05-01,2008-09-05,5.0,None,Remote,Low,Not required,Partial,None,None,"ICQ99 ICQ web server build 1701 with ""Active Homepage"" enabled generates allows remote attackers to determine the existence of files on the server by comparing server responses when a file exists (""404 Forbidden"") versus when a file does not exist (""404 not found"").","{'http://www.securityfocus.com/bid/246', 'http://www.securityfocus.com/archive/1/13508'}"
CVE-1999-1414,https://www.cvedetails.com/cve/CVE-1999-1414/,,+Priv,1999-05-25,2016-10-18,7.2,None,Local,Low,Not required,Complete,Complete,Complete,"IBM Netfinity Remote Control allows local users to gain administrator privileges by starting programs from the process manager, which runs with system level privileges.","{'http://www.securityfocus.com/bid/284', 'https://marc.info/?l=ntbugtraq&m=92902484317769&w=2', 'https://marc.info/?l=ntbugtraq&m=92765856706547&w=2'}"
CVE-1999-1412,https://www.cvedetails.com/cve/CVE-1999-1412/,,DoS,1999-06-03,2021-04-21,5.0,None,Remote,Low,Not required,None,None,Partial,"A possible interaction between Apple MacOS X release 1.0 and Apache HTTP server allows remote attackers to cause a denial of service (crash) via a flood of HTTP GET requests to CGI programs, which generates a large number of processes.","{'http://www.securityfocus.com/bid/306', 'http://www.securityfocus.com/archive/1/14215'}"
CVE-1999-1405,https://www.cvedetails.com/cve/CVE-1999-1405/,,Exec Code,1999-02-17,2016-10-18,10.0,None,Remote,Low,Not required,Complete,Complete,Complete,"snap command in AIX before 4.3.2 creates the /tmp/ibmsupt directory with world-readable permissions and does not remove or clear the directory when snap -a is executed, which could allow local users to access the shadowed password file by creating /tmp/ibmsupt/general/passwd before root runs snap -a.","{'http://www.securityfocus.com/bid/375', 'https://marc.info/?l=bugtraq&m=91936783009385&w=2', 'https://marc.info/?l=bugtraq&m=91954824614013&w=2'}"
CVE-1999-1400,https://www.cvedetails.com/cve/CVE-1999-1400/,,Bypass,1999-06-03,2016-10-18,2.1,None,Local,Low,Not required,Partial,None,None,"The Economist screen saver 1999 with the ""Password Protected"" option enabled allows users with physical access to the machine to bypass the screen saver and read files by running Internet Explorer while the screen is still locked.","{'http://archives.indenial.com/hypermail/ntbugtraq/1999/June1999/0009.html', 'http://archives.indenial.com/hypermail/ntbugtraq/1999/June1999/0007.html', 'http://www.securityfocus.com/bid/466', 'https://marc.info/?l=ntbugtraq&m=92851653600852&w=2'}"
CVE-1999-1397,https://www.cvedetails.com/cve/CVE-1999-1397/,,+Info,1999-03-23,2016-10-18,7.5,None,Remote,Low,Not required,Partial,Partial,Partial,"Index Server 2.0 on IIS 4.0 stores physical path information in the ContentIndex\Catalogs subkey of the AllowedPaths registry key, whose permissions allows local and remote users to obtain the physical paths of directories that are being indexed.","{'http://www.securityfocus.com/bid/476', 'http://www.iss.net/security_center/static/7559.php', 'https://marc.info/?l=bugtraq&m=92242671024118&w=2', 'https://marc.info/?l=ntbugtraq&m=92223293409756&w=2'}"
CVE-1999-1394,https://www.cvedetails.com/cve/CVE-1999-1394/,,,1999-07-02,2016-10-18,2.1,None,Local,Low,Not required,None,Partial,None,"BSD 4.4 based operating systems, when running at security level 1, allow the root user to clear the immutable and append-only flags for files by unmounting the file system and using a file system editor such as fsdb to directly modify the file through a device.","{'http://www.securityfocus.com/bid/510', 'https://marc.info/?l=bugtraq&m=93094058620450&w=2'}"
CVE-1999-1393,https://www.cvedetails.com/cve/CVE-1999-1393/,,Bypass,1999-05-21,2008-09-05,4.6,None,Local,Low,Not required,Partial,Partial,Partial,"Control Panel ""Password Security"" option for Apple Powerbooks allows attackers with physical access to the machine to bypass the security by booting it with an emergency startup disk and using a disk editor to modify the on/off toggle or password in the aaaaaaaAPWD file, which is normally inaccessible.","{'http://freaky.staticusers.net/macsec/data/powerbooksecurity-data.html', 'http://www.securityfocus.com/bid/532'}"
CVE-1999-1386,https://www.cvedetails.com/cve/CVE-1999-1386/,,,1999-12-31,2016-10-18,2.1,None,Local,Low,Not required,None,Partial,None,"Perl 5.004_04 and earlier follows symbolic links when running with the -e option, which allows local users to overwrite arbitrary files via a symlink attack on the /tmp/perl-eaXXXXX file.","{'http://www.iss.net/security_center/static/7243.php', 'https://www.redhat.com/support/errata/rh50-errata-general.html#perl', 'https://marc.info/?l=bugtraq&m=88932165406213&w=2'}"
CVE-1999-1382,https://www.cvedetails.com/cve/CVE-1999-1382/,,+Priv,1999-12-31,2016-10-18,7.2,None,Local,Low,Not required,Complete,Complete,Complete,"NetWare NFS mode 1 and 2 implements the ""Read Only"" flag in Unix by changing the ownership of a file to root, which allows local users to gain root privileges by creating a setuid program and setting it to ""Read Only,"" which NetWare-NFS changes to a setuid root program.","{'https://marc.info/?l=bugtraq&m=88427711321769&w=2', 'http://www.iss.net/security_center/static/7246.php', 'https://marc.info/?l=bugtraq&m=90295697702474&w=2', 'http://support.novell.com/cgi-bin/search/tidfinder.cgi?2940551'}"
CVE-1999-1379,https://www.cvedetails.com/cve/CVE-1999-1379/,,,1999-12-31,2016-10-18,5.0,None,Remote,Low,Not required,None,None,Partial,"DNS allows remote attackers to use DNS name servers as traffic amplifiers via a UDP DNS query with a spoofed source address, which produces more traffic to the victim than was sent by the attacker.","{'https://marc.info/?l=bugtraq&m=93433758607623&w=2', 'ftp://ftp.auscert.org.au/pub/auscert/advisory/AL-1999.004.dns_dos', 'https://marc.info/?l=bugtraq&m=93348057829957&w=2', 'http://www.iss.net/security_center/static/7238.php', 'http://ciac.llnl.gov/ciac/bulletins/j-063.shtml'}"
CVE-1999-1378,https://www.cvedetails.com/cve/CVE-1999-1378/,,,1999-07-19,2016-10-18,5.0,None,Remote,Low,Not required,Partial,None,None,"dbmlparser.exe CGI guestbook program does not perform a chroot operation properly, which allows remote attackers to read arbitrary files.",{'https://marc.info/?l=bugtraq&m=93250710625956&w=2'}
CVE-1999-1377,https://www.cvedetails.com/cve/CVE-1999-1377/,,,1999-09-09,2008-09-05,5.0,None,Remote,Low,Not required,Partial,None,None,Matt Wright's download.cgi 1.0 allows remote attackers to read arbitrary files via a .. (dot dot) in the f parameter.,{'http://pulhas.org/phrack/55/P55-07.html'}
CVE-1999-1376,https://www.cvedetails.com/cve/CVE-1999-1376/,,Exec Code Overflow,1999-01-14,2016-10-18,10.0,None,Remote,Low,Not required,Complete,Complete,Complete,Buffer overflow in fpcount.exe in IIS 4.0 with FrontPage Server Extensions allows remote attackers to execute arbitrary commands.,"{'https://marc.info/?l=ntbugtraq&m=91632724913080&w=2', 'https://marc.info/?l=bugtraq&m=91638375309890&w=2'}"
CVE-1999-1375,https://www.cvedetails.com/cve/CVE-1999-1375/,,,1999-02-11,2016-10-18,5.0,None,Remote,Low,Not required,Partial,None,None,FileSystemObject (FSO) in the showfile.asp Active Server Page (ASP) allows remote attackers to read arbitrary files by specifying the name in the file parameter.,"{'http://www.securityfocus.com/bid/230', 'https://marc.info/?l=ntbugtraq&m=91877455626320&w=2'}"
CVE-1999-1372,https://www.cvedetails.com/cve/CVE-1999-1372/,,+Priv,1999-02-19,2016-10-18,4.6,None,Local,Low,Not required,Partial,Partial,Partial,"Triactive Remote Manager with Basic authentication enabled stores the username and password in cleartext in registry keys, which could allow local users to gain privileges.",{'https://marc.info/?l=bugtraq&m=91966339502073&w=2'}
CVE-1999-1371,https://www.cvedetails.com/cve/CVE-1999-1371/,,Overflow +Priv,1999-03-08,2018-10-30,7.2,None,Local,Low,Not required,Complete,Complete,Complete,Buffer overflow in /usr/bin/write in Solaris 2.6 and 7 allows local users to gain privileges via a long string in the terminal name argument.,"{'https://exchange.xforce.ibmcloud.com/vulnerabilities/7546', 'https://marc.info/?l=bugtraq&m=92100752221493&w=2', 'http://www.securiteam.com/exploits/5ZP0O1P35O.html'}"
CVE-1999-1370,https://www.cvedetails.com/cve/CVE-1999-1370/,,,1999-03-23,2021-07-22,7.2,None,Local,Low,Not required,Complete,Complete,Complete,"The setup wizard (ie5setup.exe) for Internet Explorer 5.0 disables (1) the screen saver, which could leave the system open to users with physical access if a failure occurs during an unattended installation, and (2) the Task Scheduler Service, which might prevent the scheduled execution of security-critical programs.",{'https://marc.info/?l=ntbugtraq&m=92220197414799&w=2'}
CVE-1999-1369,https://www.cvedetails.com/cve/CVE-1999-1369/,,+Priv,1999-04-14,2016-10-18,4.6,None,Local,Low,Not required,Partial,Partial,Partial,"Real Media RealServer (rmserver) 6.0.3.353 stores a password in plaintext in the world-readable rmserver.cfg file, which allows local users to gain privileges.",{'https://marc.info/?l=bugtraq&m=92411181619110&w=2'}
CVE-1999-1368,https://www.cvedetails.com/cve/CVE-1999-1368/,,,1999-05-12,2021-04-09,7.5,None,Remote,Low,Not required,Partial,Partial,Partial,"AV Option for MS Exchange Server option for InoculateIT 4.53, and possibly other versions, only scans the Inbox folder tree of a Microsoft Exchange server, which could allow viruses to escape detection if a user's rules cause the message to be moved to a different mailbox.","{'https://marc.info/?l=ntbugtraq&m=92652152723629&w=2', 'https://marc.info/?l=ntbugtraq&m=97439568517355&w=2'}"
CVE-1999-1367,https://www.cvedetails.com/cve/CVE-1999-1367/,,,1999-05-06,2021-07-22,4.6,None,Local,Low,Not required,Partial,Partial,Partial,"Internet Explorer 5.0 does not properly reset the username/password cache for Web sites that do not use standard cache controls, which could allow users on the same system to access restricted web sites that were visited by other users.","{'https://www.pcworld.com/news/article/0,aid,10842,00.asp'}"
CVE-1999-1366,https://www.cvedetails.com/cve/CVE-1999-1366/,,,1999-05-15,2016-10-18,3.6,None,Local,Low,Not required,Partial,Partial,None,"Pegasus e-mail client 3.0 and earlier uses weak encryption to store POP3 passwords in the pmail.ini file, which allows local users to easily decrypt the passwords and read e-mail.",{'https://marc.info/?l=bugtraq&m=92714118829880&w=2'}
CVE-1999-1365,https://www.cvedetails.com/cve/CVE-1999-1365/,,+Priv Bypass,1999-06-28,2017-10-26,7.2,None,Local,Low,Not required,Complete,Complete,Complete,"Windows NT searches a user's home directory (%systemroot% by default) before other directories to find critical programs such as NDDEAGNT.EXE, EXPLORER.EXE, USERINIT.EXE or TASKMGR.EXE, which could allow local users to bypass access restrictions or gain privileges by placing a Trojan horse program into the root directory, which is writable by default.","{'https://exchange.xforce.ibmcloud.com/vulnerabilities/2336', 'https://marc.info/?l=ntbugtraq&m=93069418400856&w=2', 'http://www.securityfocus.com/bid/515', 'https://marc.info/?l=ntbugtraq&m=93127894731200&w=2'}"
CVE-1999-1364,https://www.cvedetails.com/cve/CVE-1999-1364/,,DoS,1999-12-31,2008-09-05,2.1,None,Local,Low,Not required,None,None,Partial,Windows NT 4.0 allows local users to cause a denial of service (crash) via an illegal kernel mode address to the functions (1) GetThreadContext or (2) SetThreadContext.,"{'http://www.iss.net/security_center/static/7421.php', 'https://support.microsoft.com/support/kb/articles/q142/6/53.asp'}"
CVE-1999-1363,https://www.cvedetails.com/cve/CVE-1999-1363/,,DoS,1999-12-31,2008-09-05,2.1,None,Local,Low,Not required,None,None,Partial,"Windows NT 3.51 and 4.0 allow local users to cause a denial of service (crash) by running a program that creates a large number of locks on a file, which exhausts the NonPagedPool.","{'https://support.microsoft.com/support/kb/articles/q163/1/43.asp', 'http://www.iss.net/security_center/static/7405.php'}"
CVE-1999-1362,https://www.cvedetails.com/cve/CVE-1999-1362/,,DoS,1999-12-31,2008-09-05,2.1,None,Local,Low,Not required,None,None,Partial,Win32k.sys in Windows NT 4.0 before SP2 allows local users to cause a denial of service (crash) by calling certain WIN32K functions with incorrect parameters.,"{'https://support.microsoft.com/support/kb/articles/q160/6/01.asp', 'http://www.iss.net/security_center/static/7403.php'}"
CVE-1999-1360,https://www.cvedetails.com/cve/CVE-1999-1360/,,DoS,1999-12-31,2008-09-05,2.1,None,Local,Low,Not required,None,None,Partial,"Windows NT 4.0 allows local users to cause a denial of service via a user mode application that closes a handle that was opened in kernel mode, which causes a crash when the kernel attempts to close the handle.","{'http://www.iss.net/security_center/static/7402.php', 'https://support.microsoft.com/support/kb/articles/q160/6/50.asp'}"
CVE-1999-1359,https://www.cvedetails.com/cve/CVE-1999-1359/,,Bypass,1999-12-31,2008-09-05,7.5,None,Remote,Low,Not required,Partial,Partial,Partial,"When the Ntconfig.pol file is used on a server whose name is longer than 13 characters, Windows NT does not properly enforce policies for global groups, which could allow users to bypass restrictions that were intended by those policies.","{'http://www.iss.net/security_center/static/7401.php', 'https://support.microsoft.com/support/kb/articles/q163/8/75.asp'}"
CVE-1999-1358,https://www.cvedetails.com/cve/CVE-1999-1358/,,Bypass,1999-12-31,2008-09-05,4.6,None,Local,Low,Not required,Partial,Partial,Partial,"When an administrator in Windows NT or Windows 2000 changes a user policy, the policy is not properly updated if the local ntconfig.pol is not writable by the user, which could allow local users to bypass restrictions that would otherwise be enforced by the policy, possibly by changing the policy file to be read-only.","{'http://www.iss.net/security_center/static/7400.php', 'https://support.microsoft.com/support/kb/articles/q157/6/73.asp'}"
CVE-1999-1357,https://www.cvedetails.com/cve/CVE-1999-1357/,,XSS,1999-10-05,2016-10-18,7.5,None,Remote,Low,Not required,Partial,Partial,Partial,"Netscape Communicator 4.04 through 4.7 (and possibly other versions) in various UNIX operating systems converts the 0x8b character to a ""<"" sign, and the 0x9b character to a "">"" sign, which could allow remote attackers to attack other clients via cross-site scripting (CSS) in CGI programs that do not filter these characters.",{'https://marc.info/?l=bugtraq&m=93915331626185&w=2'}
CVE-1999-1356,https://www.cvedetails.com/cve/CVE-1999-1356/,,,1999-09-02,2016-10-18,4.6,None,Local,Low,Not required,Partial,Partial,Partial,"Compaq Integration Maintenance Utility as used in Compaq Insight Manager agent before SmartStart 4.50 modifies the legal notice caption (LegalNoticeCaption) and text (LegalNoticeText) in Windows NT, which could produce a legal notice that is in violation of the security policy.","{'https://marc.info/?l=ntbugtraq&m=93637792706047&w=2', 'http://www.iss.net/security_center/static/7763.php', 'https://marc.info/?l=bugtraq&m=93646669500991&w=2', 'https://marc.info/?l=ntbugtraq&m=93759822830815&w=2'}"
CVE-1999-1355,https://www.cvedetails.com/cve/CVE-1999-1355/,,,1999-12-31,2017-12-19,7.5,None,Remote,Low,Not required,Partial,Partial,Partial,"BMC Patrol component, when installed with Compaq Insight Management Agent 4.23 and earlier, or Management Agents for Servers 4.40 and earlier, creates a PFCUser account with a default password and potentially dangerous privileges.","{'https://www.compaq.com/products/servers/management/advisory.html', 'https://marc.info/?l=ntbugtraq&m=93759822430801&w=2', 'https://marc.info/?l=ntbugtraq&m=93542118727732&w=2', 'https://exchange.xforce.ibmcloud.com/vulnerabilities/3231', 'https://marc.info/?l=ntbugtraq&m=93654336516711&w=2', 'https://marc.info/?l=ntbugtraq&m=94183795025294&w=2'}"
CVE-1999-1354,https://www.cvedetails.com/cve/CVE-1999-1354/,,,1999-08-30,2016-10-18,4.6,None,Local,Low,Not required,Partial,Partial,Partial,"E-mail client in Softarc FirstClass Internet Server 5.506 and earlier stores usernames and passwords in cleartext in the files (1) home.fc for version 5.506, (2) network.fc for version 3.5, or (3) FCCLIENT.LOG when logging is enabled.","{'https://marc.info/?l=ntbugtraq&m=93698283309513&w=2', 'https://marc.info/?l=ntbugtraq&m=93637687305327&w=2'}"
