cve_id,cve_href,cwe_id,vuln_type,publish_date,update_date,score,acces_level,access,complexity,authentication,confidentiality,integrity,availability,summary,refs
CVE-1999-0700,https://www.cvedetails.com/cve/CVE-1999-0700/,CWE-119,Overflow,1999-07-29,2018-10-12,6.2,None,Local,High,Not required,Complete,Complete,Complete,"Buffer overflow in Microsoft Phone Dialer (dialer.exe), via a malformed dialer entry in the dialer.ini file.","{'https://support.microsoft.com/default.aspx?scid=kb;[LN];Q237185', 'https://docs.microsoft.com/en-us/security-updates/securitybulletins/1999/ms99-026'}"
CVE-1999-0698,https://www.cvedetails.com/cve/CVE-1999-0698/,,DoS,1999-01-01,2005-10-20,10.0,None,Remote,Low,Not required,Complete,Complete,Complete,Denial of service in IP protocol logger (ippl) on Red Hat and Debian Linux.,set()
CVE-1999-0697,https://www.cvedetails.com/cve/CVE-1999-0697/,,+Priv,1999-09-09,2008-09-09,7.2,None,Local,Low,Not required,Complete,Complete,Complete,SCO Doctor allows local users to gain root privileges through a Tools option.,{'http://www.securityfocus.com/bid/621'}
CVE-1999-0696,https://www.cvedetails.com/cve/CVE-1999-0696/,,Overflow,1999-07-01,2018-10-30,10.0,None,Remote,Low,Not required,Complete,Complete,Complete,Buffer overflow in CDE Calendar Manager Service Daemon (rpc.cmsd).,"{'http://www.ciac.org/ciac/bulletins/j-051.shtml', 'http://www1.itrc.hp.com/service/cki/docDisplay.do?docId=HPSBUX9908-102', 'http://sunsolve.sun.com/pub-cgi/retrieve.pl?doctype=coll&doc=secbull/188'}"
CVE-1999-0694,https://www.cvedetails.com/cve/CVE-1999-0694/,,DoS,1999-08-11,2008-09-09,2.1,None,Local,Low,Not required,None,None,Partial,Denial of service in AIX ptrace system call allows local users to crash the system.,{'http://www.ciac.org/ciac/bulletins/j-055.shtml'}
CVE-1999-0692,https://www.cvedetails.com/cve/CVE-1999-0692/,,+Priv,1999-07-19,2008-09-09,10.0,None,Remote,Low,Not required,Complete,Complete,Complete,"The default configuration of the Array Services daemon (arrayd) disables authentication, allowing remote users to gain root privileges.","{'http://www.ciac.org/ciac/bulletins/j-052.shtml', 'ftp://patches.sgi.com/support/free/security/advisories/19990701-01-P'}"
CVE-1999-0691,https://www.cvedetails.com/cve/CVE-1999-0691/,,Overflow +Priv,1999-09-13,2018-10-30,7.2,None,Local,Low,Not required,Complete,Complete,Complete,Buffer overflow in the AddSuLog function of the CDE dtaction utility allows local users to gain root privileges via a long user name.,"{'http://www1.itrc.hp.com/service/cki/docDisplay.do?docId=HPSBUX9909-103', 'https://oval.cisecurity.org/repository/search/definition/oval%3Aorg.mitre.oval%3Adef%3A3078', 'http://sunsolve.sun.com/pub-cgi/retrieve.pl?doctype=coll&doc=secbull/192', 'http://www.securityfocus.com/bid/635'}"
CVE-1999-0690,https://www.cvedetails.com/cve/CVE-1999-0690/,,,1999-07-01,2008-09-09,7.2,None,Local,Low,Not required,Complete,Complete,Complete,HP CDE program includes the current directory in root's PATH variable.,"{'http://www1.itrc.hp.com/service/cki/docDisplay.do?docId=HPSBUX9907-100', 'http://www.ciac.org/ciac/bulletins/j-053.shtml'}"
CVE-1999-0689,https://www.cvedetails.com/cve/CVE-1999-0689/,,Exec Code,1999-09-13,2018-10-30,7.2,None,Local,Low,Not required,Complete,Complete,Complete,The CDE dtspcd daemon allows local users to execute arbitrary commands via a symlink attack.,"{'https://oval.cisecurity.org/repository/search/definition/oval%3Aorg.mitre.oval%3Adef%3A1880', 'http://www1.itrc.hp.com/service/cki/docDisplay.do?docId=HPSBUX9909-103', 'http://www.securityfocus.com/bid/636', 'http://sunsolve.sun.com/pub-cgi/retrieve.pl?doctype=coll&doc=secbull/192'}"
CVE-1999-0688,https://www.cvedetails.com/cve/CVE-1999-0688/,,Overflow,1999-07-01,2008-09-09,4.6,None,Local,Low,Not required,Partial,Partial,Partial,Buffer overflows in HP Software Distributor (SD) for HPUX 10.x and 11.x.,"{'http://www.securityfocus.com/bid/545', 'http://www1.itrc.hp.com/service/cki/docDisplay.do?docId=HPSBUX9907-101'}"
CVE-1999-0687,https://www.cvedetails.com/cve/CVE-1999-0687/,,Exec Code,1999-09-13,2018-10-30,7.5,None,Remote,Low,Not required,Partial,Partial,Partial,"The ToolTalk ttsession daemon uses weak RPC authentication, which allows a remote attacker to execute commands.","{'http://www.securityfocus.com/bid/637', 'http://www1.itrc.hp.com/service/cki/docDisplay.do?docId=HPSBUX9909-103', 'http://www.ciac.org/ciac/bulletins/k-001.shtml', 'http://sunsolve.sun.com/pub-cgi/retrieve.pl?doctype=coll&doc=secbull/192'}"
CVE-1999-0686,https://www.cvedetails.com/cve/CVE-1999-0686/,,DoS,1999-05-07,2008-09-09,5.0,None,Remote,Low,Not required,None,None,Partial,Denial of service in Netscape Enterprise Server (NES) in HP Virtual Vault (VVOS) via a long URL.,"{'http://www.ciac.org/ciac/bulletins/j-046.shtml', 'http://www1.itrc.hp.com/service/cki/docDisplay.do?docId=HPSBUX9906-098'}"
CVE-1999-0685,https://www.cvedetails.com/cve/CVE-1999-0685/,,Overflow,1999-09-02,2008-09-09,5.1,None,Remote,High,Not required,Partial,Partial,Partial,Buffer overflow in Netscape Communicator via EMBED tags in the pluginspage option.,{'http://www.securityfocus.com/bid/618'}
CVE-1999-0684,https://www.cvedetails.com/cve/CVE-1999-0684/,,DoS,1999-04-19,2008-09-09,5.0,None,Remote,Low,Not required,None,None,Partial,Denial of service in Sendmail 8.8.6 in HPUX.,set()
CVE-1999-0683,https://www.cvedetails.com/cve/CVE-1999-0683/,,DoS,1999-07-30,2008-09-09,5.0,None,Remote,Low,Not required,None,None,Partial,Denial of service in Gauntlet Firewall via a malformed ICMP packet.,"{'http://www.osvdb.org/1029', 'http://www.securityfocus.com/bid/556'}"
CVE-1999-0682,https://www.cvedetails.com/cve/CVE-1999-0682/,,,1999-08-06,2020-04-02,5.0,None,Remote,Low,Not required,None,None,Partial,"Microsoft Exchange 5.5 allows a remote attacker to relay email (i.e. spam) using encapsulated SMTP addresses, even if the anti-relaying features are enabled.","{'https://docs.microsoft.com/en-us/security-updates/securitybulletins/1999/ms99-027', 'http://www.ciac.org/ciac/bulletins/j-056.shtml', 'https://support.microsoft.com/default.aspx?scid=kb;[LN];Q237927', 'http://www.securityfocus.com/bid/567'}"
CVE-1999-0680,https://www.cvedetails.com/cve/CVE-1999-0680/,CWE-287,DoS,1999-08-09,2018-10-12,5.0,None,Remote,Low,Not required,None,None,Partial,"Windows NT Terminal Server performs extra work when a client opens a new connection but before it is authenticated, allowing for a denial of service.","{'https://docs.microsoft.com/en-us/security-updates/securitybulletins/1999/ms99-028', 'http://www.securityfocus.com/bid/571', 'https://support.microsoft.com/default.aspx?scid=kb;[LN];Q238600', 'http://www.ciac.org/ciac/bulletins/j-057.shtml'}"
CVE-1999-0679,https://www.cvedetails.com/cve/CVE-1999-0679/,,Exec Code Overflow,1999-08-13,2008-09-09,7.5,None,Remote,Low,Not required,Partial,Partial,Partial,Buffer overflow in hybrid-6 IRC server commonly used on EFnet allows remote attackers to execute commands via m_invite invite option.,"{'http://www.efnet.org/archive/servers/hybrid/ChangeLog', 'http://www.securityfocus.com/bid/581'}"
CVE-1999-0678,https://www.cvedetails.com/cve/CVE-1999-0678/,,,1999-01-17,2020-10-13,5.0,None,Remote,Low,Not required,Partial,None,None,"A default configuration of Apache on Debian GNU/Linux sets the ServerRoot to /usr/doc, which allows remote users to read documentation files for the entire server.",{'http://www.securityfocus.com/bid/318'}
CVE-1999-0677,https://www.cvedetails.com/cve/CVE-1999-0677/,,,1999-08-03,2008-09-09,7.5,None,Remote,Low,Not required,Partial,Partial,Partial,The WebRamp web administration utility has a default password.,{'http://www.securityfocus.com/bid/577'}
CVE-1999-0676,https://www.cvedetails.com/cve/CVE-1999-0676/,,,1999-08-09,2018-10-30,4.6,None,Local,Low,Not required,Partial,Partial,Partial,sdtcm_convert in Solaris 2.6 allows a local user to overwrite sensitive files via a symlink attack.,"{'http://www.securityfocus.com/bid/575', 'http://www.securityfocus.com/templates/archive.pike?list=1&msg=19990809134220.A1191@hades.chaoz.org'}"
CVE-1999-0675,https://www.cvedetails.com/cve/CVE-1999-0675/,,DoS,1999-08-09,2008-09-09,5.0,None,Remote,Low,Not required,None,None,Partial,Check Point FireWall-1 can be subjected to a denial of service via UDP packets that are sent through VPN-1 to port 0 of a host.,"{'http://www.securityfocus.com/bid/576', 'http://www.osvdb.org/1038', 'http://www.securityfocus.com/archive/1/23615'}"
CVE-1999-0674,https://www.cvedetails.com/cve/CVE-1999-0674/,,,1999-08-09,2018-10-30,7.2,None,Local,Low,Not required,Complete,Complete,Complete,The BSD profil system call allows a local user to modify the internal data space of a program via profiling and execve.,"{'http://www.securityfocus.com/bid/570', 'http://www.ciac.org/ciac/bulletins/j-067.shtml'}"
CVE-1999-0673,https://www.cvedetails.com/cve/CVE-1999-0673/,,Overflow,1999-08-08,2008-09-09,5.1,None,Remote,High,Not required,Partial,Partial,Partial,Buffer overflow in ALMail32 POP3 client via From: or To: headers.,{'http://www.securityfocus.com/bid/574'}
CVE-1999-0672,https://www.cvedetails.com/cve/CVE-1999-0672/,,Overflow,1999-08-01,2008-09-09,5.1,None,Remote,High,Not required,Partial,Partial,Partial,Buffer overflow in Fujitsu Chocoa IRC client via IRC channel topics.,{'http://www.securityfocus.com/bid/573'}
CVE-1999-0671,https://www.cvedetails.com/cve/CVE-1999-0671/,,Overflow,1999-08-03,2008-09-09,5.1,None,Remote,High,Not required,Partial,Partial,Partial,Buffer overflow in ToxSoft NextFTP client through CWD command.,{'http://www.securityfocus.com/bid/572'}
CVE-1999-0670,https://www.cvedetails.com/cve/CVE-1999-0670/,,Exec Code Overflow,1999-09-01,2021-07-22,4.0,None,Remote,High,Not required,Partial,Partial,None,Buffer overflow in the Eyedog ActiveX control allows a remote attacker to execute arbitrary commands.,"{'http://ciac.llnl.gov/ciac/bulletins/j-064.shtml', 'https://docs.microsoft.com/en-us/security-updates/securitybulletins/1999/ms99-032'}"
CVE-1999-0669,https://www.cvedetails.com/cve/CVE-1999-0669/,,Exec Code,1999-09-01,2021-07-22,4.0,None,Remote,High,Not required,Partial,Partial,None,"The Eyedog ActiveX control is marked as ""safe for scripting"" for Internet Explorer, which allows a remote attacker to execute arbitrary commands as demonstrated by Bubbleboy.",{'http://ciac.llnl.gov/ciac/bulletins/j-064.shtml'}
CVE-1999-0668,https://www.cvedetails.com/cve/CVE-1999-0668/,,Exec Code,1999-08-21,2021-07-22,5.1,None,Remote,High,Not required,Partial,Partial,Partial,"The scriptlet.typelib ActiveX control is marked as ""safe for scripting"" for Internet Explorer, which allows a remote attacker to execute arbitrary commands as demonstrated by Bubbleboy.","{'http://www.securityfocus.com/bid/598', 'https://support.microsoft.com/default.aspx?scid=kb;[LN];Q240308', 'https://docs.microsoft.com/en-us/security-updates/securitybulletins/1999/ms99-032', 'http://ciac.llnl.gov/ciac/bulletins/j-064.shtml'}"
CVE-1999-0665,https://www.cvedetails.com/cve/CVE-1999-0665/,,,1999-01-01,2005-10-20,10.0,None,Remote,Low,Not required,Complete,Complete,Complete,An application-critical Windows NT registry key has an inappropriate value.,set()
CVE-1999-0664,https://www.cvedetails.com/cve/CVE-1999-0664/,,,1999-01-01,2005-10-20,10.0,None,Remote,Low,Not required,Complete,Complete,Complete,An application-critical Windows NT registry key has inappropriate permissions.,set()
CVE-1999-0663,https://www.cvedetails.com/cve/CVE-1999-0663/,,,1999-01-01,2005-10-20,10.0,None,Remote,Low,Not required,Complete,Complete,Complete,"A system-critical program, library, or file has a checksum or other integrity measurement that indicates that it has been modified.",set()
CVE-1999-0662,https://www.cvedetails.com/cve/CVE-1999-0662/,,,1999-01-01,2005-10-20,10.0,None,Remote,Low,Not required,Complete,Complete,Complete,"A system-critical program or library does not have the appropriate patch, hotfix, or service pack installed, or is outdated or obsolete.",set()
CVE-1999-0661,https://www.cvedetails.com/cve/CVE-1999-0661/,,,1999-01-01,2016-10-18,10.0,None,Remote,Low,Not required,Complete,Complete,Complete,"A system is running a version of software that was replaced with a Trojan Horse at one of its distribution points, such as (1) TCP Wrappers 7.6, (2) util-linux 2.9g, (3) wuarchive ftpd (wuftpd) 2.2 and 2.1f, (4) IRC client (ircII) ircII 2.2.9, (5) OpenSSH 3.4p1, or (6) Sendmail 8.12.6.","{'http://online.securityfocus.com/archive/1/294539', 'https://www.cert.org/advisories/CA-1999-02.html', 'http://www.iss.net/security_center/static/10313.php', 'https://www.cert.org/advisories/CA-2002-28.html', 'https://www.cert.org/advisories/CA-1999-01.html', 'https://www.cert.org/advisories/CA-1994-14.html', 'https://marc.info/?l=bugtraq&m=102821663814127&w=2', 'https://www.cert.org/advisories/CA-1994-07.html', 'https://marc.info/?l=bugtraq&m=102820843403741&w=2', 'http://www.securityfocus.com/bid/5921'}"
CVE-1999-0657,https://www.cvedetails.com/cve/CVE-1999-0657/,,,1999-01-01,2007-07-21,0.0,None,Remote,Low,Not required,None,None,None,WinGate is being used.,set()
CVE-1999-0656,https://www.cvedetails.com/cve/CVE-1999-0656/,CWE-16,,1999-01-01,2017-07-11,5.0,None,Remote,Low,Not required,Partial,None,None,"The ugidd RPC interface, by design, allows remote attackers to enumerate valid usernames by specifying arbitrary UIDs that ugidd maps to local user and group names.","{'https://exchange.xforce.ibmcloud.com/vulnerabilities/348', 'http://ca.com/au/securityadvisor/vulninfo/Vuln.aspx?ID=1638'}"
CVE-1999-0654,https://www.cvedetails.com/cve/CVE-1999-0654/,,,1999-01-01,2005-10-20,10.0,None,Remote,Low,Not required,Complete,Complete,Complete,The OS/2 or POSIX subsystem in NT is enabled.,set()
CVE-1999-0653,https://www.cvedetails.com/cve/CVE-1999-0653/,,,1999-01-01,2005-10-20,10.0,None,Remote,Low,Not required,Complete,Complete,Complete,A component service related to NIS+ is running.,set()
CVE-1999-0651,https://www.cvedetails.com/cve/CVE-1999-0651/,,,1999-01-01,2005-10-20,7.5,None,Remote,Low,Not required,Partial,Partial,Partial,The rsh/rlogin service is running.,set()
CVE-1999-0650,https://www.cvedetails.com/cve/CVE-1999-0650/,,,1999-01-01,2017-07-11,5.0,None,Remote,Low,Not required,Partial,None,None,"The netstat service is running, which provides sensitive information to remote attackers.",{'https://exchange.xforce.ibmcloud.com/vulnerabilities/72'}
CVE-1999-0641,https://www.cvedetails.com/cve/CVE-1999-0641/,,,1999-01-01,2007-07-13,0.0,None,Remote,Low,Not required,None,None,None,The UUCP service is running.,set()
CVE-1999-0640,https://www.cvedetails.com/cve/CVE-1999-0640/,,,1999-01-01,2005-10-20,10.0,None,Remote,Low,Not required,Complete,Complete,Complete,The Gopher service is running.,set()
CVE-1999-0639,https://www.cvedetails.com/cve/CVE-1999-0639/,,,1999-01-01,2007-07-13,0.0,None,Remote,Low,Not required,None,None,None,The chargen service is running.,set()
CVE-1999-0638,https://www.cvedetails.com/cve/CVE-1999-0638/,,,1999-01-01,2007-07-13,0.0,None,Remote,Low,Not required,None,None,None,The daytime service is running.,set()
CVE-1999-0637,https://www.cvedetails.com/cve/CVE-1999-0637/,,,1999-01-01,2007-07-13,0.0,None,Remote,Low,Not required,None,None,None,The systat service is running.,set()
CVE-1999-0636,https://www.cvedetails.com/cve/CVE-1999-0636/,,,1999-01-01,2005-10-20,10.0,None,Remote,Low,Not required,Complete,Complete,Complete,The discard service is running.,set()
CVE-1999-0635,https://www.cvedetails.com/cve/CVE-1999-0635/,,,1999-01-01,2007-07-13,0.0,None,Remote,Low,Not required,None,None,None,The echo service is running.,"{'https://secunia.com/advisories/18514', 'http://lists.grok.org.uk/pipermail/full-disclosure/2006-January/041434.html'}"
CVE-1999-0632,https://www.cvedetails.com/cve/CVE-1999-0632/,,,1999-01-01,2007-07-13,0.0,None,Remote,Low,Not required,None,None,None,The RPC portmapper service is running.,set()
CVE-1999-0630,https://www.cvedetails.com/cve/CVE-1999-0630/,,,1999-01-01,2005-10-20,10.0,None,Remote,Low,Not required,Complete,Complete,Complete,The NT Alerter and Messenger services are running.,set()
CVE-1999-0629,https://www.cvedetails.com/cve/CVE-1999-0629/,,,1999-01-01,2010-12-01,0.0,None,Remote,Low,Not required,None,None,None,The ident/identd service is running.,set()
CVE-1999-0625,https://www.cvedetails.com/cve/CVE-1999-0625/,,,1999-01-01,2007-07-13,0.0,None,Remote,Low,Not required,None,None,None,The rpc.rquotad service is running.,set()
CVE-1999-0624,https://www.cvedetails.com/cve/CVE-1999-0624/,,,1999-01-01,2007-07-13,0.0,None,Remote,Low,Not required,None,None,None,The rstat/rstatd service is running.,set()
CVE-1999-0618,https://www.cvedetails.com/cve/CVE-1999-0618/,,,1999-01-01,2005-10-20,10.0,None,Remote,Low,Not required,Complete,Complete,Complete,The rexec service is running.,set()
CVE-1999-0613,https://www.cvedetails.com/cve/CVE-1999-0613/,,,1999-01-01,2007-07-13,0.0,None,Remote,Low,Not required,None,None,None,The rpc.sprayd service is running.,set()
CVE-1999-0611,https://www.cvedetails.com/cve/CVE-1999-0611/,,,1999-01-01,2005-10-20,10.0,None,Remote,Low,Not required,Complete,Complete,Complete,A system-critical Windows NT registry key has an inappropriate value.,set()
CVE-1999-0610,https://www.cvedetails.com/cve/CVE-1999-0610/,,,1999-04-01,2016-10-18,5.0,None,Remote,Low,Not required,Partial,None,None,An incorrect configuration of the Webcart CGI program could disclose private information.,{'https://marc.info/?l=bugtraq&m=92462991805485&w=2'}
CVE-1999-0609,https://www.cvedetails.com/cve/CVE-1999-0609/,,,1999-04-01,2016-10-18,5.0,None,Remote,Low,Not required,Partial,None,None,"An incorrect configuration of the SoftCart CGI program ""SoftCart.exe"" could disclose private information.",{'https://marc.info/?l=bugtraq&m=92462991805485&w=2'}
CVE-1999-0608,https://www.cvedetails.com/cve/CVE-1999-0608/,,,1999-04-01,2017-10-10,5.0,None,Remote,Low,Not required,Partial,None,None,"An incorrect configuration of the PDG Shopping Cart CGI program ""shopper.cgi"" could disclose private information.","{'https://marc.info/?l=bugtraq&m=92462991805485&w=2', 'http://www.pdgsoft.com/Security/security.html.', 'https://exchange.xforce.ibmcloud.com/vulnerabilities/3857'}"
CVE-1999-0607,https://www.cvedetails.com/cve/CVE-1999-0607/,,+Priv,1999-04-20,2016-10-18,5.0,None,Remote,Low,Not required,Partial,None,None,"quikstore.cgi in QuikStore shopping cart stores quikstore.cfg under the web document root with insufficient access control, which allows remote attackers to obtain the cleartext administrator password and gain privileges.",{'https://marc.info/?l=bugtraq&m=92462991805485&w=2'}
CVE-1999-0606,https://www.cvedetails.com/cve/CVE-1999-0606/,CWE-200,+Info,1999-04-01,2016-10-18,5.0,None,Remote,Low,Not required,Partial,None,None,"An incorrect configuration of the EZMall 2000 shopping cart  CGI program ""mall2000.cgi"" could disclose private information.",{'https://marc.info/?l=bugtraq&m=92462991805485&w=2'}
CVE-1999-0605,https://www.cvedetails.com/cve/CVE-1999-0605/,CWE-200,+Info,1999-04-01,2016-10-18,5.0,None,Remote,Low,Not required,Partial,None,None,An incorrect configuration of the Order Form 1.0 shopping cart  CGI program could disclose private information.,{'https://marc.info/?l=bugtraq&m=92462991805485&w=2'}
CVE-1999-0604,https://www.cvedetails.com/cve/CVE-1999-0604/,,,1999-04-20,2016-10-18,5.0,None,Remote,Low,Not required,Partial,None,None,"An incorrect configuration of the WebStore 1.0 shopping cart CGI program ""web_store.cgi"" could disclose private information.",{'https://marc.info/?l=bugtraq&m=92462991805485&w=2'}
CVE-1999-0603,https://www.cvedetails.com/cve/CVE-1999-0603/,,,1999-01-01,2005-10-20,10.0,None,Remote,Low,Not required,Complete,Complete,Complete,"In Windows NT, an inappropriate user is a member of a group, e.g. Administrator, Backup Operators, Domain Admins, Domain Guests, Power Users, Print Operators, Replicators, System Operators, etc.",set()
CVE-1999-0602,https://www.cvedetails.com/cve/CVE-1999-0602/,,,1999-01-01,2005-10-20,10.0,None,Remote,Low,Not required,Complete,Complete,Complete,A network intrusion detection system (IDS) does not properly reassemble fragmented packets.,set()
CVE-1999-0601,https://www.cvedetails.com/cve/CVE-1999-0601/,,,1999-01-01,2005-10-20,10.0,None,Remote,Low,Not required,Complete,Complete,Complete,A network intrusion detection system (IDS) does not properly handle data within TCP handshake packets.,set()
CVE-1999-0600,https://www.cvedetails.com/cve/CVE-1999-0600/,,,1999-01-01,2005-10-20,10.0,None,Remote,Low,Not required,Complete,Complete,Complete,A network intrusion detection system (IDS) does not verify the checksum on a packet.,set()
CVE-1999-0599,https://www.cvedetails.com/cve/CVE-1999-0599/,,,1999-01-01,2005-10-20,10.0,None,Remote,Low,Not required,Complete,Complete,Complete,A network intrusion detection system (IDS) does not properly handle packets with improper sequence numbers.,set()
CVE-1999-0598,https://www.cvedetails.com/cve/CVE-1999-0598/,,,1999-01-01,2005-10-20,10.0,None,Remote,Low,Not required,Complete,Complete,Complete,"A network intrusion detection system (IDS) does not properly handle packets that are sent out of order, allowing an attacker to escape detection.",set()
CVE-1999-0597,https://www.cvedetails.com/cve/CVE-1999-0597/,,,1999-01-01,2005-10-20,10.0,None,Remote,Low,Not required,Complete,Complete,Complete,A Windows NT account policy does not forcibly disconnect remote users from the server when their logon hours expire.,set()
CVE-1999-0596,https://www.cvedetails.com/cve/CVE-1999-0596/,,,1999-01-01,2005-10-20,10.0,None,Remote,Low,Not required,Complete,Complete,Complete,A Windows NT log file has an inappropriate maximum size or retention period.,set()
CVE-1999-0594,https://www.cvedetails.com/cve/CVE-1999-0594/,,,1999-01-01,2005-10-20,10.0,None,Remote,Low,Not required,Complete,Complete,Complete,A Windows NT system does not restrict access to removable media drives such as a floppy disk drive or CDROM drive.,set()
CVE-1999-0593,https://www.cvedetails.com/cve/CVE-1999-0593/,,,1999-01-01,2017-07-11,4.9,None,Local,Low,Not required,None,None,Complete,The default setting for the Winlogon key entry ShutdownWithoutLogon in Windows NT allows users with physical access to shut down a Windows NT system without logging in.,"{'https://www.microsoft.com/technet/archive/winntas/deploy/confeat/06wntpcc.mspx?mfr=true', 'https://technet.microsoft.com/en-us/library/cc722469.aspx', 'https://exchange.xforce.ibmcloud.com/vulnerabilities/1291', 'http://osvdb.org/59333'}"
CVE-1999-0592,https://www.cvedetails.com/cve/CVE-1999-0592/,,,1999-01-01,2005-10-20,10.0,None,Remote,Low,Not required,Complete,Complete,Complete,The Logon box of a Windows NT system displays the name of the last user who logged in.,set()
CVE-1999-0591,https://www.cvedetails.com/cve/CVE-1999-0591/,,,1999-01-01,2005-10-20,10.0,None,Remote,Low,Not required,Complete,Complete,Complete,An event log in Windows NT has inappropriate access permissions.,set()
CVE-1999-0589,https://www.cvedetails.com/cve/CVE-1999-0589/,,,1999-01-01,2005-10-20,10.0,None,Remote,Low,Not required,Complete,Complete,Complete,A system-critical Windows NT registry key has inappropriate permissions.,set()
CVE-1999-0588,https://www.cvedetails.com/cve/CVE-1999-0588/,,,1999-01-01,2005-10-20,7.5,None,Remote,Low,Not required,Partial,Partial,Partial,A filter in a router or firewall allows unusual fragmented packets.,set()
CVE-1999-0587,https://www.cvedetails.com/cve/CVE-1999-0587/,,,1999-01-01,2005-10-20,10.0,None,Remote,Low,Not required,Complete,Complete,Complete,"A WWW server is not running in a restricted file system, e.g. through a chroot, thus allowing access to system-critical data.",set()
CVE-1999-0586,https://www.cvedetails.com/cve/CVE-1999-0586/,,,1999-01-01,2014-11-04,0.0,None,Remote,Low,Not required,None,None,None,A network service is running on a nonstandard port.,set()
CVE-1999-0584,https://www.cvedetails.com/cve/CVE-1999-0584/,,,1999-01-01,2005-10-20,10.0,None,Remote,Low,Not required,Complete,Complete,Complete,A Windows NT file system is not NTFS.,set()
CVE-1999-0583,https://www.cvedetails.com/cve/CVE-1999-0583/,,,1999-01-01,2005-10-20,10.0,None,Remote,Low,Not required,Complete,Complete,Complete,There is a one-way or two-way trust relationship between Windows NT domains.,set()
CVE-1999-0581,https://www.cvedetails.com/cve/CVE-1999-0581/,,,1999-01-01,2008-09-05,10.0,None,Remote,Low,Not required,Complete,Complete,Complete,"The HKEY_CLASSES_ROOT key in a Windows NT system has inappropriate, system-critical permissions.",set()
CVE-1999-0580,https://www.cvedetails.com/cve/CVE-1999-0580/,,,1999-01-01,2005-10-20,10.0,None,Remote,Low,Not required,Complete,Complete,Complete,"The HKEY_LOCAL_MACHINE key in a Windows NT system has inappropriate, system-critical permissions.",set()
CVE-1999-0579,https://www.cvedetails.com/cve/CVE-1999-0579/,,,1999-01-01,2008-09-05,10.0,None,Remote,Low,Not required,Complete,Complete,Complete,A Windows NT system's registry audit policy does not log an event success or failure for non-critical registry keys.,set()
CVE-1999-0578,https://www.cvedetails.com/cve/CVE-1999-0578/,,,1999-01-01,2008-09-05,4.6,None,Local,Low,Not required,Partial,Partial,Partial,A Windows NT system's registry audit policy does not log an event success or failure for security-critical registry keys.,set()
CVE-1999-0577,https://www.cvedetails.com/cve/CVE-1999-0577/,,,1999-01-01,2008-09-05,10.0,None,Remote,Low,Not required,Complete,Complete,Complete,A Windows NT system's file audit policy does not log an event success or failure for non-critical files or directories.,set()
CVE-1999-0571,https://www.cvedetails.com/cve/CVE-1999-0571/,,,1999-01-01,2005-10-20,10.0,None,Remote,Low,Not required,Complete,Complete,Complete,A router's configuration service or management interface (such as a web server or telnet) is configured to allow connections from arbitrary hosts.,set()
