cve_id,cve_href,cwe_id,vuln_type,publish_date,update_date,score,acces_level,access,complexity,authentication,confidentiality,integrity,availability,summary,refs
CVE-2001-0679,https://www.cvedetails.com/cve/CVE-2001-0679/,,Exec Code Overflow,1999-11-08,2017-12-19,10.0,None,Remote,Low,Not required,Complete,Complete,Complete,A buffer overflow in InterScan VirusWall 3.23 and 3.3 allows a remote attacker to execute arbitrary code by sending a long HELO command to the server.,"{'https://exchange.xforce.ibmcloud.com/vulnerabilities/3465', 'https://marc.info/?l=ntbugtraq&m=94216491202063&w=2', 'https://marc.info/?l=ntbugtraq&m=94208143007829&w=2', 'https://marc.info/?l=bugtraq&m=94204166130782&w=2', 'http://www.ntbugtraq.com/default.asp?pid=36&sid=1&A2=ind9911&L=NTBUGTRAQ&P=R2331'}"
CVE-2000-1206,https://www.cvedetails.com/cve/CVE-2000-1206/,,,1999-08-20,2021-06-06,5.0,None,Remote,Low,Not required,Partial,None,None,"Vulnerability in Apache httpd before 1.3.11, when configured for mass virtual hosting using mod_rewrite, or mod_vhost_alias in Apache 1.3.9, allows remote attackers to retrieve arbitrary files.","{'http://www.apacheweek.com/issues/00-01-07#status', 'https://lists.apache.org/thread.html/rf6449464fd8b7437704c55f88361b66f12d5b5f90bcce66af4be4ba9@%3Ccvs.httpd.apache.org%3E', 'https://lists.apache.org/thread.html/rf2f0f3611f937cf6cfb3b4fe4a67f69885855126110e1e3f2fb2728e@%3Ccvs.httpd.apache.org%3E', 'https://lists.apache.org/thread.html/rb9c9f42dafa25d2f669dac2a536a03f2575bc5ec1be6f480618aee10@%3Ccvs.httpd.apache.org%3E', 'https://lists.apache.org/thread.html/r9f93cf6dde308d42a9c807784e8102600d0397f5f834890708bf6920@%3Ccvs.httpd.apache.org%3E', 'https://lists.apache.org/thread.html/r5f9c22f9c28adbd9f00556059edc7b03a5d5bb71d4bb80257c0d34e4@%3Ccvs.httpd.apache.org%3E', 'https://lists.apache.org/thread.html/r5419c9ba0951ef73a655362403d12bb8d10fab38274deb3f005816f5@%3Ccvs.httpd.apache.org%3E'}"
CVE-2000-0531,https://www.cvedetails.com/cve/CVE-2000-0531/,,DoS,1999-11-23,2017-12-19,2.1,None,Local,Low,Not required,None,None,Partial,Linux gpm program allows local users to cause a denial of service by flooding the /dev/gpmctl device with STREAM sockets.,"{'https://exchange.xforce.ibmcloud.com/vulnerabilities/5010', 'http://www.securityfocus.com/templates/archive.pike?list=1&msg=Pine.LNX.4.10.10006201453090.1812-200000@apollo.aci.com.pl', 'http://www.securityfocus.com/bid/1377', 'http://archives.neohapsis.com/archives/bugtraq/2000-07/0409.html', 'https://www.redhat.com/support/errata/RHSA-2000-045.html'}"
CVE-2000-0489,https://www.cvedetails.com/cve/CVE-2000-0489/,,DoS,1999-09-05,2017-10-10,2.1,None,Local,Low,Not required,None,None,Partial,"FreeBSD, NetBSD, and OpenBSD allow an attacker to cause a denial of service by creating a large number of socket pairs using the socketpair function, setting a large buffer size via setsockopt, then writing large buffers.","{'http://www.securityfocus.com/templates/archive.pike?list=1&msg=NCBBKFKDOLAGKIAPMILPCEJLCEAA.labs@ussrback.com', 'http://www.securityfocus.com/bid/622', 'http://www.securityfocus.com/templates/archive.pike?list=1&msg=Pine.LNX.4.10.9908270039010.16315-100000@thetis.deor.org', 'https://exchange.xforce.ibmcloud.com/vulnerabilities/3298'}"
CVE-2000-0481,https://www.cvedetails.com/cve/CVE-2000-0481/,,DoS Overflow,1999-06-01,2017-10-10,5.0,None,Remote,Low,Not required,None,None,Partial,Buffer overflow in KDE Kmail allows a remote attacker to cause a denial of service via an attachment with a long file name.,"{'http://www.securityfocus.com/bid/1380', 'http://securityfocus.com/templates/archive.pike?list=82&date=2000-06-22&msg=00060200422401.01667@lez', 'https://exchange.xforce.ibmcloud.com/vulnerabilities/4993'}"
CVE-2000-0412,https://www.cvedetails.com/cve/CVE-2000-0412/,,,1999-05-01,2008-09-10,7.5,None,Remote,Low,Not required,Partial,Partial,Partial,"The gnapster and knapster clients for Napster do not properly restrict access only to MP3 files, which allows remote attackers to read arbitrary files from the client by specifying the full pathname for the file.","{'http://www.securityfocus.com/bid/1186', 'http://archives.neohapsis.com/archives/bugtraq/2000-05/0124.html', 'ftp://ftp.freebsd.org/pub/FreeBSD/CERT/advisories/FreeBSD-SA-00:18-gnapster.adv', 'http://archives.neohapsis.com/archives/bugtraq/2000-05/0127.html'}"
CVE-2000-0374,https://www.cvedetails.com/cve/CVE-2000-0374/,,Bypass +Info,1999-08-22,2017-10-10,10.0,None,Remote,Low,Not required,Complete,Complete,Complete,"The default configuration of kdm in Caldera and Mandrake Linux, and possibly other distributions, allows XDMCP connections from any host, which allows remote attackers to obtain sensitive information or bypass additional access restrictions.","{'https://exchange.xforce.ibmcloud.com/vulnerabilities/4856', 'http://frontal2.mandriva.com/security/advisories?name=MDKSA-2002:025', 'http://www.securityfocus.com/bid/1446', 'ftp://ftp.calderasystems.com/pub/OpenLinux/security/CSSA-1999-021.0.txt'}"
CVE-2000-0373,https://www.cvedetails.com/cve/CVE-2000-0373/,,+Priv,1999-06-01,2017-10-10,7.2,None,Local,Low,Not required,Complete,Complete,Complete,Vulnerabilities in the KDE kvt terminal program allow local users to gain root privileges.,"{'https://www.redhat.com/support/errata/RHSA1999015_01.html', 'https://exchange.xforce.ibmcloud.com/vulnerabilities/2266', 'ftp://ftp.calderasystems.com/pub/OpenLinux/security/CSSA-1999-015.0.txt'}"
CVE-2000-0371,https://www.cvedetails.com/cve/CVE-2000-0371/,,,1999-03-01,2008-09-10,1.2,None,Local,High,Not required,None,Partial,None,The libmediatool library used for the KDE mediatool allows local users to create arbitrary files via a symlink attack.,"{'ftp://ftp.calderasystems.com/pub/OpenLinux/security/CSSA-1999-005.0.txt', 'http://www.securityfocus.com/bid/1269'}"
CVE-2000-0370,https://www.cvedetails.com/cve/CVE-2000-0370/,,Exec Code,1999-01-29,2008-09-10,10.0,None,Remote,Low,Not required,Complete,Complete,Complete,The debug option in Caldera Linux smail allows remote attackers to execute commands via shell metacharacters in the -D option for the rmail command.,"{'http://www.securityfocus.com/bid/1268', 'ftp://ftp.calderasystems.com/pub/OpenLinux/security/CSSA-1999-001.0.txt'}"
CVE-2000-0369,https://www.cvedetails.com/cve/CVE-2000-0369/,,DoS,1999-10-08,2008-09-10,5.0,None,Remote,Low,Not required,None,None,Partial,"The IDENT server in Caldera Linux 2.3 creates multiple threads for each IDENT request, which allows remote attackers to cause a denial of service.","{'ftp://ftp.calderasystems.com/pub/OpenLinux/security/CSSA-1999-029.1.txt', 'http://www.securityfocus.com/bid/1266'}"
CVE-2000-0367,https://www.cvedetails.com/cve/CVE-2000-0367/,,+Priv,1999-02-18,2008-09-10,7.2,None,Local,Low,Not required,Complete,Complete,Complete,Vulnerability in eterm 0.8.8 in Debian GNU/Linux allows an attacker to gain root privileges.,{'https://www.debian.org/security/1999/19990218'}
CVE-2000-0366,https://www.cvedetails.com/cve/CVE-2000-0366/,,,1999-12-02,2008-09-10,2.1,None,Local,Low,Not required,None,Partial,None,"dump in Debian GNU/Linux 2.1 does not properly restore symlinks, which allows a local user to modify the ownership of arbitrary files.","{'http://www.securityfocus.com/bid/1442', 'https://www.debian.org/security/1999/19991202'}"
CVE-2000-0365,https://www.cvedetails.com/cve/CVE-2000-0365/,,,1999-06-01,2016-10-18,4.6,None,Local,Low,Not required,Partial,Partial,Partial,"Red Hat Linux 6.0 installs the /dev/pts file system with insecure modes, which allows local users to write to other tty devices.","{'https://www.redhat.com/corp/support/errata/RHSA1999014_01.html', 'https://marc.info/?l=bugtraq&m=92877527701347&w=2', 'http://www.securityfocus.com/bid/308', 'https://marc.info/?l=bugtraq&m=92886009012161&w=2'}"
CVE-2000-0364,https://www.cvedetails.com/cve/CVE-2000-0364/,,,1999-06-01,2016-10-18,4.6,None,Local,Low,Not required,Partial,Partial,Partial,"screen and rxvt in Red Hat Linux 6.0 do not properly set the modes of tty devices, which allows local users to write to other ttys.","{'https://www.redhat.com/corp/support/errata/RHSA1999014_01.html', 'http://www.securityfocus.com/bid/309', 'https://marc.info/?l=bugtraq&m=92877527701347&w=2', 'https://marc.info/?l=bugtraq&m=92886009012161&w=2'}"
CVE-2000-0363,https://www.cvedetails.com/cve/CVE-2000-0363/,,+Priv,1999-10-22,2008-09-10,6.2,None,Local,High,Not required,Complete,Complete,Complete,Linux cdwtools 093 and earlier allows local users to gain root privileges via the /tmp directory.,"{'http://www.novell.com/linux/security/advisories/suse_security_announce_25.html', 'http://www.securityfocus.com/bid/738'}"
CVE-2000-0362,https://www.cvedetails.com/cve/CVE-2000-0362/,,Overflow +Priv,1999-10-22,2008-09-10,7.2,None,Local,Low,Not required,Complete,Complete,Complete,Buffer overflows in Linux cdwtools 093 and earlier allows local users to gain root privileges.,"{'http://www.novell.com/linux/security/advisories/suse_security_announce_25.html', 'http://www.securityfocus.com/bid/738'}"
CVE-2000-0361,https://www.cvedetails.com/cve/CVE-2000-0361/,,,1999-12-14,2008-09-10,2.1,None,Local,Low,Not required,Partial,None,None,"The PPP wvdial.lxdialog script in wvdial 1.4 and earlier creates a .config file with world readable permissions, which allows a local attacker in the dialout group to access login and password information.",{'http://www.novell.com/linux/security/advisories/suse_security_announce_35.html'}
CVE-2000-0358,https://www.cvedetails.com/cve/CVE-2000-0358/,,,1999-12-03,2008-09-10,5.0,None,Remote,Low,Not required,None,None,Partial,ORBit and gnome-session in Red Hat Linux 6.1 allows remote attackers to crash a program.,{'https://www.redhat.com/corp/support/errata/RHSA1999058-01.html'}
CVE-2000-0357,https://www.cvedetails.com/cve/CVE-2000-0357/,,,1999-12-03,2008-09-10,7.5,None,Remote,Low,Not required,Partial,Partial,Partial,"ORBit and esound in Red Hat Linux 6.1 do not use sufficiently random numbers, which allows local users to guess the authentication keys.",{'https://www.redhat.com/corp/support/errata/RHSA1999058-01.html'}
CVE-2000-0356,https://www.cvedetails.com/cve/CVE-2000-0356/,,,1999-10-13,2008-09-10,4.6,None,Local,Low,Not required,Partial,Partial,Partial,Pluggable Authentication Modules (PAM) in Red Hat Linux 6.1 does not properly lock access to disabled NIS accounts.,"{'http://www.securityfocus.com/bid/697', 'http://www.securityfocus.com/templates/advisory.html?id=1789'}"
CVE-2000-0355,https://www.cvedetails.com/cve/CVE-2000-0355/,,,1999-08-21,2008-09-10,7.5,None,Remote,Low,Not required,Partial,Partial,Partial,pg and pb in SuSE pbpg 1.x package allows an attacker to read arbitrary files.,{'http://www.novell.com/linux/security/advisories/suse_security_announce_21.html'}
CVE-2000-0353,https://www.cvedetails.com/cve/CVE-2000-0353/,,Exec Code,1999-06-28,2008-09-10,10.0,None,Remote,Low,Not required,Complete,Complete,Complete,"Pine 4.x allows a remote attacker to execute arbitrary commands via an index.html file which executes lynx and obtains a uudecoded file from a malicious web server, which is then executed by Pine.","{'http://www.novell.com/linux/security/advisories/suse_security_announce_6.html', 'http://www.securityfocus.com/bid/1247', 'http://www.novell.com/linux/security/advisories/pine_update_announcement.html', 'http://www.securiteam.com/unixfocus/HHP-Pine_remote_exploit.html'}"
CVE-2000-0352,https://www.cvedetails.com/cve/CVE-2000-0352/,,Exec Code,1999-11-18,2008-09-10,10.0,None,Remote,Low,Not required,Complete,Complete,Complete,"Pine before version 4.21 does not properly filter shell metacharacters from URLs, which allows remote attackers to execute arbitrary commands via a malformed URL.","{'ftp://ftp.calderasystems.com/pub/OpenLinux/security/CSSA-1999-036.0.txt', 'http://www.securityfocus.com/templates/archive.pike?list=1&msg=Pine.LNX.4.10.9911171818220.12375-100000@ray.compu-aid.com', 'http://www.securityfocus.com/bid/810', 'http://www.novell.com/linux/security/advisories/suse_security_announce_36.html'}"
CVE-2000-0333,https://www.cvedetails.com/cve/CVE-2000-0333/,,DoS,1999-05-31,2008-09-10,5.0,None,Remote,Low,Not required,None,None,Partial,"tcpdump, Ethereal, and other sniffer packages allow remote attackers to cause a denial of service via malformed DNS packets in which a jump offset refers to itself, which causes tcpdump to enter an infinite loop while decompressing the packet.","{'http://www.securityfocus.com/bid/1165', 'http://www.securityfocus.com/templates/archive.pike?list=1&msg=Pine.SOL.4.10.10005021942380.2077-100000@paranoia.pgci.ca'}"
CVE-2000-0330,https://www.cvedetails.com/cve/CVE-2000-0330/,,Exec Code,1999-11-12,2018-10-12,7.6,None,Remote,High,Not required,Complete,Complete,Complete,"The networking software in Windows 95 and Windows 98 allows remote attackers to execute commands via a long file name string, aka the ""File Access URL"" vulnerability.",{'https://docs.microsoft.com/en-us/security-updates/securitybulletins/1999/ms99-049'}
CVE-2000-0329,https://www.cvedetails.com/cve/CVE-2000-0329/,,,1999-11-11,2021-07-22,5.1,None,Remote,High,Not required,Partial,Partial,Partial,"A Microsoft ActiveX control allows a remote attacker to execute a malicious cabinet file via an attachment and an embedded script in an HTML mail, aka the ""Active Setup Control"" vulnerability.",{'https://docs.microsoft.com/en-us/security-updates/securitybulletins/1999/ms99-048'}
CVE-2000-0328,https://www.cvedetails.com/cve/CVE-2000-0328/,,,1999-08-24,2018-10-12,5.0,None,Remote,Low,Not required,Partial,None,None,"Windows NT 4.0 generates predictable random TCP initial sequence numbers (ISN), which allows remote attackers to perform spoofing and session hijacking.","{'http://www.securityfocus.com/bid/604', 'https://docs.microsoft.com/en-us/security-updates/securitybulletins/1999/ms99-046', 'http://www.securityfocus.com/templates/archive.pike?list=1&msg=4.1.19990824165629.00abcb40@192.168.124.1'}"
CVE-2000-0327,https://www.cvedetails.com/cve/CVE-2000-0327/,,Exec Code,1999-10-21,2018-10-12,7.6,None,Remote,High,Not required,Complete,Complete,Complete,"Microsoft Virtual Machine (VM) allows remote attackers to escape the Java sandbox and execute commands via an applet containing an illegal cast operation, aka the ""Virtual Machine Verifier"" vulnerability.","{'https://docs.microsoft.com/en-us/security-updates/securitybulletins/1999/ms99-045', 'https://marc.info/?l=bugtraq&m=93993545118416&w=2'}"
CVE-2000-0325,https://www.cvedetails.com/cve/CVE-2000-0325/,,Exec Code,1999-08-20,2018-10-12,7.2,None,Local,Low,Not required,Complete,Complete,Complete,"The Microsoft Jet database engine allows an attacker to execute commands via a database query, aka the ""VBA Shell"" vulnerability.","{'https://exchange.xforce.ibmcloud.com/vulnerabilities/3155', 'https://docs.microsoft.com/en-us/security-updates/securitybulletins/1999/ms99-030', 'http://www.securityfocus.com/bid/548'}"
CVE-2000-0323,https://www.cvedetails.com/cve/CVE-2000-0323/,,,1999-07-28,2018-10-15,7.6,None,Remote,High,Not required,Complete,Complete,Complete,"The Microsoft Jet database engine allows an attacker to modify text files via a database query, aka the ""Text I-ISAM"" vulnerability.","{'http://www.securityfocus.com/templates/archive.pike?list=1&date=1999-08-22&msg=19990729195531.25108.qmail@underground.org', 'https://www.securityfocus.com/bid/595', 'https://docs.microsoft.com/en-us/security-updates/securitybulletins/1999/ms99-030', 'https://web.archive.org/web/20000819203059/http://xforce.iss.net:80/alerts/vol-4_num-7.php#jet-text-isam'}"
CVE-2000-0165,https://www.cvedetails.com/cve/CVE-2000-0165/,,Exec Code Overflow,1999-11-13,2018-05-03,7.5,None,Remote,Low,Not required,Partial,Partial,Partial,The Delegate application proxy has several buffer overflows which allow a remote attacker to execute commands.,"{'https://exchange.xforce.ibmcloud.com/vulnerabilities/4195', 'http://www.ciac.org/ciac/bulletins/k-023.shtml', 'http://www.securityfocus.com/templates/archive.pike?list=1&date=2000-02-15&msg=Pine.BSF.4.21.0002192249290.10784-100000@freefall.freebsd.org'}"
CVE-2000-0153,https://www.cvedetails.com/cve/CVE-2000-0153/,,,1999-03-26,2008-09-10,5.0,None,Remote,Low,Not required,Partial,None,None,FrontPage Personal Web Server (PWS) allows remote attackers to read files via a .... (dot dot) attack.,"{'http://www.securityfocus.com/bid/989', 'http://www.securityfocus.com/templates/archive.pike?list=1&date=2000-02-15&msg=000801bf780a$9ad4b2e0$0100007f@localhost'}"
CVE-2000-0139,https://www.cvedetails.com/cve/CVE-2000-0139/,,DoS,1999-12-03,2016-10-18,2.1,None,Local,Low,Not required,None,None,Partial,Internet Anywhere POP3 Mail Server allows local users to cause a denial of service via a malformed RETR command.,"{'https://marc.info/?l=bugtraq&m=95021326417936&w=2', 'http://www.securityfocus.com/bid/982'}"
CVE-2000-0119,https://www.cvedetails.com/cve/CVE-2000-0119/,,,1999-12-22,2016-10-18,7.2,None,Local,Low,Not required,Complete,Complete,Complete,"The default configurations for McAfee Virus Scan and Norton Anti-Virus virus checkers do not check files in the RECYCLED folder that is used by the Windows Recycle Bin utility, which allows attackers to store malicious code without detection.",{'https://marc.info/?l=bugtraq&m=94936267131123&w=2'}
CVE-2000-0118,https://www.cvedetails.com/cve/CVE-2000-0118/,,,1999-06-09,2018-10-30,7.2,None,Local,Low,Not required,Complete,Complete,Complete,"The Red Hat Linux su program does not log failed password guesses if the su process is killed before it times out, which allows local attackers to conduct brute force password guessing.",{'https://marc.info/?l=bugtraq&m=94935300520617&w=2'}
CVE-2000-0100,https://www.cvedetails.com/cve/CVE-2000-0100/,,+Priv,1999-12-29,2018-10-12,7.2,None,Local,Low,Not required,Complete,Complete,Complete,"The SMS Remote Control program is installed with insecure permissions, which allows local users to gain privileges by modifying or replacing the program.","{'http://archives.neohapsis.com/archives/ntbugtraq/current/0045.html', 'https://docs.microsoft.com/en-us/security-updates/securitybulletins/2000/ms00-012'}"
CVE-2000-0076,https://www.cvedetails.com/cve/CVE-2000-0076/,,,1999-12-30,2016-10-18,2.1,None,Local,Low,Not required,None,Partial,None,nviboot boot script in the Debian nvi package allows local users to delete files via malformed entries in vi.recover.,"{'https://marc.info/?l=bugtraq&m=94709988232618&w=2', 'http://www.securityfocus.com/bid/1439'}"
CVE-2000-0073,https://www.cvedetails.com/cve/CVE-2000-0073/,,DoS Overflow,1999-11-17,2018-10-12,5.0,None,Remote,Low,Not required,None,None,Partial,Buffer overflow in Microsoft Rich Text Format (RTF) reader allows attackers to cause a denial of service via a malformed control word.,"{'https://support.microsoft.com/default.aspx?scid=kb;[LN];Q249973', 'https://docs.microsoft.com/en-us/security-updates/securitybulletins/2000/ms00-005', 'http://xforce.iss.net/search.php3?type=2&pattern=win-malformed-rtf-control-word'}"
CVE-2000-0068,https://www.cvedetails.com/cve/CVE-2000-0068/,,,1999-12-14,2016-10-18,7.5,None,Remote,Low,Not required,Partial,Partial,Partial,"daynad program in Intel InBusiness E-mail Station does not require authentication, which allows remote attackers to modify its configuration, delete files, or read mail.",{'https://marc.info/?l=bugtraq&m=94704437920965&w=2'}
CVE-2000-0060,https://www.cvedetails.com/cve/CVE-2000-0060/,,DoS Overflow,1999-12-27,2016-10-18,5.0,None,Remote,Low,Not required,None,None,Partial,Buffer overflow in aVirt Rover POP3 server 1.1 allows remote attackers to cause a denial of service via a long user name.,"{'http://www.securityfocus.com/bid/894', 'https://marc.info/?l=bugtraq&m=94633851427858&w=2', 'http://www.iss.net/security_center/static/3765.php', 'https://marc.info/?l=ntbugtraq&m=94647711311057&w=2'}"
CVE-2000-0054,https://www.cvedetails.com/cve/CVE-2000-0054/,,,1999-01-03,2008-09-10,5.0,None,Remote,Low,Not required,Partial,None,None,search.cgi in the SolutionScripts Home Free package allows remote attackers to view directories via a .. (dot dot) attack.,{'http://www.securityfocus.com/bid/921'}
CVE-2000-0047,https://www.cvedetails.com/cve/CVE-2000-0047/,,DoS Overflow,1999-10-01,2008-09-10,5.0,None,Remote,Low,Not required,None,None,Partial,Buffer overflow in Yahoo Pager/Messenger client allows remote attackers to cause a denial of service via a long URL within a message.,set()
CVE-2000-0043,https://www.cvedetails.com/cve/CVE-2000-0043/,,Exec Code Overflow,1999-12-30,2008-09-10,7.5,None,Remote,Low,Not required,Partial,Partial,Partial,Buffer overflow in CamShot WebCam HTTP server allows remote attackers to execute commands via a long GET request.,{'http://www.securityfocus.com/bid/905'}
CVE-2000-0042,https://www.cvedetails.com/cve/CVE-2000-0042/,,DoS Exec Code Overflow,1999-12-29,2008-09-10,10.0,None,Remote,Low,Not required,Complete,Complete,Complete,Buffer overflow in CSM mail server allows remote attackers to cause a denial of service or execute commands via a long HELO command.,{'http://www.securityfocus.com/bid/895'}
CVE-2000-0041,https://www.cvedetails.com/cve/CVE-2000-0041/,,,1999-12-28,2008-09-10,5.0,None,Remote,Low,Not required,None,None,Partial,"Macintosh systems generate large ICMP datagrams in response to malformed datagrams, allowing them to be used as amplifiers in a flood attack.",{'http://www.securityfocus.com/bid/890'}
CVE-2000-0040,https://www.cvedetails.com/cve/CVE-2000-0040/,,+Priv,1999-12-23,2008-09-10,10.0,None,Remote,Low,Not required,Complete,Complete,Complete,glFtpD allows local users to gain privileges via metacharacters in the SITE ZIPCHK command.,set()
CVE-2000-0039,https://www.cvedetails.com/cve/CVE-2000-0039/,,,1999-12-29,2008-09-10,5.0,None,Remote,Low,Not required,Partial,None,None,AltaVista search engine allows remote attackers to read files above the document root via a .. (dot dot) in the query.cgi CGI program.,"{'http://www.osvdb.org/15', 'http://www.securityfocus.com/bid/896'}"
CVE-2000-0038,https://www.cvedetails.com/cve/CVE-2000-0038/,,,1999-12-23,2008-09-10,7.5,None,Remote,Low,Not required,Partial,Partial,Partial,glFtpD includes a default glftpd user account with a default password and a UID of 0.,set()
CVE-2000-0037,https://www.cvedetails.com/cve/CVE-2000-0037/,,+Priv,1999-12-28,2016-10-18,4.6,None,Local,Low,Not required,Partial,Partial,Partial,Majordomo wrapper allows local users to gain privileges by specifying an alternate configuration file.,"{'https://marc.info/?l=bugtraq&m=94780294009285&w=2', 'https://www.redhat.com/support/errata/RHSA-2000-005.html', 'http://www.securityfocus.com/bid/903'}"
CVE-2000-0036,https://www.cvedetails.com/cve/CVE-2000-0036/,,,1999-12-22,2018-10-12,5.0,None,Remote,Low,Not required,None,Partial,None,"Outlook Express 5 for Macintosh downloads attachments to HTML mail without prompting the user, aka the ""HTML Mail Attachment"" vulnerability.","{'https://support.microsoft.com/default.aspx?scid=kb;[LN];Q249082', 'https://docs.microsoft.com/en-us/security-updates/securitybulletins/1999/ms99-060'}"
CVE-2000-0035,https://www.cvedetails.com/cve/CVE-2000-0035/,,+Priv,1999-12-28,2016-10-18,4.6,None,Local,Low,Not required,Partial,Partial,Partial,resend command in Majordomo allows local users to gain privileges via shell metacharacters.,"{'https://marc.info/?l=bugtraq&m=94780294009285&w=2', 'http://www.securityfocus.com/bid/902'}"
CVE-2000-0034,https://www.cvedetails.com/cve/CVE-2000-0034/,,,1999-12-22,2008-09-10,5.0,None,Remote,Low,Not required,Partial,None,None,"Netscape 4.7 records user passwords in the preferences.js file during an IMAP or POP session, even if the user has not enabled ""remember passwords.""",set()
CVE-2000-0033,https://www.cvedetails.com/cve/CVE-2000-0033/,,,1999-12-27,2008-09-10,5.0,None,Remote,Low,Not required,None,Partial,None,InterScan VirusWall SMTP scanner does not properly scan messages with malformed attachments.,{'http://www.securityfocus.com/bid/899'}
CVE-2000-0032,https://www.cvedetails.com/cve/CVE-2000-0032/,,,1999-12-22,2018-10-30,10.0,None,Remote,Low,Not required,Complete,Complete,Complete,Solaris dmi_cmd allows local users to crash the dmispd daemon by adding a malformed file to the /var/dmi/db database.,"{'http://www.securityfocus.com/bid/878', 'http://www.osvdb.org/7582'}"
CVE-2000-0030,https://www.cvedetails.com/cve/CVE-2000-0030/,,,1999-12-22,2018-10-30,5.0,None,Remote,Low,Not required,None,None,Partial,Solaris dmispd dmi_cmd allows local users to fill up restricted disk space by adding files to the /var/dmi/db database.,{'http://www.securityfocus.com/bid/878'}
CVE-2000-0029,https://www.cvedetails.com/cve/CVE-2000-0029/,,+Priv,1999-12-27,2016-10-18,4.6,None,Local,Low,Not required,Partial,Partial,Partial,UnixWare pis and mkpis commands allow local users to gain privileges via a symlink attack.,"{'http://www.securityfocus.com/bid/901', 'https://marc.info/?l=bugtraq&m=94780294009285&w=2'}"
CVE-2000-0028,https://www.cvedetails.com/cve/CVE-2000-0028/,,Bypass,1999-12-23,2021-07-23,2.6,None,Remote,High,Not required,Partial,None,None,Internet Explorer 5.0 and 5.01 allows remote attackers to bypass the cross frame security policy and read files via the external.NavigateAndFind function.,set()
CVE-2000-0027,https://www.cvedetails.com/cve/CVE-2000-0027/,,+Priv,1999-12-27,2008-09-10,6.2,None,Local,High,Not required,Complete,Complete,Complete,IBM Network Station Manager NetStation allows local users to gain privileges via a symlink attack.,"{'http://www.iss.net/security_center/static/5381.php', 'http://www.securityfocus.com/archive/1/39962', 'http://www.securityfocus.com/bid/900'}"
