cve_id,cve_href,cwe_id,vuln_type,publish_date,update_date,score,acces_level,access,complexity,authentication,confidentiality,integrity,availability,summary,github,refs
CVE-2001-1145,https://www.cvedetails.com/cve/CVE-2001-1145/,,,2001-08-17,2008-09-10,6.2,Admin,Local,High,Not required,Complete,Complete,Complete,"fts routines in FreeBSD 4.3 and earlier, NetBSD before 1.5.2, and OpenBSD 2.9 and earlier can be forced to change (chdir) into a different directory than intended when the directory above the current directory is moved, which could cause scripts to perform dangerous actions on the wrong directories.",[],"['ftp://ftp.FreeBSD.org/pub/FreeBSD/CERT/advisories/FreeBSD-SA-01:40.fts.v1.1.asc', 'http://www.iss.net/security_center/static/8715.php', 'http://www.osvdb.org/5466', 'http://www.securityfocus.com/bid/3205', 'http://archives.neohapsis.com/archives/netbsd/2001-q3/0204.html', 'https://www.openbsd.org/errata28.html']"
CVE-2001-1144,https://www.cvedetails.com/cve/CVE-2001-1144/,,Dir. Trav.,2001-07-11,2013-08-17,5.0,None,Remote,Low,Not required,Partial,None,None,Directory traversal vulnerability in McAfee ASaP VirusScan agent 1.0 allows remote attackers to read arbitrary files via a .. (dot dot) in the HTTP request.,[],"['http://www.iss.net/security_center/static/6834.php', 'http://www.ntbugtraq.com/default.asp?pid=36&sid=1&A2=ind0107&L=ntbugtraq&F=P&S=&P=1558', 'https://www.kb.cert.org/vuls/id/190267', 'http://www.securityfocus.com/bid/3020', 'http://www.securityfocus.com/archive/1/196272', 'http://www.osvdb.org/584']"
CVE-2001-1143,https://www.cvedetails.com/cve/CVE-2001-1143/,,DoS,2001-07-11,2008-09-05,5.0,None,Remote,Low,Not required,None,None,None,"IBM DB2 7.0 allows a remote attacker to cause a denial of service (crash) via a single byte to (1) db2ccs.exe on port 6790, or (2) db2jds.exe on port 6789.",[],"['http://www.iss.net/security_center/static/6832.php', 'http://www.iss.net/security_center/static/6833.php', 'http://www.securityfocus.com/archive/1/196140', 'http://www.securityfocus.com/bid/3010']"
CVE-2001-1142,https://www.cvedetails.com/cve/CVE-2001-1142/,,+Priv,2001-07-12,2008-09-05,5.0,None,Remote,Low,Not required,Partial,None,None,"ArGoSoft FTP Server 1.2.2.2 uses weak encryption for user passwords, which allows an attacker with access to the password file to gain privileges.",[],"['http://www.iss.net/security_center/static/6848.php', 'http://www.securityfocus.com/bid/3029', 'http://www.securityfocus.com/archive/1/196968']"
CVE-2001-1141,https://www.cvedetails.com/cve/CVE-2001-1141/,,,2001-07-10,2017-10-09,5.0,None,Remote,Low,Not required,Partial,None,None,"The Pseudo-Random Number Generator (PRNG) in SSLeay and OpenSSL before 0.9.6b allows attackers to use the output of small PRNG requests to determine the internal state information, which could be used by attackers to predict future pseudo-random numbers.",[],"['http://www.securityfocus.com/archive/1/195829', 'https://exchange.xforce.ibmcloud.com/vulnerabilities/6823', 'https://www.redhat.com/support/errata/RHSA-2001-051.html', 'http://www.linux-mandrake.com/en/security/2001/MDKSA-2001-065.php3?dis=8.0', 'http://www.linuxsecurity.com/advisories/other_advisory-1483.html', 'http://www.securityfocus.com/advisories/3475', 'http://distro.conectiva.com.br/atualizacoes/?id=a&anuncio=000418', 'http://www.securityfocus.com/bid/3004', 'ftp://ftp.netbsd.org/pub/NetBSD/security/advisories/NetBSD-SA2001-013.txt.asc']"
CVE-2001-1140,https://www.cvedetails.com/cve/CVE-2001-1140/,,,2001-08-22,2017-12-18,5.0,None,Remote,Low,Not required,Partial,None,None,BadBlue Personal Edition v1.02 beta allows remote attackers to read source code for executable programs by appending a %00 (null byte) to the request.,[],"['https://exchange.xforce.ibmcloud.com/vulnerabilities/7021', 'http://www.securityfocus.com/archive/1/209545', 'http://www.securityfocus.com/bid/3222']"
CVE-2001-1139,https://www.cvedetails.com/cve/CVE-2001-1139/,,Dir. Trav.,2001-08-22,2008-09-05,5.0,None,Remote,Low,Not required,Partial,None,None,Directory traversal vulnerability in ASCII NT WinWrapper Professional allows remote attackers to read arbitrary files via a .. (dot dot) in the server request.,[],"['http://www.tsc.ant.co.jp/products/download.htm', 'http://www.iss.net/security_center/static/7015.php', 'http://www.securityfocus.com/bid/3219', 'http://www.securityfocus.com/archive/1/209414']"
CVE-2001-1138,https://www.cvedetails.com/cve/CVE-2001-1138/,,Exec Code Dir. Trav.,2001-09-07,2017-12-18,7.5,User,Remote,Low,Not required,Partial,Partial,Partial,Directory traversal vulnerability in r.pl (aka r.cgi) of Randy Parker Power Up HTML 0.8033beta allows remote attackers to read arbitrary files and possibly execute arbitrary code via a .. (dot dot) in the FILE parameter.,[],"['https://exchange.xforce.ibmcloud.com/vulnerabilities/7092', 'http://www.securityfocus.com/archive/1/212679', 'http://www.securityfocus.com/bid/3304']"
CVE-2001-1137,https://www.cvedetails.com/cve/CVE-2001-1137/,,DoS,2001-09-06,2017-12-18,5.0,None,Remote,Low,Not required,None,None,None,D-Link DI-704 Internet Gateway firmware earlier than V2.56b6 allows remote attackers to cause a denial of service (reboot) via malformed IP datagram fragments.,[],"['http://www.securityfocus.com/bid/3306', 'https://exchange.xforce.ibmcloud.com/vulnerabilities/7090', 'http://www.securityfocus.com/archive/1/212532']"
CVE-2001-1136,https://www.cvedetails.com/cve/CVE-2001-1136/,,DoS,2001-09-13,2017-12-18,2.1,None,Local,Low,Not required,None,None,None,The libsecurity library in HP-UX 11.04 (VVOS) allows attackers to cause a denial of service.,[],"['http://www.ciac.org/ciac/bulletins/l-143.shtml', 'http://www.securityfocus.com/bid/3338', 'https://exchange.xforce.ibmcloud.com/vulnerabilities/7124', 'http://archives.neohapsis.com/archives/hp/2001-q3/0063.html']"
CVE-2001-1135,https://www.cvedetails.com/cve/CVE-2001-1135/,,,2001-08-14,2017-12-18,7.5,User,Remote,Low,Not required,Partial,Partial,Partial,"ZyXEL Prestige 642R and 642R-I routers do not filter the routers' Telnet and FTP ports on the external WAN interface from inside access, allowing someone on an internal computer to reconfigure the router, if the password is known.",[],"['https://exchange.xforce.ibmcloud.com/vulnerabilities/7146', 'http://www.securityfocus.com/bid/3346', 'http://www.securityfocus.com/archive/1/203022', 'http://www.securityfocus.com/archive/1/203592', 'http://www.securityfocus.com/archive/1/204439', 'http://www.securityfocus.com/archive/1/214971']"
CVE-2001-1134,https://www.cvedetails.com/cve/CVE-2001-1134/,,DoS,2001-08-09,2008-09-10,5.0,None,Remote,Low,Not required,None,None,None,"Xerox DocuPrint N40 Printers allow remote attackers to cause a denial of service via malformed data, such as that produced by the Code Red worm.",[],"['http://www.securityfocus.com/archive/1/198381', 'http://www.securityfocus.com/archive/1/203025', 'http://www.iss.net/security_center/static/6976.php', 'http://www.securityfocus.com/bid/3170']"
CVE-2001-1133,https://www.cvedetails.com/cve/CVE-2001-1133/,,DoS,2001-08-21,2008-09-05,2.1,None,Local,Low,Not required,None,None,None,Vulnerability in a system call in BSDI 3.0 and 3.1 allows local users to cause a denial of service (reboot) in the kernel via a particular sequence of instructions.,[],"['http://www.iss.net/security_center/static/7023.php', 'http://www.securityfocus.com/archive/1/209192', 'http://www.securityfocus.com/bid/3220']"
CVE-2001-1132,https://www.cvedetails.com/cve/CVE-2001-1132/,,,2001-09-05,2017-10-09,7.5,User,Remote,Low,Not required,Partial,Partial,Partial,"Mailman 2.0.x before 2.0.6 allows remote attackers to gain access to list administrative pages when there is an empty site or list password, which is not properly handled during the call to the crypt function during authentication.",[],"['https://exchange.xforce.ibmcloud.com/vulnerabilities/7091', 'http://distro.conectiva.com.br/atualizacoes/?id=a&anuncio=000420']"
CVE-2001-1131,https://www.cvedetails.com/cve/CVE-2001-1131/,,Dir. Trav.,2001-08-21,2008-09-05,5.0,None,Remote,Low,Not required,Partial,None,None,Directory traversal vulnerability in WhitSoft Development SlimFTPd 2.2 allows an attacker to read arbitrary files and directories via a ... (modified dot dot) in the CD command.,[],['http://www.securiteam.com/windowsntfocus/5RP0L0055O.html']
CVE-2001-1130,https://www.cvedetails.com/cve/CVE-2001-1130/,,Exec Code,2001-08-02,2017-10-09,7.5,User,Remote,Low,Not required,Partial,Partial,Partial,"Sdbsearch.cgi in SuSE Linux 6.0-7.2 could allow remote attackers to execute arbitrary commands by uploading a keylist.txt file that contains filenames with shell metacharacters, then causing the file to be searched using a .. in the HTTP referer (from the HTTP_REFERER variable) to point to the directory that contains the keylist.txt file.",[],"['http://www.novell.com/linux/security/advisories/2001_027_sdb_txt.html', 'http://www.securityfocus.com/archive/1/201216', 'https://exchange.xforce.ibmcloud.com/vulnerabilities/7003']"
CVE-2001-1129,https://www.cvedetails.com/cve/CVE-2001-1129/,,Exec Code,2001-11-02,2017-12-18,7.2,Admin,Local,Low,Not required,Complete,Complete,Complete,"Format string vulnerabilities in (1) _probuild, (2) _dbutil, (3) _mprosrv, (4) _mprshut, (5) _proapsv, (6) _progres, (7) _proutil, (8) _rfutil and (9) prolib in Progress database 9.1C allows a local user to execute arbitrary code via format string specifiers in the file used by the PROMSGS environment variable.",[],"['https://exchange.xforce.ibmcloud.com/vulnerabilities/7457', 'http://www.securityfocus.com/archive/1/224395', 'http://www.securityfocus.com/bid/3502']"
CVE-2001-1128,https://www.cvedetails.com/cve/CVE-2001-1128/,,Exec Code Overflow,2001-10-08,2017-12-18,7.2,Admin,Local,Low,Not required,Complete,Complete,Complete,Buffer overflow in Progress database 8.3D and 9.1C allows local users to execute arbitrary code via long entries in files that are specified by the (1) PROMSGS or (2) PROTERMCAP environment variables.,[],"['https://exchange.xforce.ibmcloud.com/vulnerabilities/7264', 'http://www.securityfocus.com/archive/1/219174', 'http://www.securityfocus.com/bid/3414']"
CVE-2001-1127,https://www.cvedetails.com/cve/CVE-2001-1127/,,Exec Code Overflow,2001-10-05,2017-12-18,7.2,Admin,Local,Low,Not required,Complete,Complete,Complete,"Buffer overflow in Progress database 8.3D and 9.1C could allow a local user to execute arbitrary code via (1) _proapsv, (2) _mprosrv, (3) _mprshut, (4) orarx, (5) sqlcpp, (6) _probrkr, (7) _sqlschema and (8) _sqldump.",[],"['https://exchange.xforce.ibmcloud.com/vulnerabilities/7236', 'http://www.securityfocus.com/archive/1/218833', 'http://www.securityfocus.com/bid/3404']"
CVE-2001-1126,https://www.cvedetails.com/cve/CVE-2001-1126/,,DoS,2001-10-05,2017-12-18,5.0,None,Remote,Low,Not required,None,None,None,"Symantec LiveUpdate 1.4 through 1.6, and possibly later versions, allows remote attackers to cause a denial of service (flood) via DNS spoofing of the update.symantec.com site.",[],"['https://exchange.xforce.ibmcloud.com/vulnerabilities/7235', 'http://www.securityfocus.com/archive/1/218717', 'http://www.securityfocus.com/bid/3413', 'http://www.sarc.com/avcenter/security/Content/2001.10.05.html']"
CVE-2001-1125,https://www.cvedetails.com/cve/CVE-2001-1125/,,Exec Code,2001-10-05,2017-12-18,7.5,User,Remote,Low,Not required,Partial,Partial,Partial,"Symantec LiveUpdate before 1.6 does not use cryptography to ensure the integrity of download files, which allows remote attackers to execute arbitrary code via DNS spoofing of the update.symantec.com site.",[],"['https://exchange.xforce.ibmcloud.com/vulnerabilities/7235', 'http://www.sarc.com/avcenter/security/Content/2001.10.05.html', 'http://www.securityfocus.com/archive/1/218717', 'http://www.securityfocus.com/bid/3403']"
CVE-2001-1124,https://www.cvedetails.com/cve/CVE-2001-1124/,,DoS Overflow,2001-10-01,2017-12-18,5.0,None,Remote,Low,Not required,None,None,None,"rpcbind in HP-UX 11.00, 11.04 and 11.11 allows remote attackers to cause a denial of service (core dump) via a malformed RPC portmap requests, possibly related to a buffer overflow.",[],"['http://www.securityfocus.com/advisories/3586', 'http://www.securityfocus.com/bid/3400', 'https://exchange.xforce.ibmcloud.com/vulnerabilities/7221', 'http://www.ciac.org/ciac/bulletins/m-003.shtml']"
CVE-2001-1123,https://www.cvedetails.com/cve/CVE-2001-1123/,,Exec Code Overflow,2001-10-01,2017-12-18,7.2,Admin,Local,Low,Not required,Complete,Complete,Complete,"Vulnerability in Network Node Manager (NNM) 6.2 and earlier in HP OpenView allows a local user to execute arbitrary code, possibly via a buffer overflow in a long hostname or object ID.",[],"['https://exchange.xforce.ibmcloud.com/vulnerabilities/7222', 'http://www.securityfocus.com/advisories/3723', 'http://www.securityfocus.com/bid/3399', 'http://www.securityfocus.com/advisories/3585', 'https://www.kb.cert.org/vuls/id/782155']"
CVE-2001-1122,https://www.cvedetails.com/cve/CVE-2001-1122/,,DoS,2001-08-03,2017-12-18,2.1,None,Local,Low,Not required,None,None,None,Windows NT 4.0 SP 6a allows a local user with write access to winnt/system32 to cause a denial of service (crash in lsass.exe) by running the NT4ALL exploit program in 'SPECIAL' mode.,[],"['http://www.securityfocus.com/bid/3144', 'https://exchange.xforce.ibmcloud.com/vulnerabilities/6943', 'http://www.securityfocus.com/archive/1/201722']"
CVE-2001-1121,https://www.cvedetails.com/cve/CVE-2001-1121/,,,2001-07-02,2008-09-10,7.5,User,Remote,Low,Not required,Partial,Partial,Partial,DEPRECATED.  This entry has been deprecated.  It is a duplicate of CVE-2001-1084.,[],[]
CVE-2001-1120,https://www.cvedetails.com/cve/CVE-2001-1120/,,,2001-07-11,2017-12-18,6.4,None,Remote,Low,Not required,Partial,Partial,Partial,"Vulnerabilities in ColdFusion 2.0 through 4.5.1 SP 2 allow remote attackers to (1) read or delete arbitrary files, or (2) overwrite ColdFusion Server templates.",[],"['https://exchange.xforce.ibmcloud.com/vulnerabilities/6839', 'http://www.securityfocus.com/bid/3018', 'https://www.kb.cert.org/vuls/id/135531', 'http://www.securityfocus.com/archive/1/196452', 'http://www.allaire.com/handlers/index.cfm?id=21566']"
CVE-2001-1119,https://www.cvedetails.com/cve/CVE-2001-1119/,,,2001-08-03,2017-10-09,6.2,Admin,Local,High,Not required,Complete,Complete,Complete,cda in xmcd 3.0.2 and 2.6 in SuSE Linux allows local users to overwrite arbitrary files via a symlink attack.,[],"['http://www.securityfocus.com/bid/3148', 'https://exchange.xforce.ibmcloud.com/vulnerabilities/6941', 'http://www.novell.com/linux/security/advisories/2001_025_xmcd_txt.html', 'https://www.kb.cert.org/vuls/id/105347']"
CVE-2001-1118,https://www.cvedetails.com/cve/CVE-2001-1118/,,Exec Code,2001-08-02,2017-10-09,7.5,User,Remote,Low,Not required,Partial,Partial,Partial,"A module in Roxen 2.0 before 2.0.92, and 2.1 before 2.1.264, does not properly decode UTF-8, Mac and ISO-2202 encoded URLs, which could allow a remote attacker to execute arbitrary commands or view arbitrary files via an encoded URL.",[],"['http://www.securityfocus.com/bid/3145', 'https://exchange.xforce.ibmcloud.com/vulnerabilities/6937', 'http://download.roxen.com/2.0/patch/security-notice.html', 'http://www.securityfocus.com/archive/1/201499', 'http://www.securityfocus.com/archive/1/201476']"
CVE-2001-1117,https://www.cvedetails.com/cve/CVE-2001-1117/,,,2001-08-10,2017-10-09,5.0,None,Remote,Low,Not required,Partial,None,None,LinkSys EtherFast BEFSR41 Cable/DSL routers running firmware before 1.39.3 Beta allows a remote attacker to view administration and user passwords by connecting to the router and viewing the HTML source for (1) index.htm and (2) Password.htm.,[],"['http://www.securityfocus.com/archive/1/201390', 'https://exchange.xforce.ibmcloud.com/vulnerabilities/6949', 'http://www.securityfocus.com/bid/3141', 'http://www.securityfocus.com/archive/1/203302', 'ftp://ftp.linksys.com/pub/befsr41/befsr-fw1402.zip']"
CVE-2001-1116,https://www.cvedetails.com/cve/CVE-2001-1116/,,Bypass,2001-08-02,2017-10-09,4.6,User,Local,Low,Not required,Partial,Partial,Partial,"Identix BioLogon 2.03 and earlier does not lock secondary displays on a multi-monitor system running Windows 98 or ME, which allows an attacker with physical access to the system to bypass authentication through a secondary display.",[],"['https://exchange.xforce.ibmcloud.com/vulnerabilities/6948', 'http://ntbugtraq.ntadvice.com/default.asp?pid=36&sid=1&A2=IND0108&L=NTBUGTRAQ&F=P&S=&P=71', 'http://ntbugtraq.ntadvice.com/default.asp?pid=36&sid=1&A2=ind0108&L=ntbugtraq&F=P&S=&P=724', 'http://www.securityfocus.com/bid/3140']"
CVE-2001-1115,https://www.cvedetails.com/cve/CVE-2001-1115/,,,2001-08-13,2017-12-18,5.0,None,Remote,Low,Not required,Partial,None,None,generate.cgi in SIX-webboard 2.01 and before allows remote attackers to read arbitrary files via a dot dot (..) in the content parameter.,[],"['https://exchange.xforce.ibmcloud.com/vulnerabilities/6975', 'http://www.securityfocus.com/archive/1/204053', 'http://www.securityfocus.com/bid/3175']"
CVE-2001-1114,https://www.cvedetails.com/cve/CVE-2001-1114/,,Exec Code,2001-08-13,2017-12-18,7.5,User,Remote,Low,Not required,Partial,Partial,Partial,"book.cgi in NetCode NC Book 0.2b allows remote attackers to execute arbitrary commands via shell metacharacters in the ""current"" parameter.",[],"['https://exchange.xforce.ibmcloud.com/vulnerabilities/6986', 'http://www.securityfocus.com/bid/3178', 'http://www.securityfocus.com/archive/1/204094']"
CVE-2001-1113,https://www.cvedetails.com/cve/CVE-2001-1113/,,Exec Code Overflow,2001-08-13,2017-10-09,10.0,Admin,Remote,Low,Not required,Complete,Complete,Complete,"Buffer overflow in TrollFTPD 1.26 and earlier allows local users to execute arbitrary code by creating a series of deeply nested directories with long names, then running the ls -R (recursive) command.",[],"['https://exchange.xforce.ibmcloud.com/vulnerabilities/6974', 'http://www.securityfocus.com/bid/3174', 'ftp://ftp.trolltech.com/freebies/ftpd/troll-ftpd-1.27.tar.gz', 'http://www.securityfocus.com/archive/1/203874']"
CVE-2001-1112,https://www.cvedetails.com/cve/CVE-2001-1112/,,Exec Code Overflow,2001-09-12,2017-12-18,7.5,User,Remote,Low,Not required,Partial,Partial,Partial,Buffer overflow in EFTP 2.0.7.337 allows remote attackers to execute arbitrary code by uploading a .lnk file containing a large number of characters.,[],"['https://exchange.xforce.ibmcloud.com/vulnerabilities/7115', 'http://www.securityfocus.com/bid/3330', 'http://www.securityfocus.com/archive/1/213647']"
CVE-2001-1111,https://www.cvedetails.com/cve/CVE-2001-1111/,,,2001-09-12,2017-12-18,4.6,User,Local,Low,Not required,Partial,Partial,Partial,EFTP 2.0.7.337 stores user passwords in plaintext in the eftp2users.dat file.,[],"['http://www.securityfocus.com/archive/1/213647', 'http://www.securityfocus.com/bid/3332', 'https://exchange.xforce.ibmcloud.com/vulnerabilities/7116']"
CVE-2001-1110,https://www.cvedetails.com/cve/CVE-2001-1110/,,+Info,2001-09-12,2008-09-05,5.0,None,Remote,Low,Not required,Partial,None,None,"EFTP 2.0.7.337 allows remote attackers to obtain NETBIOS credentials by requesting information on a file that is in a network share, which causes the server to send the credentials to the host that owns the share, and allows the attacker to sniff the connection.",[],['http://www.securityfocus.com/archive/1/213647']
CVE-2001-1109,https://www.cvedetails.com/cve/CVE-2001-1109/,,Dir. Trav.,2001-09-12,2017-12-18,7.5,User,Remote,Low,Not required,Partial,Partial,Partial,"Directory traversal vulnerability in EFTP 2.0.7.337 allows remote authenticated users to reveal directory contents via a .. (dot dot) in the (1) LIST, (2) QUOTE SIZE, and (3) QUOTE MDTM commands.",[],"['http://www.securityfocus.com/bid/3331', 'http://www.securityfocus.com/bid/3333', 'https://exchange.xforce.ibmcloud.com/vulnerabilities/7113', 'https://exchange.xforce.ibmcloud.com/vulnerabilities/7114', 'http://www.securityfocus.com/archive/1/213647', 'http://www.eftp.org/releasehistory.html']"
CVE-2001-1108,https://www.cvedetails.com/cve/CVE-2001-1108/,,Dir. Trav.,2001-07-26,2017-10-09,7.5,User,Remote,Low,Not required,Partial,Partial,Partial,Directory traversal vulnerability in SnapStream PVS 1.2a allows remote attackers to read arbitrary files via a .. (dot dot) attack in the requested URL.,[],"['http://www.securityfocus.com/bid/3100', 'https://exchange.xforce.ibmcloud.com/vulnerabilities/6917', 'http://archives.neohapsis.com/archives/bugtraq/2001-07/0606.html', 'http://discuss.snapstream.com/ubb/Forum1/HTML/000216.html']"
CVE-2001-1107,https://www.cvedetails.com/cve/CVE-2001-1107/,,+Priv,2001-07-26,2017-12-18,5.0,None,Remote,Low,Not required,Partial,None,None,"SnapStream PVS 1.2a stores its passwords in plaintext in the file SSD.ini, which could allow a remote attacker to gain privileges on the server.",[],"['https://exchange.xforce.ibmcloud.com/vulnerabilities/6917', 'http://www.securityfocus.com/bid/3101', 'http://discuss.snapstream.com/ubb/Forum1/HTML/000216.html', 'http://archives.neohapsis.com/archives/bugtraq/2001-07/0606.html']"
CVE-2001-1106,https://www.cvedetails.com/cve/CVE-2001-1106/,,,2001-07-25,2017-10-09,7.5,User,Remote,Low,Not required,Partial,Partial,Partial,"The default configuration of Sambar Server 5 and earlier uses a symmetric key that is compiled into the binary program for encrypting passwords, which could allow local users to break all user passwords by cracking the key or modifying a copy of the sambar program to call the decryption procedure.",[],"['https://exchange.xforce.ibmcloud.com/vulnerabilities/6909', 'http://www.securityfocus.com/bid/3095', 'http://www.securityfocus.com/archive/1/199418']"
CVE-2001-1105,https://www.cvedetails.com/cve/CVE-2001-1105/,,Bypass,2001-09-12,2017-12-18,7.5,User,Remote,Low,Not required,Partial,Partial,Partial,"RSA BSAFE SSL-J 3.0, 3.0.1 and 3.1, as used in Cisco iCND 2.0, caches session IDs from failed login attempts, which could allow remote attackers to bypass SSL client authentication and gain access to sensitive data by logging in after an initial failure.",[],"['http://www.securityfocus.com/bid/3329', 'https://exchange.xforce.ibmcloud.com/vulnerabilities/7112', 'http://www.rsasecurity.com/products/bsafe/bulletins/BSAFE_SSL-J_3.x.SecurityBulletin.html', 'https://www.cisco.com/warp/public/707/SSL-J-pub.html', 'http://www.ciac.org/ciac/bulletins/l-141.shtml']"
CVE-2001-1104,https://www.cvedetails.com/cve/CVE-2001-1104/,,,2001-07-25,2008-09-05,7.5,User,Remote,Low,Not required,Partial,Partial,Partial,"SonicWALL SOHO uses easily predictable TCP sequence numbers, which allows remote attackers to spoof or hijack sessions.",[],"['http://www.securityfocus.com/bid/3098', 'http://www.securityfocus.com/archive/1/199632']"
CVE-2001-1103,https://www.cvedetails.com/cve/CVE-2001-1103/,,Exec Code,2001-03-03,2017-10-09,7.5,User,Remote,Low,Not required,Partial,Partial,Partial,"FTP Voyager ActiveX control before 8.0, when it is marked as safe for scripting (the default) or if allowed by the IObjectSafety interface, allows remote attackers to execute arbitrary commands.",[],"['https://www.kb.cert.org/vuls/id/320944', 'https://exchange.xforce.ibmcloud.com/vulnerabilities/7119']"
CVE-2001-1102,https://www.cvedetails.com/cve/CVE-2001-1102/,,,2001-09-08,2017-12-18,6.2,Admin,Local,High,Not required,Complete,Complete,Complete,"Check Point FireWall-1 3.0b through 4.1 for Solaris allows local users to overwrite arbitrary files via a symlink attack on temporary policy files that end in a .cpp extension, which are set world-writable.",[],"['https://exchange.xforce.ibmcloud.com/vulnerabilities/7094', 'http://www.securityfocus.com/archive/1/212824', 'http://www.securityfocus.com/bid/3300']"
CVE-2001-1101,https://www.cvedetails.com/cve/CVE-2001-1101/,,,2001-09-08,2017-12-18,6.4,None,Remote,Low,Not required,None,Partial,Partial,"The Log Viewer function in the Check Point FireWall-1 GUI for Solaris 3.0b through 4.1 SP2 does not check for the existence of '.log' files when saving files, which allows (1) remote authenticated users to overwrite arbitrary files ending in '.log', or (2) local users to overwrite arbitrary files via a symlink attack.",[],"['http://www.securityfocus.com/bid/3303', 'http://www.securityfocus.com/archive/1/212826', 'https://exchange.xforce.ibmcloud.com/vulnerabilities/7095']"
CVE-2001-1100,https://www.cvedetails.com/cve/CVE-2001-1100/,,Exec Code,2001-10-07,2017-10-09,7.5,User,Remote,Low,Not required,Partial,Partial,Partial,"sendmessage.cgi in W3Mail 1.0.2, and possibly other CGI programs, allows remote attackers to execute arbitrary commands via shell metacharacters in any field of the 'Compose Message' page.",[],"['http://www.w3mail.org/ChangeLog', 'http://www.securityfocus.com/bid/3673', 'http://www.securityfocus.com/archive/1/218921', 'https://exchange.xforce.ibmcloud.com/vulnerabilities/7230']"
CVE-2001-1099,https://www.cvedetails.com/cve/CVE-2001-1099/,,,2001-09-07,2017-10-09,5.0,None,Remote,Low,Not required,Partial,None,None,"The default configuration of Norton AntiVirus for Microsoft Exchange 2000 2.x allows remote attackers to identify the recipient's INBOX file path by sending an email with an attachment containing malicious content, which includes the path in the rejection notice.",[],"['https://exchange.xforce.ibmcloud.com/vulnerabilities/7093', 'http://www.securityfocus.com/archive/1/212724', 'http://www.securityfocus.com/bid/3305', 'http://www.securityfocus.com/archive/1/213762']"
