cve_id,cve_href,cwe_id,vuln_type,publish_date,update_date,score,acces_level,access,complexity,authentication,confidentiality,integrity,availability,summary,github,refs
CVE-2001-0716,https://www.cvedetails.com/cve/CVE-2001-0716/,,DoS,2001-12-06,2017-10-09,5.0,None,Remote,Low,Not required,None,None,None,"Citrix MetaFrame 1.8 Server with Service Pack 3, and XP Server Service Pack 1 and earlier, allows remote attackers to cause a denial of service (crash) via a large number of incomplete connections to the server.",[],"['https://exchange.xforce.ibmcloud.com/vulnerabilities/7068', 'http://www.securityfocus.com/bid/3440', 'http://xforce.iss.net/alerts/advise99.php']"
CVE-2001-0715,https://www.cvedetails.com/cve/CVE-2001-0715/,,+Info,2001-10-30,2008-09-05,2.1,None,Local,Low,Not required,Partial,None,None,"Sendmail before 8.12.1, without the RestrictQueueRun option enabled, allows local users to obtain potentially sensitive information about the mail queue by setting debugging flags to enable debug mode.",[],"['ftp://patches.sgi.com/support/free/security/advisories/20011101-01-I', 'http://razor.bindview.com/publish/advisories/adv_sm812.html']"
CVE-2001-0714,https://www.cvedetails.com/cve/CVE-2001-0714/,,DoS,2001-10-30,2008-09-05,2.1,None,Local,Low,Not required,None,None,None,"Sendmail before 8.12.1, without the RestrictQueueRun option enabled, allows local users to cause a denial of service (data loss) by (1) setting a high initial message hop count option (-h), which causes Sendmail to drop queue entries, (2) via the -qR option, or (3) via the -qS option.",[],"['ftp://patches.sgi.com/support/free/security/advisories/20011101-01-I', 'http://razor.bindview.com/publish/advisories/adv_sm812.html']"
CVE-2001-0713,https://www.cvedetails.com/cve/CVE-2001-0713/,,+Priv,2001-10-30,2008-09-05,4.6,None,Local,Low,Not required,Partial,Partial,Partial,"Sendmail before 8.12.1 does not properly drop privileges when the -C option is used to load custom configuration files, which allows local users to gain privileges via malformed arguments in the configuration file whose names contain characters with the high bit set, such as (1) macro names that are one character long, (2) a variable setting which is processed by the setoption function, or (3) a Modifiers setting which is processed by the getmodifiers function.",[],"['http://www.securityfocus.com/bid/3377', 'http://www.iss.net/security_center/static/7192.php', 'http://razor.bindview.com/publish/advisories/adv_sm812.html']"
CVE-2001-0712,https://www.cvedetails.com/cve/CVE-2001-0712/,,,2001-10-30,2008-09-05,7.5,None,Remote,Low,Not required,Partial,Partial,Partial,"The rendering engine in Internet Explorer determines the MIME type independently of the type that is specified by the server, which allows remote servers to automatically execute script which is placed in a file whose MIME type does not normally support scripting, such as text (.txt), JPEG (.jpg), etc.",[],"['http://www.securityfocus.com/archive/1/200109', 'http://www.securityfocus.com/archive/1/200291', 'http://www.securityfocus.com/bid/3116']"
CVE-2001-0711,https://www.cvedetails.com/cve/CVE-2001-0711/,,DoS,2001-08-31,2017-12-18,5.0,None,Remote,Low,Not required,None,None,None,Cisco IOS 11.x and 12.0 with ATM support allows attackers to cause a denial of service via the undocumented Interim Local Management Interface (ILMI) SNMP community string.,[],"['https://exchange.xforce.ibmcloud.com/vulnerabilities/6169', 'https://www.cisco.com/warp/public/707/ios-snmp-ilmi-vuln-pub.shtml']"
CVE-2001-0710,https://www.cvedetails.com/cve/CVE-2001-0710/,,DoS,2001-09-20,2017-10-09,5.0,None,Remote,Low,Not required,None,None,None,"NetBSD 1.5 and earlier and FreeBSD 4.3 and earlier allows a remote attacker to cause a denial of service by sending a large number of IP fragments to the machine, exhausting the mbuf pool.",[],"['https://exchange.xforce.ibmcloud.com/vulnerabilities/6636', 'http://www.securityfocus.com/bid/2799', 'ftp://ftp.netbsd.org/pub/NetBSD/security/advisories/NetBSD-SA2001-006.txt.asc', 'ftp://ftp.FreeBSD.org/pub/FreeBSD/CERT/advisories/FreeBSD-SA-01:52.fragment.asc']"
CVE-2001-0709,https://www.cvedetails.com/cve/CVE-2001-0709/,,,2001-09-20,2017-12-18,5.0,None,Remote,Low,Not required,Partial,None,None,"Microsoft IIS 4.0 and before, when installed on a FAT partition, allows a remote attacker to obtain source code of ASP files via a URL encoded with Unicode.",[],"['https://exchange.xforce.ibmcloud.com/vulnerabilities/6742', 'http://www.securityfocus.com/archive/1/192802', 'http://www.securityfocus.com/bid/2909']"
CVE-2001-0708,https://www.cvedetails.com/cve/CVE-2001-0708/,,DoS,2001-09-20,2017-12-18,5.0,None,Remote,Low,Not required,None,None,None,Denicomp REXECD 1.05 and earlier allows a remote attacker to cause a denial of service (crash) via a long string.,[],"['https://exchange.xforce.ibmcloud.com/vulnerabilities/6524', 'http://www.securityfocus.com/archive/1/183911']"
CVE-2001-0707,https://www.cvedetails.com/cve/CVE-2001-0707/,,DoS,2001-09-20,2017-12-18,5.0,None,Remote,Low,Not required,None,None,None,Denicomp RSHD 2.18 and earlier allows a remote attacker to cause a denial of service (crash) via a long string to port 514.,[],"['https://exchange.xforce.ibmcloud.com/vulnerabilities/6523', 'http://www.securityfocus.com/archive/1/183911']"
CVE-2001-0706,https://www.cvedetails.com/cve/CVE-2001-0706/,,DoS,2001-09-20,2017-10-09,2.1,None,Local,Low,Not required,None,None,None,Maximum Rumpus FTP Server 2.0.3 dev and before allows an attacker to cause a denial of service (crash) via a mkdir command that specifies a large number of sub-folders.,[],"['https://exchange.xforce.ibmcloud.com/vulnerabilities/6699', 'http://www.securityfocus.com/archive/1/190932', 'http://www.securityfocus.com/bid/2864']"
CVE-2001-0705,https://www.cvedetails.com/cve/CVE-2001-0705/,,Dir. Trav.,2001-09-20,2017-12-18,5.0,None,Remote,Low,Not required,Partial,None,None,"Directory traversal vulnerability in tradecli.dll in Arcadia Internet Store 1.0 allows a remote attacker to read arbitrary files on the web server via a URL with ""dot dot"" sequences in the template argument.",[],"['https://exchange.xforce.ibmcloud.com/vulnerabilities/6737', 'http://www.securityfocus.com/archive/1/192651', 'http://www.securityfocus.com/bid/2902']"
CVE-2001-0704,https://www.cvedetails.com/cve/CVE-2001-0704/,,,2001-09-20,2017-12-18,7.5,None,Remote,Low,Not required,Partial,Partial,Partial,tradecli.dll in Arcadia Internet Store 1.0 allows a remote attacker to discover the full path to the working directory via a URL with a template argument for a file that does not exist.,[],"['https://exchange.xforce.ibmcloud.com/vulnerabilities/6738', 'http://www.securityfocus.com/bid/2904', 'http://www.securityfocus.com/archive/1/192651']"
CVE-2001-0703,https://www.cvedetails.com/cve/CVE-2001-0703/,,DoS,2001-09-20,2017-12-18,5.0,None,Remote,Low,Not required,None,None,None,tradecli.dll in Arcadia Internet Store 1.0 allows a remote attacker to cause a denial of service via a URL request with an MS-DOS device name in the template parameter.,[],"['https://exchange.xforce.ibmcloud.com/vulnerabilities/6739', 'http://www.securityfocus.com/bid/2905', 'http://www.securityfocus.com/archive/1/192651']"
CVE-2001-0702,https://www.cvedetails.com/cve/CVE-2001-0702/,,DoS Exec Code,2001-09-20,2017-12-18,7.5,None,Remote,Low,Not required,Partial,Partial,Partial,"Cerberus FTP 1.5 and earlier allows remote attackers to cause a denial of service, and possibly execute arbitrary code, via a long (1) username, (2) password, or (3) PASV command.",[],"['https://exchange.xforce.ibmcloud.com/vulnerabilities/6728', 'http://archive.cert.uni-stuttgart.de/archive/bugtraq/2001/07/msg00070.html', 'http://www.securityfocus.com/bid/2901', 'http://www.securityfocus.com/archive/1/192655']"
CVE-2001-0701,https://www.cvedetails.com/cve/CVE-2001-0701/,,Overflow +Priv,2001-09-20,2018-05-02,7.2,Admin,Local,Low,Not required,Complete,Complete,Complete,Buffer overflow in ptexec in the Sun Validation Test Suite 4.3 and earlier allows a local user to gain privileges via a long -o argument.,[],"['https://exchange.xforce.ibmcloud.com/vulnerabilities/6736', 'http://www.securityfocus.com/archive/1/192667', 'http://www.securityfocus.com/bid/2898']"
CVE-2001-0700,https://www.cvedetails.com/cve/CVE-2001-0700/,,Exec Code Overflow,2001-09-20,2017-10-09,7.5,None,Remote,Low,Not required,Partial,Partial,Partial,Buffer overflow in w3m 0.2.1 and earlier allows a remote attacker to execute arbitrary code via a long base64 encoded MIME header.,[],"['http://distro.conectiva.com.br/atualizacoes/?id=a&anuncio=000434', 'http://mi.med.tohoku.ac.jp/~satodai/w3m-dev-en/200106.month/537.html', 'https://www.debian.org/security/2001/dsa-064', 'https://www.debian.org/security/2001/dsa-081', 'http://www.securityfocus.com/archive/1/192371', 'http://www.securityfocus.com/bid/2895', 'https://exchange.xforce.ibmcloud.com/vulnerabilities/6725']"
CVE-2001-0699,https://www.cvedetails.com/cve/CVE-2001-0699/,,Exec Code Overflow,2001-09-20,2018-10-30,7.2,Admin,Local,Low,Not required,Complete,Complete,Complete,Buffer overflow in cb_reset in the System Service Processor (SSP) package of SunOS 5.8 allows a local user to execute arbitrary code via a long argument.,[],"['https://exchange.xforce.ibmcloud.com/vulnerabilities/6726', 'http://www.securityfocus.com/bid/2893', 'http://www.securityfocus.com/archive/1/192299']"
CVE-2001-0698,https://www.cvedetails.com/cve/CVE-2001-0698/,,Dir. Trav.,2001-09-20,2017-10-09,5.0,None,Remote,Low,Not required,Partial,None,None,Directory traversal vulnerability in NetWin SurgeFTP 2.0a and 1.0b allows a remote attacker to list arbitrary files and directories via the 'nlist ...' command.,[],"['http://www.netwinsite.com/surgeftp/manual/updates.htm', 'http://www.securityfocus.com/archive/1/191916', 'http://www.securityfocus.com/bid/2892', 'https://exchange.xforce.ibmcloud.com/vulnerabilities/6711']"
CVE-2001-0697,https://www.cvedetails.com/cve/CVE-2001-0697/,,DoS,2001-09-20,2017-10-09,5.0,None,Remote,Low,Not required,None,None,None,NetWin SurgeFTP prior to 1.1h allows a remote attacker to cause a denial of service (crash) via an 'ls ..' command.,[],"['https://exchange.xforce.ibmcloud.com/vulnerabilities/6168', 'http://netwinsite.com/surgeftp/manual/updates.htm', 'http://www.securityfocus.com/bid/2442', 'http://www.securityfocus.com/archive/1/165816', 'http://www.secadministrator.com/Articles/Index.cfm?ArticleID=20200']"
CVE-2001-0696,https://www.cvedetails.com/cve/CVE-2001-0696/,,DoS,2001-09-20,2017-10-09,5.0,None,Remote,Low,Not required,None,None,None,NetWin SurgeFTP 2.0a and 1.0b allows a remote attacker to cause a denial of service (crash) via a CD command to a directory with an MS-DOS device name such as con.,[],"['https://exchange.xforce.ibmcloud.com/vulnerabilities/6712', 'http://www.securityfocus.com/bid/2891', 'http://www.securityfocus.com/archive/1/191916', 'http://netwinsite.com/surgeftp/manual/updates.htm']"
CVE-2001-0695,https://www.cvedetails.com/cve/CVE-2001-0695/,,DoS,2001-09-20,2017-12-18,5.0,None,Remote,Low,Not required,None,None,None,WFTPD 3.00 R5 allows a remote attacker to cause a denial of service by making repeated requests to cd to the floppy drive (A:\).,[],"['https://exchange.xforce.ibmcloud.com/vulnerabilities/6496', 'http://www.securityfocus.com/archive/1/182054']"
CVE-2001-0694,https://www.cvedetails.com/cve/CVE-2001-0694/,,Dir. Trav.,2001-09-20,2008-09-05,7.5,User,Remote,Low,Not required,Partial,Partial,Partial,Directory traversal vulnerability in WFTPD 3.00 R5 allows a remote attacker to view arbitrary files via a dot dot attack in the CD command.,[],['http://archives.neohapsis.com/archives/vuln-dev/2001-q2/0454.html']
CVE-2001-0693,https://www.cvedetails.com/cve/CVE-2001-0693/,,,2001-09-20,2017-12-18,5.0,None,Remote,Low,Not required,Partial,None,None,WebTrends HTTP Server 3.1c and 3.5 allows a remote attacker to view script source code via a filename followed by an encoded space (%20).,[],"['https://exchange.xforce.ibmcloud.com/vulnerabilities/6639', 'https://marc.info/?l=bugtraq&m=99166905208903&w=2', 'http://www.securityfocus.com/bid/2812']"
CVE-2001-0692,https://www.cvedetails.com/cve/CVE-2001-0692/,,Bypass,2001-09-20,2017-10-09,7.5,None,Remote,Low,Not required,Partial,Partial,Partial,SMTP proxy in WatchGuard Firebox (2500 and 4500) 4.5 and 4.6 allows a remote attacker to bypass firewall filtering via a base64 MIME encoded email attachment whose boundary name ends in two dashes.,[],"['https://exchange.xforce.ibmcloud.com/vulnerabilities/6682', 'http://www.securityfocus.com/bid/2855', 'https://marc.info/?l=bugtraq&m=99379787421319&w=2', 'http://www.securityfocus.com/archive/1/189783']"
CVE-2001-0691,https://www.cvedetails.com/cve/CVE-2001-0691/,,Exec Code Overflow,2001-09-20,2008-09-05,4.6,None,Local,Low,Not required,Partial,Partial,Partial,Buffer overflows in Washington University imapd 2000a through 2000c could allow local users without shell access to execute code as themselves in certain configurations.,[],"['http://www.iss.net/security_center/static/6269.php', 'https://www.redhat.com/support/errata/RHSA-2001-094.html', 'http://www.securityfocus.com/bid/2856', 'http://www.securityfocus.com/advisories/3352']"
CVE-2001-0690,https://www.cvedetails.com/cve/CVE-2001-0690/,,Exec Code,2001-09-20,2017-10-09,7.5,None,Remote,Low,Not required,Partial,Partial,Partial,"Format string vulnerability in exim (3.22-10 in Red Hat, 3.12 in Debian and 3.16 in Conectiva) in batched SMTP mode allows a remote attacker to execute arbitrary code via format strings in SMTP mail headers.",[],"['https://exchange.xforce.ibmcloud.com/vulnerabilities/6671', 'http://www.securityfocus.com/bid/2828', 'https://www.redhat.com/support/errata/RHSA-2001-078.html', 'https://www.debian.org/security/2001/dsa-058', 'http://distro.conectiva.com.br/atualizacoes/?id=a&anuncio=000402', 'http://archives.neohapsis.com/archives/bugtraq/2001-06/0041.html']"
CVE-2001-0689,https://www.cvedetails.com/cve/CVE-2001-0689/,,,2001-09-20,2008-09-05,7.5,None,Remote,Low,Not required,Partial,Partial,Partial,Vulnerability in TrendMicro Virus Control System 1.8 allows a remote attacker to view configuration files and change the configuration via a certain CGI program.,[],['http://archives.neohapsis.com/archives/bugtraq/2001-06/0065.html']
CVE-2001-0688,https://www.cvedetails.com/cve/CVE-2001-0688/,,DoS,2001-09-20,2008-09-05,5.0,None,Remote,Low,Not required,None,None,None,"Broker FTP Server 5.9.5.0 allows a remote attacker to cause a denial of service by repeatedly issuing an invalid CD or CWD (""CD . ."") command.",[],"['http://www.securityfocus.com/bid/2851', 'http://www.securityfocus.com/archive/1/190032']"
CVE-2001-0687,https://www.cvedetails.com/cve/CVE-2001-0687/,,,2001-09-20,2017-12-18,5.0,None,Remote,Low,Not required,Partial,None,None,"Broker FTP server 5.9.5 for Windows NT and 9x allows a remote attacker to retrieve privileged web server system information by (1) issuing a CD command (CD C:) followed by the LS command, (2) specifying arbitrary paths in the UNC format (\\computername\sharename).",[],"['https://exchange.xforce.ibmcloud.com/vulnerabilities/6674', 'http://www.securityfocus.com/archive/1/190032', 'http://www.securityfocus.com/bid/2853']"
CVE-2001-0686,https://www.cvedetails.com/cve/CVE-2001-0686/,,Overflow +Priv,2001-09-20,2018-05-02,4.6,None,Local,Low,Not required,Partial,Partial,Partial,Buffer overflow in mail included with SunOS 5.8 for x86 allows a local user to gain privileges via a long HOME environment variable.,[],"['https://exchange.xforce.ibmcloud.com/vulnerabilities/6638', 'http://www.securityfocus.com/bid/2819', 'http://archives.neohapsis.com/archives/bugtraq/2001-06/0000.html']"
CVE-2001-0685,https://www.cvedetails.com/cve/CVE-2001-0685/,,,2001-09-20,2017-10-09,2.6,None,Local,High,Not required,None,Partial,Partial,Thibault Godouet FCron prior to 1.1.1 allows a local user to corrupt another user's crontab file via a symlink attack on the fcrontab temporary file.,[],"['https://exchange.xforce.ibmcloud.com/vulnerabilities/7127', 'https://marc.info/?l=bugtraq&m=98339581702282&w=2', 'http://www.securityfocus.com/bid/2835', 'http://fcron.free.fr/CHANGES.html']"
CVE-2001-0684,https://www.cvedetails.com/cve/CVE-2001-0684/,,DoS,2001-09-20,2017-12-18,5.0,None,Remote,Low,Not required,None,None,None,Netscape Collabra Server 3.5.4 and earlier allows a remote attacker to cause a denial of service by sending seven or more characters to TCP port 5239.,[],"['http://www.securityfocus.com/archive/1/165516', 'https://exchange.xforce.ibmcloud.com/vulnerabilities/6159']"
CVE-2001-0683,https://www.cvedetails.com/cve/CVE-2001-0683/,,DoS,2001-09-20,2017-12-18,5.0,None,Remote,Low,Not required,None,None,None,Memory leak in Netscape Collabra Server 3.5.4 and earlier allows a remote attacker to cause a denial of service (memory exhaustion) by repeatedly sending approximately 5K of data to TCP port 5238.,[],"['http://www.securityfocus.com/archive/1/165516', 'https://exchange.xforce.ibmcloud.com/vulnerabilities/6158']"
CVE-2001-0682,https://www.cvedetails.com/cve/CVE-2001-0682/,,DoS,2001-08-29,2017-10-09,2.1,None,Local,Low,Not required,None,None,None,ZoneAlarm and ZoneAlarm Pro allows a local attacker to cause a denial of service by running a trojan to initialize a ZoneAlarm mutex object which prevents ZoneAlarm from starting.,[],"['https://exchange.xforce.ibmcloud.com/vulnerabilities/5821', 'https://marc.info/?l=ntbugtraq&m=97818917222992&w=2']"
CVE-2001-0681,https://www.cvedetails.com/cve/CVE-2001-0681/,,DoS Overflow,2001-09-20,2017-12-18,5.0,None,Remote,Low,Not required,None,None,None,Buffer overflow in ftpd in QPC QVT/Net 5.0 and QVT/Term 5.0 allows a remote attacker to cause a denial of service via a long (1) username or (2) password.,[],"['https://exchange.xforce.ibmcloud.com/vulnerabilities/6376', 'http://www.securityfocus.com/archive/1/176712']"
CVE-2001-0680,https://www.cvedetails.com/cve/CVE-2001-0680/,,Dir. Trav.,2001-09-20,2017-10-09,5.0,None,Remote,Low,Not required,Partial,None,None,"Directory traversal vulnerability in ftpd in QPC QVT/Net 4.0 and AVT/Term 5.0 allows a remote attacker to traverse directories on the web server via a ""dot dot"" attack in a LIST (ls) command.",[],"['https://exchange.xforce.ibmcloud.com/vulnerabilities/6375', 'http://www.securityfocus.com/archive/1/176712', 'http://www.securityfocus.com/bid/2618', 'http://online.securityfocus.com/archive/1/216555']"
CVE-2001-0678,https://www.cvedetails.com/cve/CVE-2001-0678/,,Exec Code Overflow,2001-09-20,2017-12-18,4.6,None,Local,Low,Not required,Partial,Partial,Partial,A buffer overflow in reggo.dll file used by Trend Micro InterScan VirusWall prior to 3.51 build 1349 for Windows NT 3.5 and InterScan WebManager 1.2 allows a local attacker to execute arbitrary code.,[],"['https://exchange.xforce.ibmcloud.com/vulnerabilities/6575', 'http://www.securityfocus.com/archive/1/185383']"
CVE-2001-0677,https://www.cvedetails.com/cve/CVE-2001-0677/,,,2001-09-20,2017-10-09,5.0,None,Remote,Low,Not required,Partial,None,None,"Eudora 5.0.2 allows a remote attacker to read arbitrary files via an email with the path of the target file in the ""Attachment Converted"" MIME header, which sends the file when the email is forwarded to the attacker by the user.",[],"['https://exchange.xforce.ibmcloud.com/vulnerabilities/6431', 'http://www.securityfocus.com/archive/1/177369', 'http://www.securityfocus.com/bid/2616']"
CVE-2001-0676,https://www.cvedetails.com/cve/CVE-2001-0676/,,Dir. Trav.,2001-09-20,2017-10-09,5.0,None,Remote,Low,Not required,None,Partial,Partial,"Directory traversal vulnerability in Rit Research Labs The Bat! 1.48f and earlier allows a remote attacker to create arbitrary files via a ""dot dot"" attack in the filename for an attachment.",[],"['https://exchange.xforce.ibmcloud.com/vulnerabilities/5871', 'http://www.securityfocus.com/archive/1/154359']"
CVE-2001-0675,https://www.cvedetails.com/cve/CVE-2001-0675/,,DoS,2001-09-20,2017-10-09,5.0,None,Remote,Low,Not required,None,None,None,Rit Research Labs The Bat! 1.51 for Windows allows a remote attacker to cause a denial of service by sending an email to a user's account containing a carriage return <CR> that is not followed by a line feed <LF>.,[],"['http://archives.neohapsis.com/archives/bugtraq/2001-04/0345.html', 'http://archives.neohapsis.com/archives/bugtraq/2001-04/0381.html', 'http://archives.neohapsis.com/archives/bugtraq/2001-04/0410.html', 'http://www.securityfocus.com/bid/2636', 'https://exchange.xforce.ibmcloud.com/vulnerabilities/6423']"
CVE-2001-0674,https://www.cvedetails.com/cve/CVE-2001-0674/,,Dir. Trav.,2001-09-20,2017-12-18,5.0,None,Remote,Low,Not required,Partial,None,None,Directory traversal vulnerability in RobTex Viking Web server before 1.07-381 allows remote attackers to read arbitrary files via a hexadecimal encoded dot-dot attack (eg. http://www.server.com/%2e%2e/%2e%2e) in an HTTP URL request.,[],"['https://exchange.xforce.ibmcloud.com/vulnerabilities/6394', 'https://www.robtex.com/viking/bugs.htm', 'http://www.securityfocus.com/archive/1/177231']"
CVE-2001-0671,https://www.cvedetails.com/cve/CVE-2001-0671/,,Overflow +Priv,2001-12-06,2008-09-05,10.0,Admin,Remote,Low,Not required,Complete,Complete,Complete,"Buffer overflows in (1) send_status, (2) kill_print, and (3) chk_fhost in lpd in AIX 4.3 and 5.1 allow remote attackers to gain root privileges.",[],"['https://www.cert.org/advisories/CA-2001-30.html', 'https://www.kb.cert.org/vuls/id/388183', 'https://www.kb.cert.org/vuls/id/466239', 'https://www.kb.cert.org/vuls/id/722143']"
CVE-2001-0670,https://www.cvedetails.com/cve/CVE-2001-0670/,,Exec Code Overflow,2001-10-03,2017-10-09,7.5,None,Remote,Low,Not required,Partial,Partial,Partial,Buffer overflow in BSD line printer daemon (in.lpd or lpd) in various BSD-based operating systems allows remote attackers to execute arbitrary code via an incomplete print job followed by a request to display the printer queue.,[],"['http://www.securityfocus.com/bid/3252', 'https://exchange.xforce.ibmcloud.com/vulnerabilities/7046', 'http://xforce.iss.net/alerts/advise94.php', 'https://www.redhat.com/support/errata/RHSA-2001-147.html', 'https://www.kb.cert.org/vuls/id/274043', 'http://www.openbsd.com/errata28.html', 'https://www.cert.org/advisories/CA-2001-30.html', 'ftp://stage.caldera.com/pub/security/openserver/CSSA-2001-SCO.20/CSSA-2001-SCO.20.txt', 'ftp://ftp.netbsd.org/pub/NetBSD/security/advisories/NetBSD-SA2001-018.txt.asc']"
CVE-2001-0669,https://www.cvedetails.com/cve/CVE-2001-0669/,,,2001-10-30,2016-10-17,7.5,None,Remote,Low,Not required,Partial,Partial,Partial,"Various Intrusion Detection Systems (IDS) including (1) Cisco Secure Intrusion Detection System, (2) Cisco Catalyst 6000 Intrusion Detection System Module, (3) Dragon Sensor 4.x, (4) Snort before 1.8.1, (5) ISS RealSecure Network Sensor 5.x and 6.x before XPU 3.2, and (6) ISS RealSecure Server Sensor 5.5 and 6.0 for Windows, allow remote attackers to evade detection of HTTP attacks via non-standard ""%u"" Unicode encoding of ASCII characters in the requested URL.",[],"['https://www.cisco.com/warp/public/707/cisco-intrusion-detection-obfuscation-vuln-pub.shtml', 'http://xforce.iss.net/alerts/advise95.php', 'https://www.kb.cert.org/vuls/id/548515', 'http://www.securityfocus.com/bid/3292', 'https://marc.info/?l=bugtraq&m=99972950200602&w=2']"
CVE-2001-0668,https://www.cvedetails.com/cve/CVE-2001-0668/,,Exec Code Overflow,2001-09-20,2017-10-09,7.5,None,Remote,Low,Not required,Partial,Partial,Partial,Buffer overflow in line printer daemon (rlpdaemon) in HP-UX 10.01 through 11.11 allows remote attackers to execute arbitrary commands.,[],"['http://xforce.iss.net/alerts/advise93.php', 'https://exchange.xforce.ibmcloud.com/vulnerabilities/6811', 'http://www.securityfocus.com/bid/3240', 'http://www.ciac.org/ciac/bulletins/l-134.shtml', 'https://www.kb.cert.org/vuls/id/966075', 'https://www.cert.org/advisories/CA-2001-30.html', 'http://archives.neohapsis.com/archives/hp/2001-q3/0047.html']"
CVE-2001-0667,https://www.cvedetails.com/cve/CVE-2001-0667/,,Exec Code,2001-10-30,2018-10-12,7.5,None,Remote,Low,Not required,Partial,Partial,Partial,"Internet Explorer 6 and earlier, when used with the Telnet client in Services for Unix (SFU) 2.0, allows remote attackers to execute commands by spawning Telnet with a log file option on the command line and writing arbitrary code into an executable file which is later executed, aka a new variant of the Telnet Invocation vulnerability as described in CVE-2001-0150.",[],"['https://exchange.xforce.ibmcloud.com/vulnerabilities/7260', 'https://docs.microsoft.com/en-us/security-updates/securitybulletins/2001/ms01-051', 'https://www.kb.cert.org/vuls/id/952611', 'http://www.ciac.org/ciac/bulletins/m-024.shtml']"
CVE-2001-0666,https://www.cvedetails.com/cve/CVE-2001-0666/,,DoS,2001-10-30,2018-10-12,2.1,None,Local,Low,Not required,None,None,None,Outlook Web Access (OWA) in Microsoft Exchange 2000 allows an authenticated user to cause a denial of service (CPU consumption) via a malformed OWA request for a deeply nested folder within the user's mailbox.,[],"['https://exchange.xforce.ibmcloud.com/vulnerabilities/7168', 'http://www.securityfocus.com/bid/3368', 'https://docs.microsoft.com/en-us/security-updates/securitybulletins/2001/ms01-049']"
