cve_id,cve_href,cwe_id,vuln_type,publish_date,update_date,score,acces_level,access,complexity,authentication,confidentiality,integrity,availability,summary,github,refs
CVE-2001-0315,https://www.cvedetails.com/cve/CVE-2001-0315/,,Bypass,2001-06-02,2017-12-18,7.5,None,Remote,Low,Not required,Partial,Partial,Partial,The locking feature in mIRC 5.7 allows local users to bypass the password mechanism by modifying the LockOptions registry key.,[],"['https://exchange.xforce.ibmcloud.com/vulnerabilities/6013', 'https://marc.info/?l=bugtraq&m=98053777917287&w=2']"
CVE-2001-0314,https://www.cvedetails.com/cve/CVE-2001-0314/,,DoS Exec Code Overflow,2001-06-02,2017-12-18,7.5,None,Remote,Low,Not required,Partial,Partial,Partial,"Buffer overflow in www.tol module in America Online (AOL) 5.0 may allow remote attackers to cause a denial of service, and possibly execute arbitrary commands, via a long URL in a link.",[],"['https://exchange.xforce.ibmcloud.com/vulnerabilities/6009', 'https://marc.info/?l=bugtraq&m=98053366805491&w=2']"
CVE-2001-0313,https://www.cvedetails.com/cve/CVE-2001-0313/,,DoS,2001-06-02,2017-12-18,5.0,None,Remote,Low,Not required,None,None,None,"Borderware Firewall Server 6.1.2 allows remote attackers to cause a denial of service via a ping to the broadcast address of the public network on which the server is placed, which causes the server to continuously send pings (echo requests) to the network.",[],"['https://exchange.xforce.ibmcloud.com/vulnerabilities/6004', 'https://marc.info/?l=bugtraq&m=98053139231392&w=2']"
CVE-2001-0312,https://www.cvedetails.com/cve/CVE-2001-0312/,,Bypass,2001-06-02,2008-09-05,5.0,None,Remote,Low,Not required,Partial,None,None,"IBM WebSphere plugin for Netscape Enterprise server allows remote attackers to read source code for JSP files via an HTTP request that contains a host header that references a host that is not in WebSphere's host aliases list, which will bypass WebSphere processing.",[],['http://archives.neohapsis.com/archives/bugtraq/2001-01/0446.html']
CVE-2001-0311,https://www.cvedetails.com/cve/CVE-2001-0311/,,,2001-06-02,2017-10-09,4.6,User,Local,Low,Not required,Partial,Partial,Partial,Vulnerability in OmniBackII A.03.50 in HP 11.x and earlier allows attackers to gain unauthorized access to an OmniBack client.,[],"['https://exchange.xforce.ibmcloud.com/vulnerabilities/6434', 'http://www1.itrc.hp.com/service/cki/docDisplay.do?docId=HPSBUX0102-142', 'http://archives.neohapsis.com/archives/hp/2001-q1/0023.html', 'http://archives.neohapsis.com/archives/hp/2001-q1/0022.html']"
CVE-2001-0310,https://www.cvedetails.com/cve/CVE-2001-0310/,,,2001-06-02,2017-10-09,2.1,None,Local,Low,Not required,None,None,None,"sort in FreeBSD 4.1.1 and earlier, and possibly other operating systems, uses predictable temporary file names and does not properly handle when the temporary file already exists, which causes sort to crash and possibly impacts security-sensitive scripts.",[],"['https://exchange.xforce.ibmcloud.com/vulnerabilities/6038', 'ftp://ftp.freebsd.org/pub/FreeBSD/CERT/advisories/FreeBSD-SA-01:13.sort.asc', 'http://www.securityfocus.com/bid/3960']"
CVE-2001-0309,https://www.cvedetails.com/cve/CVE-2001-0309/,,DoS,2001-06-02,2017-10-09,5.0,None,Remote,Low,Not required,None,None,None,"inetd in Red Hat 6.2 does not properly close sockets for internal services such as chargen, daytime, echo, etc., which allows remote attackers to cause a denial of service via a series of connections to the internal services.",[],"['https://www.redhat.com/support/errata/RHSA-2001-006.html', 'https://exchange.xforce.ibmcloud.com/vulnerabilities/6380']"
CVE-2001-0308,https://www.cvedetails.com/cve/CVE-2001-0308/,CWE-94,Exec Code,2001-05-03,2008-09-05,7.5,User,Remote,Low,Not required,Partial,Partial,Partial,"UploadServlet in Bajie HTTP JServer 0.78, and possibly other versions before 0.80, allows remote attackers to execute arbitrary commands by calling the servlet to upload a program, then using a ... (modified ..) to access the file that was created for the program.",[],"['http://archives.neohapsis.com/archives/bugtraq/2001-02/0314.html', 'http://www.securityfocus.com/bid/2388', 'http://www.geocities.com/gzhangx/websrv/docs/security.html']"
CVE-2001-0307,https://www.cvedetails.com/cve/CVE-2001-0307/,CWE-94,Exec Code,2001-05-03,2008-09-05,7.5,User,Remote,Low,Not required,Partial,Partial,Partial,"Bajie HTTP JServer 0.78, and other versions before 0.80, allows remote attackers to execute arbitrary commands via shell metacharacters in an HTTP request for a CGI program that does not exist.",[],"['http://www.geocities.com/gzhangx/websrv/docs/security.html', 'http://archives.neohapsis.com/archives/bugtraq/2001-02/0314.html']"
CVE-2001-0306,https://www.cvedetails.com/cve/CVE-2001-0306/,,Dir. Trav.,2001-05-03,2008-09-05,5.0,None,Remote,Low,Not required,Partial,None,None,Directory traversal vulnerability in ITAfrica WEBactive HTTP Server 1.00 allows remote attackers to read arbitrary files via a .. (dot dot) in a URL.,[],"['http://www.securityfocus.com/bid/2386', 'http://archives.neohapsis.com/archives/bugtraq/2001-02/0332.html']"
CVE-2001-0305,https://www.cvedetails.com/cve/CVE-2001-0305/,,Dir. Trav.,2001-05-03,2008-09-05,5.0,None,Remote,Low,Not required,Partial,None,None,Directory traversal vulnerability in store.cgi in Thinking Arts ES.One package allows remote attackers to read arbitrary files via a .. (dot dot) in the StartID parameter.,[],"['http://www.securityfocus.com/bid/2385', 'http://archives.neohapsis.com/archives/bugtraq/2001-02/0324.html']"
CVE-2001-0304,https://www.cvedetails.com/cve/CVE-2001-0304/,,Dir. Trav.,2001-05-03,2016-10-17,5.0,None,Remote,Low,Not required,Partial,None,None,"Directory traversal vulnerability in Caucho Resin 1.2.2 allows remote attackers to read arbitrary files via a ""\.."" (dot dot) in a URL request.",[],"['http://www.securityfocus.com/bid/2384', 'https://marc.info/?l=bugtraq&m=98229372610440&w=2']"
CVE-2001-0303,https://www.cvedetails.com/cve/CVE-2001-0303/,,,2001-05-03,2008-09-05,5.0,None,Remote,Low,Not required,Partial,None,None,tstisapi.dll in Pi3Web 1.0.1 web server allows remote attackers to determine the physical path of the server via a URL that requests a non-existent file.,[],"['http://www.securityfocus.com/bid/2381', 'http://archives.neohapsis.com/archives/bugtraq/2001-02/0316.html']"
CVE-2001-0302,https://www.cvedetails.com/cve/CVE-2001-0302/,,DoS Exec Code Overflow,2001-05-03,2008-09-05,5.0,None,Remote,Low,Not required,None,None,None,"Buffer overflow in tstisapi.dll in Pi3Web 1.0.1 web server allows remote attackers to cause a denial of service, and possibly execute arbitrary commands, via a long URL.",[],"['http://www.securityfocus.com/bid/2381', 'http://archives.neohapsis.com/archives/bugtraq/2001-02/0316.html']"
CVE-2001-0301,https://www.cvedetails.com/cve/CVE-2001-0301/,,Exec Code Overflow,2001-05-03,2017-10-09,10.0,Admin,Remote,Low,Not required,Complete,Complete,Complete,Buffer overflow in Analog before 4.16 allows remote attackers to execute arbitrary commands by using the ALIAS command to construct large strings.,[],"['http://www.securityfocus.com/bid/2377', 'https://www.debian.org/security/2001/dsa-033', 'http://archives.neohapsis.com/archives/bugtraq/2001-02/0264.html', 'http://archives.neohapsis.com/archives/linux/redhat/2001-q1/0056.html', 'http://www.analog.cx/security2.html', 'https://exchange.xforce.ibmcloud.com/vulnerabilities/6105']"
CVE-2001-0300,https://www.cvedetails.com/cve/CVE-2001-0300/,,,2001-06-02,2017-07-10,2.1,None,Local,Low,Not required,None,Partial,Partial,"oidldapd 2.1.1.1 in Oracle 8.1.7 records log files in a directory (ldaplog) that has world-writable permissions, which may allow local users to delete logs and/or overwrite other files via a symlink attack.",[],"['http://archives.neohapsis.com/archives/bugtraq/2000-12/0434.html', 'https://www.kb.cert.org/vuls/id/610904', 'https://exchange.xforce.ibmcloud.com/vulnerabilities/5804']"
CVE-2001-0299,https://www.cvedetails.com/cve/CVE-2001-0299/,,DoS Exec Code Overflow,2001-06-02,2017-10-09,7.5,None,Remote,Low,Not required,Partial,Partial,Partial,"Buffer overflow in Voyager web administration server for Nokia IP440 allows local users to cause a denial of service, and possibly execute arbitrary commands, via a long URL.",[],"['https://exchange.xforce.ibmcloud.com/vulnerabilities/5640', 'http://www.securityfocus.com/bid/2054', 'https://marc.info/?l=bugtraq&m=97603879517777&w=2', 'https://marc.info/?l=bugtraq&m=97535202912588&w=2']"
CVE-2001-0298,https://www.cvedetails.com/cve/CVE-2001-0298/,,DoS Exec Code Overflow,2001-05-03,2008-09-05,5.0,None,Remote,Low,Not required,None,None,None,"Buffer overflow in WebReflex 1.55 HTTPd allows remote attackers to cause a denial of service, and possibly execute arbitrary commands, via a long HTTP GET request.",[],"['http://www.securityfocus.com/archive/1/165671', 'http://www.securityfocus.com/bid/2425']"
CVE-2001-0297,https://www.cvedetails.com/cve/CVE-2001-0297/,,Dir. Trav.,2001-05-03,2008-09-05,5.0,None,Remote,Low,Not required,Partial,None,None,Directory traversal vulnerability in Simple Server HTTPd 1.0 (originally Free Java Server) allows remote attackers to read arbitrary files via a .. (dot dot) in the URL.,[],"['http://www.securityfocus.com/bid/2415', 'http://www.securityfocus.com/archive/1/165523']"
CVE-2001-0296,https://www.cvedetails.com/cve/CVE-2001-0296/,,Exec Code Overflow,2001-05-03,2008-09-05,10.0,Admin,Remote,Low,Not required,Complete,Complete,Complete,Buffer overflow in WFTPD Pro 3.00 allows remote attackers to execute arbitrary commands via a long CWD command.,[],['http://archives.neohapsis.com/archives/bugtraq/2001-02/0531.html']
CVE-2001-0295,https://www.cvedetails.com/cve/CVE-2001-0295/,,Dir. Trav.,2001-05-03,2016-10-17,5.0,None,Remote,Low,Not required,Partial,None,None,"Directory traversal vulnerability in War FTP 1.67.04 allows remote attackers to list directory contents and possibly read files via a ""dir *./../.."" command.",[],"['http://support.jgaa.com/?cmd=ShowArticle&ID=31', 'http://www.securityfocus.com/bid/2444', 'https://marc.info/?l=bugtraq&m=98390925726814&w=2']"
CVE-2001-0294,https://www.cvedetails.com/cve/CVE-2001-0294/,,Dir. Trav.,2001-05-03,2008-09-05,5.0,None,Remote,Low,Not required,Partial,None,None,"Directory traversal vulnerability in TYPSoft FTP Server 0.85 allows remote attackers to read arbitrary files via (1) a .. (dot dot) in a GET command, or (2) a ... in a CWD command.",[],['http://archives.neohapsis.com/archives/bugtraq/2001-02/0511.html']
CVE-2001-0293,https://www.cvedetails.com/cve/CVE-2001-0293/,,Dir. Trav.,2001-05-03,2008-09-05,5.0,None,Remote,Low,Not required,Partial,None,None,Directory traversal vulnerability in FtpXQ FTP server 2.0.93 allows remote attackers to read arbitrary files via a .. (dot dot) in the GET command.,[],"['http://www.securityfocus.com/bid/2426', 'http://archives.neohapsis.com/archives/bugtraq/2001-02/0508.html']"
CVE-2001-0292,https://www.cvedetails.com/cve/CVE-2001-0292/,,,2001-05-03,2008-09-05,7.5,User,Remote,Low,Not required,Partial,Partial,Partial,PHP-Nuke 4.4.1a allows remote attackers to modify a user's email address and obtain the password by guessing the user id (UID) and calling user.php with the saveuser operator.,[],['http://archives.neohapsis.com/archives/bugtraq/2001-02/0525.html']
CVE-2001-0291,https://www.cvedetails.com/cve/CVE-2001-0291/,,Exec Code Overflow,2001-05-03,2005-10-20,10.0,Admin,Remote,Low,Not required,Complete,Complete,Complete,Buffer overflow in post-query sample CGI program allows remote attackers to execute arbitrary commands via an HTTP POST request that contains at least 10001 parameters.,[],['http://archives.neohapsis.com/archives/bugtraq/2001-03/0003.html']
CVE-2001-0290,https://www.cvedetails.com/cve/CVE-2001-0290/,,,2001-05-03,2008-09-05,4.6,User,Local,Low,Not required,Partial,Partial,Partial,Vulnerability in Mailman 2.0.1 and earlier allows list administrators to obtain user passwords.,[],['http://archives.neohapsis.com/archives/bugtraq/2001-03/0031.html']
CVE-2001-0289,https://www.cvedetails.com/cve/CVE-2001-0289/,,+Priv,2001-05-03,2008-09-05,4.6,User,Local,Low,Not required,Partial,Partial,Partial,"Joe text editor 2.8 searches the current working directory (CWD) for the .joerc configuration file, which could allow local users to gain privileges of other users by placing a Trojan Horse .joerc file into a directory, then waiting for users to execute joe from that directory.",[],"['http://archives.neohapsis.com/archives/bugtraq/2001-02/0490.html', 'https://www.debian.org/security/2001/dsa-041', 'http://www.linux-mandrake.com/en/security/2001/MDKSA-2001-026.php3', 'https://www.redhat.com/support/errata/RHSA-2001-024.html']"
CVE-2001-0288,https://www.cvedetails.com/cve/CVE-2001-0288/,,,2001-05-03,2008-09-05,7.5,None,Remote,Low,Not required,Partial,Partial,Partial,"Cisco switches and routers running IOS 12.1 and earlier produce predictable TCP Initial Sequence Numbers (ISNs), which allows remote attackers to spoof or hijack TCP connections.",[],['https://www.cisco.com/warp/public/707/ios-tcp-isn-random-pub.shtml']
CVE-2001-0287,https://www.cvedetails.com/cve/CVE-2001-0287/,,DoS,2001-05-03,2008-09-05,2.1,None,Local,Low,Not required,None,None,None,VERITAS Cluster Server (VCS) 1.3.0 on Solaris allows local users to cause a denial of service (system panic) via the -L option to the lltstat command.,[],"['http://archives.neohapsis.com/archives/bugtraq/2001-02/0528.html', 'http://seer.support.veritas.com/docs/234326.htm', 'http://www.osvdb.org/6025']"
CVE-2001-0286,https://www.cvedetails.com/cve/CVE-2001-0286/,,Dir. Trav.,2001-05-03,2008-09-05,5.0,None,Remote,Low,Not required,Partial,None,None,Directory traversal vulnerability in A1 HTTP server 1.0a allows remote attackers to read arbitrary files via a .. (dot dot) in an HTTP GET request.,[],['http://archives.neohapsis.com/archives/bugtraq/2001-02/0457.html']
CVE-2001-0285,https://www.cvedetails.com/cve/CVE-2001-0285/,,DoS Exec Code Overflow,2001-05-03,2008-09-05,10.0,Admin,Remote,Low,Not required,Complete,Complete,Complete,Buffer overflow in A1 HTTP server 1.0a allows remote attackers to cause a denial of service and possibly execute arbitrary commands via a long HTTP request.,[],['http://archives.neohapsis.com/archives/bugtraq/2001-02/0457.html']
CVE-2001-0284,https://www.cvedetails.com/cve/CVE-2001-0284/,,DoS Exec Code Overflow,2001-05-03,2008-09-10,10.0,Admin,Remote,Low,Not required,Complete,Complete,Complete,Buffer overflow in IPSEC authentication mechanism for OpenBSD 2.8 and earlier allows remote attackers to cause a denial of service and possibly execute arbitrary commands via a malformed Authentication header (AH) IPv4 option.,[],"['http://www.osvdb.org/6026', 'https://www.openbsd.org/errata.html#ipsec_ah']"
CVE-2001-0283,https://www.cvedetails.com/cve/CVE-2001-0283/,,Dir. Trav.,2001-05-03,2008-09-05,6.4,None,Remote,Low,Not required,Partial,Partial,Partial,"Directory traversal vulnerability in SunFTP build 9 allows remote attackers to read arbitrary files via .. (dot dot) characters in various commands, including (1) GET, (2) MKDIR, (3) RMDIR, (4) RENAME, or (5) PUT.",[],['http://archives.neohapsis.com/archives/bugtraq/2001-02/0523.html']
CVE-2001-0282,https://www.cvedetails.com/cve/CVE-2001-0282/,,DoS Exec Code,2001-05-03,2008-09-10,10.0,Admin,Remote,Low,Not required,Complete,Complete,Complete,SEDUM 2.1 HTTP server allows remote attackers to cause a denial of service and possibly execute arbitrary commands via a long HTTP request.,[],['http://archives.neohapsis.com/archives/bugtraq/2001-02/0419.html']
CVE-2001-0281,https://www.cvedetails.com/cve/CVE-2001-0281/,,+Priv,2001-05-03,2008-09-05,7.2,Admin,Local,Low,Not required,Complete,Complete,Complete,"Format string vulnerability in DbgPrint function, used in debug messages for some Windows NT drivers (possibly when called through DebugMessage), may allow local users to gain privileges.",[],['http://archives.neohapsis.com/archives/bugtraq/2001-02/0379.html']
CVE-2001-0280,https://www.cvedetails.com/cve/CVE-2001-0280/,,Exec Code Overflow,2001-05-03,2017-10-09,10.0,Admin,Remote,Low,Not required,Complete,Complete,Complete,Buffer overflow in MERCUR SMTP server 3.30 allows remote attackers to execute arbitrary commands via a long EXPN command.,[],"['https://exchange.xforce.ibmcloud.com/vulnerabilities/6149', 'http://archives.neohapsis.com/archives/bugtraq/2001-02/0413.html']"
CVE-2001-0279,https://www.cvedetails.com/cve/CVE-2001-0279/,,Overflow +Priv,2001-05-03,2008-09-05,7.2,Admin,Local,Low,Not required,Complete,Complete,Complete,Buffer overflow in sudo earlier than 1.6.3p6 allows local users to gain root privileges.,[],"['http://archives.neohapsis.com/archives/bugtraq/2001-02/0437.html', 'http://distro.conectiva.com.br/atualizacoes/?id=a&anuncio=000381', 'https://www.redhat.com/support/errata/RHSA-2001-018.html', 'https://www.redhat.com/support/errata/RHSA-2001-019.html', 'http://archives.neohapsis.com/archives/bugtraq/2001-02/0414.html', 'https://www.debian.org/security/2001/dsa-031', 'http://www.linux-mandrake.com/en/security/2001/MDKSA-2001-024.php3', 'http://archives.neohapsis.com/archives/bugtraq/2001-02/0427.html']"
CVE-2001-0278,https://www.cvedetails.com/cve/CVE-2001-0278/,,+Priv,2001-05-03,2017-10-09,4.6,User,Local,Low,Not required,Partial,Partial,Partial,Vulnerability in linkeditor in HP MPE/iX 6.5 and earlier allows local users to gain privileges.,[],"['http://archives.neohapsis.com/archives/hp/2001-q1/0050.html', 'https://exchange.xforce.ibmcloud.com/vulnerabilities/6223']"
CVE-2001-0277,https://www.cvedetails.com/cve/CVE-2001-0277/,,DoS Exec Code Overflow,2001-05-03,2016-10-17,10.0,Admin,Remote,Low,Not required,Complete,Complete,Complete,Buffer overflow in ext.dll in BadBlue 1.02.07 Personal Edition allows remote attackers to cause a denial of service and possibly execute arbitrary commands via a long HTTP GET request.,[],"['http://www.securityfocus.com/bid/2392', 'https://marc.info/?l=bugtraq&m=98263019502565&w=2']"
CVE-2001-0276,https://www.cvedetails.com/cve/CVE-2001-0276/,,,2001-05-03,2017-10-09,6.4,None,Remote,Low,Not required,Partial,None,None,"ext.dll in BadBlue 1.02.07 Personal Edition web server allows remote attackers to determine the physical path of the server by directly calling ext.dll without any arguments, which produces an error message that contains the path.",[],"['https://exchange.xforce.ibmcloud.com/vulnerabilities/6130', 'https://marc.info/?l=bugtraq&m=98263019502565&w=2', 'http://www.badblue.com/p010219.htm', 'http://www.securityfocus.com/bid/2390']"
CVE-2001-0275,https://www.cvedetails.com/cve/CVE-2001-0275/,,DoS Exec Code,2001-05-03,2008-09-05,2.1,None,Local,Low,Not required,None,None,None,"Moby Netsuite Web Server 1.02 allows remote attackers to cause a denial of service, and possibly execute arbitrary commands, via a long HTTP request.",[],['http://archives.neohapsis.com/archives/bugtraq/2001-02/0346.html']
CVE-2001-0274,https://www.cvedetails.com/cve/CVE-2001-0274/,,Exec Code,2001-05-03,2017-10-09,7.5,User,Remote,Low,Not required,Partial,Partial,Partial,"kicq IRC client 1.0.0, and possibly later versions, allows remote attackers to execute arbitrary commands via shell metacharacters in a URL.",[],"['https://exchange.xforce.ibmcloud.com/vulnerabilities/6112', 'http://archives.neohapsis.com/archives/bugtraq/2001-02/0536.html', 'http://archives.neohapsis.com/archives/bugtraq/2001-02/0276.html']"
CVE-2001-0273,https://www.cvedetails.com/cve/CVE-2001-0273/,,,2001-05-03,2017-07-10,2.6,None,Remote,High,Not required,Partial,None,None,"pgp4pine Pine/PGP interface version 1.75-6 does not properly check to see if a public key has expired when obtaining the keys via Gnu Privacy Guard (GnuPG), which causes the message to be sent in cleartext.",[],"['http://www.securityfocus.com/bid/2405', 'https://exchange.xforce.ibmcloud.com/vulnerabilities/6135', 'https://www.kb.cert.org/vuls/id/566640', 'http://archives.neohapsis.com/archives/bugtraq/2001-02/0367.html']"
CVE-2001-0272,https://www.cvedetails.com/cve/CVE-2001-0272/,,Dir. Trav.,2001-05-03,2008-09-05,5.0,None,Remote,Low,Not required,Partial,None,None,Directory traversal vulnerability in sendtemp.pl in W3.org Anaya Web development server allows remote attackers to read arbitrary files via a .. (dot dot) attack in the templ parameter.,[],['http://archives.neohapsis.com/archives/bugtraq/2001-02/0259.html']
CVE-2001-0271,https://www.cvedetails.com/cve/CVE-2001-0271/,,Exec Code,2001-05-03,2008-09-05,10.0,Admin,Remote,Low,Not required,Complete,Complete,Complete,mailnews.cgi 1.3 and earlier allows remote attackers to execute arbitrary commands via a user name that contains shell metacharacters.,[],"['http://www.securityfocus.com/bid/2391', 'http://archives.neohapsis.com/archives/bugtraq/2001-02/0347.html']"
CVE-2001-0270,https://www.cvedetails.com/cve/CVE-2001-0270/,,DoS,2001-05-03,2008-09-05,5.0,None,Remote,Low,Not required,None,None,None,Marconi ASX-1000 ASX switches allow remote attackers to cause a denial of service in the telnet and web management interfaces via a malformed packet with the SYN-FIN and More Fragments attributes set.,[],"['http://www.securityfocus.com/bid/2400', 'http://archives.neohapsis.com/archives/bugtraq/2001-02/0349.html']"
CVE-2001-0269,https://www.cvedetails.com/cve/CVE-2001-0269/,,Bypass,2001-05-03,2018-10-30,10.0,Admin,Remote,Low,Not required,Complete,Complete,Complete,pam_ldap authentication module in Solaris 8 allows remote attackers to bypass authentication via a NULL password.,[],"['https://exchange.xforce.ibmcloud.com/vulnerabilities/6440', 'http://archives.neohapsis.com/archives/bugtraq/2001-02/0344.html']"
CVE-2001-0268,https://www.cvedetails.com/cve/CVE-2001-0268/,,+Priv,2001-05-03,2017-10-09,7.2,Admin,Local,Low,Not required,Complete,Complete,Complete,"The i386_set_ldt system call in NetBSD 1.5 and earlier, and OpenBSD 2.8 and earlier, when the USER_LDT kernel option is enabled, does not validate a call gate target, which allows local users to gain root privileges by creating a segment call gate in the Local Descriptor Table (LDT) with a target that specifies an arbitrary kernel address.",[],"['https://www.kb.cert.org/vuls/id/358960', 'https://www.openbsd.org/errata.html#userldt', 'https://exchange.xforce.ibmcloud.com/vulnerabilities/6222', 'http://www.securityfocus.com/bid/2739', 'http://archives.neohapsis.com/archives/netbsd/2001-q1/0093.html', 'http://archives.neohapsis.com/archives/linux/caldera/2001-q4/0014.html', 'http://archives.neohapsis.com/archives/bugtraq/2001-02/0353.html']"
CVE-2001-0267,https://www.cvedetails.com/cve/CVE-2001-0267/,,+Priv,2001-05-03,2017-10-09,7.2,Admin,Local,Low,Not required,Complete,Complete,Complete,"NM debug in HP MPE/iX 6.5 and earlier does not properly handle breakpoints, which allows local users to gain privileges.",[],"['http://archives.neohapsis.com/archives/hp/2001-q1/0050.html', 'https://exchange.xforce.ibmcloud.com/vulnerabilities/6226']"
CVE-2001-0266,https://www.cvedetails.com/cve/CVE-2001-0266/,,+Priv,2001-05-03,2008-09-05,7.2,Admin,Local,Low,Not required,Complete,Complete,Complete,Vulnerability in Software Distributor SD-UX in HP-UX 11.0 and earlier allows local users to gain privileges.,[],"['http://www.osvdb.org/6033', 'http://archives.neohapsis.com/archives/hp/2001-q1/0069.html']"
CVE-2001-0265,https://www.cvedetails.com/cve/CVE-2001-0265/,,,2001-06-18,2017-10-09,2.1,None,Local,Low,Not required,None,Partial,Partial,ASCII Armor parser in Windows PGP 7.0.3 and earlier allows attackers to create files in arbitrary locations via a malformed ASCII armored file.,[],"['https://exchange.xforce.ibmcloud.com/vulnerabilities/6643', 'http://www.securityfocus.com/bid/2556', 'http://www.atstake.com/research/advisories/2001/a040901-1.txt']"
CVE-2001-0264,https://www.cvedetails.com/cve/CVE-2001-0264/,,+Info,2001-06-18,2008-09-05,5.0,None,Remote,Low,Not required,Partial,None,None,"Gene6 G6 FTP Server 2.0 (aka BPFTP Server 2.10) allows remote attackers to obtain NETBIOS credentials by requesting information on a file that is in a network share, which causes the server to send the credentials to the host that owns the share, and allows the attacker to sniff the connection.",[],"['http://www.securityfocus.com/bid/2534', 'http://www.atstake.com/research/advisories/2001/a040301-1.txt']"
CVE-2001-0263,https://www.cvedetails.com/cve/CVE-2001-0263/,,,2001-06-18,2017-12-18,7.5,User,Remote,Low,Not required,Partial,Partial,Partial,"Gene6 G6 FTP Server 2.0 (aka BPFTP Server 2.10) allows attackers to read file attributes outside of the web root via the (1) SIZE and (2) MDTM commands when the ""show relative paths"" option is not enabled.",[],"['https://exchange.xforce.ibmcloud.com/vulnerabilities/6330', 'http://www.securityfocus.com/bid/2537', 'http://www.atstake.com/research/advisories/2001/a040301-1.txt']"
CVE-2001-0262,https://www.cvedetails.com/cve/CVE-2001-0262/,,Exec Code Overflow,2001-07-02,2008-09-05,7.5,None,Remote,Low,Not required,Partial,Partial,Partial,Buffer overflow in Netscape SmartDownload 1.3 allows remote attackers (malicious web pages) to execute arbitrary commands via a long URL.,[],['http://www.atstake.com/research/advisories/2001/a041301-1.txt']
CVE-2001-0261,https://www.cvedetails.com/cve/CVE-2001-0261/,,,2001-06-02,2017-12-18,2.1,None,Local,Low,Not required,Partial,None,None,"Microsoft Windows 2000 Encrypted File System does not properly destroy backups of files that are encrypted, which allows a local attacker to recover the text of encrypted files.",[],"['https://exchange.xforce.ibmcloud.com/vulnerabilities/5973', 'http://www.securityfocus.com/bid/2243', 'https://marc.info/?l=bugtraq&m=97992179925715&w=2', 'https://marc.info/?l=bugtraq&m=98027311214976&w=2']"
