cve_id,cve_href,cwe_id,vuln_type,publish_date,update_date,score,acces_level,access,complexity,authentication,confidentiality,integrity,availability,summary,refs
CVE-2004-2513,https://www.cvedetails.com/cve/CVE-2004-2513/,,Exec Code Overflow,2004-12-31,2017-10-19,10.0,None,Remote,Low,Not required,Complete,Complete,Complete,Buffer overflow in the IMAP service of Mercury (Pegasus) Mail 4.01 allows remote attackers to execute arbitrary code via a long SELECT command.,"{'https://exchange.xforce.ibmcloud.com/vulnerabilities/18295', 'http://home.kabelfoon.nl/~jaabogae/han/m_401b.html', 'https://www.exploit-db.com/exploits/663'}"
CVE-2004-2512,https://www.cvedetails.com/cve/CVE-2004-2512/,,Http R.Spl.,2004-12-31,2017-07-11,4.3,None,Remote,Medium,Not required,None,Partial,None,"CRLF injection vulnerability in calendar.php in DCP-Portal 5.3.2 and earlier allows remote attackers to conduct HTTP response splitting attacks to spoof web content and poison web caches via CRLF (""%0d%0a"") sequences in the PHPSESSID parameter.","{'http://securitytracker.com/id?1011481', 'http://www.osvdb.org/10591', 'https://secunia.com/advisories/12751', 'http://archives.neohapsis.com/archives/bugtraq/2004-10/0042.html', 'https://exchange.xforce.ibmcloud.com/vulnerabilities/17640', 'http://www.securityfocus.com/bid/11340'}"
CVE-2004-2511,https://www.cvedetails.com/cve/CVE-2004-2511/,,XSS,2004-12-31,2017-07-11,4.3,None,Remote,Medium,Not required,None,Partial,None,"Multiple cross-site scripting (XSS) vulnerabilities in DCP-Portal 5.3.2 and earlier allow remote attackers to inject arbitrary web script or HTML via (1) the year, (2) month, and (3) day parameters in calendar.php; (4) the cid and (5) url parameters in index.php; (6) the cid parameter in annoucement.php; (7) the cid parameter in news.php; (8) the cid parameter in contents.php; (9) the q parameter in search.php; and (10) the country parameter in register.php.","{'http://www.securityfocus.com/bid/11338', 'http://www.securityfocus.com/bid/11339', 'http://www.osvdb.org/11405', 'https://exchange.xforce.ibmcloud.com/vulnerabilities/17638', 'http://www.osvdb.org/10590', 'http://archives.neohapsis.com/archives/bugtraq/2004-10/0042.html', 'http://www.osvdb.org/10585', 'https://secunia.com/advisories/12751', 'http://www.osvdb.org/10589', 'http://securitytracker.com/id?1006351', 'http://www.osvdb.org/10587', 'https://exchange.xforce.ibmcloud.com/vulnerabilities/17639', 'http://www.osvdb.org/10588'}"
CVE-2004-2510,https://www.cvedetails.com/cve/CVE-2004-2510/,,XSS,2004-12-31,2017-07-11,4.3,None,Remote,Medium,Not required,None,Partial,None,Cross-site scripting (XSS) vulnerability in showflat.php in Infopop UBB.Threads before 6.5 allows remote attackers to inject arbitrary web script or HTML via the Cat parameter.,"{'https://secunia.com/advisories/13452', 'http://securitytracker.com/id?1012503', 'http://archives.neohapsis.com/archives/fulldisclosure/2004-12/0239.html', 'https://exchange.xforce.ibmcloud.com/vulnerabilities/18432', 'http://www.osvdb.org/12364', 'http://www.securityfocus.com/bid/11900'}"
CVE-2004-2509,https://www.cvedetails.com/cve/CVE-2004-2509/,,XSS,2004-12-31,2017-07-11,4.3,None,Remote,Medium,Not required,None,Partial,None,"Cross-site scripting (XSS) vulnerabilities in (1) calendar.php, (2) login.php, and (3) online.php in Infopop UBB.Threads 6.2.3 and 6.5 allow remote attackers to inject arbitrary web script or HTML via the Cat parameter.","{'http://www.osvdb.org/12366', 'http://www.osvdb.org/12367', 'https://secunia.com/advisories/13452', 'http://securitytracker.com/id?1012503', 'http://archives.neohapsis.com/archives/fulldisclosure/2004-12/0239.html', 'https://exchange.xforce.ibmcloud.com/vulnerabilities/18432', 'http://www.securityfocus.com/bid/11900', 'http://www.osvdb.org/12365'}"
CVE-2004-2508,https://www.cvedetails.com/cve/CVE-2004-2508/,,XSS,2004-12-31,2017-07-11,4.3,None,Remote,Medium,Not required,None,Partial,None,Cross-site scripting (XSS) vulnerability in main.cgi in Linksys WVC11B Wireless-B Internet Video Camera allows remote attackers to inject arbitrary web script or HTML via the next_file parameter.,"{'https://secunia.com/advisories/11881', 'https://exchange.xforce.ibmcloud.com/vulnerabilities/16415', 'http://www.securityfocus.com/bid/10533', 'http://securitytracker.com/id?1010424', 'http://archives.neohapsis.com/archives/bugtraq/2004-06/0215.html'}"
CVE-2004-2507,https://www.cvedetails.com/cve/CVE-2004-2507/,,,2004-12-31,2017-07-11,5.0,None,Remote,Low,Not required,Partial,None,None,Absolute path traversal vulnerability in main.cgi in Linksys WVC11B Wireless-B Internet Video Camera allows remote attackers to read arbitrary files via an absolute pathname in the next_file parameter.,"{'http://securitytracker.com/id?1010489', 'http://www.securityfocus.com/bid/10476', 'http://www.osvdb.org/7112', 'http://archives.neohapsis.com/archives/bugtraq/2004-06/0103.html', 'https://secunia.com/advisories/11811/', 'https://exchange.xforce.ibmcloud.com/vulnerabilities/16339'}"
CVE-2004-2506,https://www.cvedetails.com/cve/CVE-2004-2506/,,+Info,2004-12-31,2017-07-11,5.0,None,Remote,Low,Not required,Partial,None,None,Unparsed web content delivery vulnerability in WIKINDX before 0.9.9g allows remote attackers to obtain sensitive information via a direct HTTP request to the config.inc file.,"{'https://secunia.com/advisories/11394', 'https://sourceforge.net/project/shownotes.php?release_id=231421', 'http://www.osvdb.org/5401', 'https://exchange.xforce.ibmcloud.com/vulnerabilities/15885'}"
CVE-2004-2505,https://www.cvedetails.com/cve/CVE-2004-2505/,,DoS,2004-12-31,2017-07-11,5.0,None,Remote,Low,Not required,None,None,Partial,"Macromedia ColdFusion MX before 6.1 does not restrict the size of error messages, which allows remote attackers to cause a denial of service (memory consumption and crash) by sending repeated GET or POST requests that trigger error messages that use long strings of data.","{'http://www.securityfocus.com/bid/10163', 'http://archives.neohapsis.com/archives/bugtraq/2004-04/0184.html', 'https://exchange.xforce.ibmcloud.com/vulnerabilities/15895'}"
CVE-2004-2504,https://www.cvedetails.com/cve/CVE-2004-2504/,,+Priv,2004-12-31,2017-07-11,7.2,None,Local,Low,Not required,Complete,Complete,Complete,"The GUI in Alt-N Technologies MDaemon 7.2 and earlier, including 6.8, executes child processes such as NOTEPAD.EXE with SYSTEM privileges when users create new files, which allows local users with physical access to gain privileges.","{'http://www.osvdb.org/12158', 'https://secunia.com/advisories/13225', 'http://archives.neohapsis.com/archives/fulldisclosure/2004-11/1324.html', 'http://www.securityfocus.com/bid/11736', 'http://archives.neohapsis.com/archives/fulldisclosure/2004-11/1353.html', 'http://securitytracker.com/id?1012350', 'http://archives.neohapsis.com/archives/bugtraq/2004-11/0385.html', 'https://exchange.xforce.ibmcloud.com/vulnerabilities/18287'}"
CVE-2004-2503,https://www.cvedetails.com/cve/CVE-2004-2503/,,DoS,2004-12-31,2017-07-11,5.0,None,Remote,Low,Not required,None,None,Partial,INweb Mail Server 2.40 allows remote attackers to cause a denial of service (crash) via a large number of connect/disconnect actions to the (1) POP3 and (2) SMTP services.,"{'https://secunia.com/advisories/12056', 'http://www.osvdb.org/7770', 'http://www.securityfocus.com/bid/10719', 'http://securitytracker.com/id?1010680', 'https://exchange.xforce.ibmcloud.com/vulnerabilities/16683', 'http://members.lycos.co.uk/r34ct/main/inwebmail.txt'}"
CVE-2004-2502,https://www.cvedetails.com/cve/CVE-2004-2502/,,,2004-12-31,2017-07-11,2.1,None,Local,Low,Not required,None,Partial,None,im-switch before 11.4-46.1 in Fedora Core 2 allows local users to overwrite arbitrary files via a symlink attack on the imswitcher[PID] temporary file.,"{'https://secunia.com/advisories/12037', 'http://www.osvdb.org/7772', 'https://bugzilla.redhat.com/bugzilla/show_bug.cgi?id=126940', 'http://packetstormsecurity.org/0407-advisories/fedora_im-switch_tempfile_race.txt', 'http://www.securityfocus.com/bid/10717', 'https://exchange.xforce.ibmcloud.com/vulnerabilities/16682'}"
CVE-2004-2501,https://www.cvedetails.com/cve/CVE-2004-2501/,,Exec Code Overflow,2004-12-31,2017-07-11,7.5,None,Remote,Low,Not required,Partial,Partial,Partial,Buffer overflow in the IMAP service of MailEnable Professional Edition 1.52 and Enterprise Edition 1.01 allows remote attackers to execute arbitrary code via (1) a long command string or (2) a long string to the MEIMAP service and then terminating the connection.,"{'http://archives.neohapsis.com/archives/bugtraq/2004-11/0349.html', 'https://secunia.com/advisories/13318', 'http://www.hat-squad.com/en/000102.html', 'http://www.osvdb.org/12135', 'http://www.securityfocus.com/bid/11755', 'https://exchange.xforce.ibmcloud.com/vulnerabilities/18285', 'https://exchange.xforce.ibmcloud.com/vulnerabilities/18286', 'http://securitytracker.com/id?1012327', 'http://www.osvdb.org/12136'}"
CVE-2004-2500,https://www.cvedetails.com/cve/CVE-2004-2500/,,,2004-12-31,2017-07-11,10.0,None,Remote,Low,Not required,Complete,Complete,Complete,Unknown vulnerability in IlohaMail before 0.8.14-rc1 has unknown impact and attack vectors.,"{'http://www.securityfocus.com/bid/11872', 'http://www.osvdb.org/12292', 'https://secunia.com/advisories/13413', 'https://exchange.xforce.ibmcloud.com/vulnerabilities/18426', 'https://sourceforge.net/project/shownotes.php?group_id=54027&release_id=288409'}"
CVE-2004-2499,https://www.cvedetails.com/cve/CVE-2004-2499/,,DoS,2004-12-31,2017-07-11,7.8,None,Remote,Low,Not required,None,None,Complete,"Unspecified vulnerability in Hitachi Web Page Generator and Web Page Generator Enterprise 4.01 and earlier allows remote attackers to cause a denial of service via unknown attack vectors when a web site is ""improperly accessed.""","{'http://www.hitachi-support.com/security_e/vuls_e/HS04-002_e/index-e.html', 'http://www.osvdb.org/8262', 'https://exchange.xforce.ibmcloud.com/vulnerabilities/16821', 'https://secunia.com/advisories/12150', 'http://www.securityfocus.com/bid/10817'}"
CVE-2004-2498,https://www.cvedetails.com/cve/CVE-2004-2498/,,,2004-12-31,2017-07-11,5.0,None,Remote,Low,Not required,Partial,None,None,"Unspecified vulnerability in the error handler in Hitachi Web Page Generator and Web Page Generator Enterprise 4.01 and earlier, when using the default error template and debug mode is set to ON, allows remote attackers to determine internal directory structures via unknown attack vectors.","{'http://www.securityfocus.com/bid/10818', 'http://www.hitachi-support.com/security_e/vuls_e/HS04-003_e/index-e.html', 'http://www.osvdb.org/8263', 'https://exchange.xforce.ibmcloud.com/vulnerabilities/16822', 'https://secunia.com/advisories/12150'}"
CVE-2004-2497,https://www.cvedetails.com/cve/CVE-2004-2497/,,XSS,2004-12-31,2017-07-11,4.3,None,Remote,Medium,Not required,None,Partial,None,"Cross-site scripting (XSS) vulnerability in the error handler in Hitachi Web Page Generator and Web Page Generator Enterprise 4.01 and earlier, when using the default error template and debug mode is set to ON, allows remote attackers to inject arbitrary web script or HTML via unknown attack vectors.","{'http://www.osvdb.org/8264', 'http://www.securityfocus.com/bid/10818', 'http://www.hitachi-support.com/security_e/vuls_e/HS04-003_e/index-e.html', 'https://exchange.xforce.ibmcloud.com/vulnerabilities/16822', 'https://secunia.com/advisories/12150'}"
CVE-2004-2496,https://www.cvedetails.com/cve/CVE-2004-2496/,,DoS,2004-12-31,2017-07-11,7.8,None,Remote,Low,Not required,None,None,Complete,The HTTP daemon in OpenText FirstClass 7.1 and 8.0 allows remote attackers to cause a denial of service (service availability loss) via a large number of POST requests to /Search.,"{'http://www.securityfocus.com/bid/11877', 'http://archives.neohapsis.com/archives/fulldisclosure/2004-12/0321.html', 'https://exchange.xforce.ibmcloud.com/vulnerabilities/18424', 'http://www.osvdb.org/12350', 'http://securitytracker.com/id?1012478', 'https://secunia.com/advisories/13415'}"
CVE-2004-2495,https://www.cvedetails.com/cve/CVE-2004-2495/,,DoS,2004-12-31,2017-07-11,7.8,None,Remote,Low,Not required,None,None,Complete,"The (1) Webmail, (2) admin, and (3) SMTP services in Ability Mail Server 1.18 allow remote attackers to cause a denial of service (CPU consumption) via a large number of simultaneous connections to the service.","{'https://exchange.xforce.ibmcloud.com/vulnerabilities/16677', 'http://www.securityfocus.com/bid/10695', 'http://members.lycos.co.uk/r34ct/main/Ability_mail_server_1.18.txt', 'https://secunia.com/advisories/12039', 'http://securitytracker.com/id?1010672', 'http://www.osvdb.org/7719'}"
CVE-2004-2494,https://www.cvedetails.com/cve/CVE-2004-2494/,,XSS,2004-12-31,2017-07-11,4.3,None,Remote,Medium,Not required,None,Partial,None,Cross-site scripting (XSS) vulnerability in _error in Ability Mail Server 1.18 allows remote attackers to inject arbitrary web script or HTML via the erromsg parameter.,"{'https://exchange.xforce.ibmcloud.com/vulnerabilities/16676', 'http://www.osvdb.org/7718', 'http://www.securityfocus.com/bid/10695', 'http://members.lycos.co.uk/r34ct/main/Ability_mail_server_1.18.txt', 'https://secunia.com/advisories/12039', 'http://securitytracker.com/id?1010672'}"
CVE-2004-2493,https://www.cvedetails.com/cve/CVE-2004-2493/,,Dir. Trav.,2004-12-31,2017-07-11,4.0,None,Remote,Low,???,Partial,None,None,"Directory traversal vulnerability in Groupmax World Wide Web (GmaxWWW) 2 and 3, and Desktop 5, 6, and Desktop for Jichitai allows remote authenticated users to read arbitrary .html files via the template name parameter.","{'http://www.hitachi-support.com/security_e/vuls_e/HS04-007_e/01-e.html', 'http://www.securityfocus.com/bid/11773', 'http://www.osvdb.org/12153', 'https://exchange.xforce.ibmcloud.com/vulnerabilities/18278', 'https://secunia.com/advisories/13321'}"
CVE-2004-2492,https://www.cvedetails.com/cve/CVE-2004-2492/,,XSS,2004-12-31,2017-07-11,4.3,None,Remote,Medium,Not required,None,Partial,None,"Cross-site scripting (XSS) vulnerability in Groupmax World Wide Web (GmaxWWW) Desktop 5, 6, and Desktop for Jichitai 6, allows remote attackers to inject arbitrary web script or HTML via the QUERY parameter.","{'http://www.hitachi-support.com/security_e/vuls_e/HS04-007_e/01-e.html', 'http://www.securityfocus.com/bid/11773', 'https://exchange.xforce.ibmcloud.com/vulnerabilities/18277', 'http://www.osvdb.org/12154', 'https://secunia.com/advisories/13321'}"
CVE-2004-2491,https://www.cvedetails.com/cve/CVE-2004-2491/,,,2004-12-31,2017-07-11,2.6,None,Remote,High,Not required,None,Partial,None,"A race condition in Opera web browser 7.53 Build 3850 causes Opera to fill in the address bar before the page has been loaded, which allows remote attackers to spoof the URL in the address bar via the window.open and location.replace HTML parameters, which facilitates phishing attacks.","{'https://www.opera.com/windows/changelogs/754/', 'https://exchange.xforce.ibmcloud.com/vulnerabilities/16816', 'http://www.osvdb.org/8317', 'https://secunia.com/advisories/12162', 'http://archives.neohapsis.com/archives/fulldisclosure/2004-07/1056.html', 'http://www.securityfocus.com/bid/10810'}"
CVE-2004-2490,https://www.cvedetails.com/cve/CVE-2004-2490/,,Exec Code Overflow,2004-12-31,2017-07-11,4.6,None,Local,Low,Not required,Partial,Partial,Partial,Buffer overflow in IBM Informix Dynamic Server (IDS) 9.40.xC1 and 9.40.xC2 allows local users to execute arbitrary code via a long GL_PATH environment variable.,"{'http://www-1.ibm.com/support/docview.wss?uid=swg21153336', 'https://marc.info/?l=bugtraq&m=107524391217364&w=2', 'http://www.securityfocus.com/bid/9511', 'https://secunia.com/advisories/10737', 'https://exchange.xforce.ibmcloud.com/vulnerabilities/14949', 'http://www.osvdb.org/3756'}"
CVE-2004-2489,https://www.cvedetails.com/cve/CVE-2004-2489/,,Exec Code,2004-12-31,2017-07-11,4.6,None,Local,Low,Not required,Partial,Partial,Partial,Format string vulnerability in IBM Informix Dynamic Server (IDS) before 9.40.xC3 allows local users to execute arbitrary code via a modified INFORMIXDIR environment variable that points to a file with format string specifiers in the filename.,"{'https://exchange.xforce.ibmcloud.com/vulnerabilities/14967', 'http://www-1.ibm.com/support/docview.wss?uid=swg21153336', 'http://www.osvdb.org/3757', 'https://marc.info/?l=bugtraq&m=107524391217364&w=2', 'http://www.securityfocus.com/bid/9511', 'https://secunia.com/advisories/10737'}"
CVE-2004-2488,https://www.cvedetails.com/cve/CVE-2004-2488/,,Dir. Trav.,2004-12-31,2017-07-11,4.0,None,Remote,Low,???,Partial,None,None,"Directory traversal vulnerability in Nexgen FTP Server before 2.2.3.23 allows remote authenticated users to read or list arbitrary files via ""C:"" sequences in the (1) RETR (get), (2) NLST (ls), (3) LIST (ls), (4) RNFR, or (5) RNTO FTP commands.","{'http://www.nexgenserver.com/cgi-bin/loadframe2.cgi?/History.html', 'http://www.osvdb.org/4557', 'http://www.securityfocus.com/bid/9970', 'https://exchange.xforce.ibmcloud.com/vulnerabilities/15594', 'https://secunia.com/advisories/11216', 'http://www.securitytracker.com/alerts/2004/Mar/1009545.html'}"
CVE-2004-2487,https://www.cvedetails.com/cve/CVE-2004-2487/,,Dir. Trav.,2004-12-31,2017-07-11,4.0,None,Remote,Low,???,Partial,None,None,"Directory traversal vulnerability in Nexgen FTP Server before 2.2.3.23 allows remote authenticated users to read or list arbitrary files via (1) "".."", (2) ""\..\"" (backslash dot dot), or (3) ""/../"" sequences in (a) RETR (get), (b) NLST (ls), (c) LIST (ls), (d) RNFR, or (e) RNTO FTP commands.","{'http://www.nexgenserver.com/cgi-bin/loadframe2.cgi?/History.html', 'http://www.osvdb.org/4557', 'http://www.securityfocus.com/bid/9970', 'https://exchange.xforce.ibmcloud.com/vulnerabilities/15594', 'https://secunia.com/advisories/11216', 'http://www.securitytracker.com/alerts/2004/Mar/1009545.html'}"
CVE-2004-2486,https://www.cvedetails.com/cve/CVE-2004-2486/,,,2004-12-31,2018-10-30,7.5,None,Remote,Low,Not required,Partial,Partial,Partial,"The DSS verification code in Dropbear SSH Server before 0.43 frees uninitialized variables, which might allow remote attackers to gain access.","{'http://www.osvdb.org/8137', 'https://matt.ucc.asn.au/dropbear/CHANGES', 'https://www.cisco.com/en/US/products/products_security_advisory09186a0080949c7a.shtml', 'http://www.vupen.com/english/advisories/2008/0543', 'https://secunia.com/advisories/28935', 'https://secunia.com/advisories/12153', 'https://exchange.xforce.ibmcloud.com/vulnerabilities/40490', 'http://www.securityfocus.com/bid/10803', 'https://exchange.xforce.ibmcloud.com/vulnerabilities/16810'}"
CVE-2004-2485,https://www.cvedetails.com/cve/CVE-2004-2485/,,,2004-12-31,2017-07-11,5.0,None,Remote,Low,Not required,None,Partial,None,"Unspecified vulnerability in PHP Live! before 2.8.2, due to a ""major security problem,"" allows remote attackers to include arbitrary files and directories via unspecified attack vectors.","{'https://exchange.xforce.ibmcloud.com/vulnerabilities/18414', 'http://securitytracker.com/id?1012467', 'http://www.osvdb.org/12147', 'https://secunia.com/advisories/13420', 'http://archives.neohapsis.com/archives/apps/freshmeat/2004-11/0022.html', 'http://www.securityfocus.com/bid/11863'}"
CVE-2004-2484,https://www.cvedetails.com/cve/CVE-2004-2484/,,XSS,2004-12-31,2017-07-11,4.3,None,Remote,Medium,Not required,None,Partial,None,Cross-site scripting (XSS) vulnerability in PHP Gift Registry 1.3.5 and earlier allows remote attackers to inject arbitrary web script or HTML via the message parameter to (1) event.php or (2) index.php.,"{'http://www.osvdb.org/12287', 'https://exchange.xforce.ibmcloud.com/vulnerabilities/18412', 'http://cvs.sourceforge.net/viewcvs.py/phpgiftreg/src/event.php?r1=1.4&r2=1.5', 'http://cvs.sourceforge.net/viewcvs.py/phpgiftreg/src/index.php?r1=1.20&r2=1.21', 'http://www.osvdb.org/12286', 'http://www.securityfocus.com/bid/11879', 'https://secunia.com/advisories/13414', 'https://sourceforge.net/project/shownotes.php?release_id=288731'}"
CVE-2004-2483,https://www.cvedetails.com/cve/CVE-2004-2483/,,DoS,2004-12-31,2017-07-11,6.4,None,Remote,Low,Not required,None,Partial,Partial,"Kerio WinRoute Firewall before 6.0.9 uses information from PTR queries in response to A queries, which allows remote attackers to poison the DNS cache or cause a denial of service (connection loss).","{'http://www.kerio.com/security_advisory.html', 'http://www.osvdb.org/12294', 'https://exchange.xforce.ibmcloud.com/vulnerabilities/18410', 'http://www.securityfocus.com/bid/11870', 'http://www.osvdb.org/12293', 'https://secunia.com/advisories/13374'}"
CVE-2004-2482,https://www.cvedetails.com/cve/CVE-2004-2482/,,Exec Code,2004-12-31,2017-07-11,5.0,None,Remote,Low,Not required,None,Partial,None,"Microsoft Outlook 2000 and 2003, when configured to use Microsoft Word 2000 or 2003 as the e-mail editor and when forwarding e-mail, does not properly handle an opening OBJECT tag that does not have a closing OBJECT tag, which causes Outlook to automatically download the URI in the data property of the OBJECT tag and might allow remote attackers to execute arbitrary code.","{'https://secunia.com/advisories/12041', 'http://www.securityfocus.com/archive/1/368492', 'https://exchange.xforce.ibmcloud.com/vulnerabilities/16663', 'http://www.osvdb.org/7769', 'http://www.securityfocus.com/bid/10683'}"
CVE-2004-2481,https://www.cvedetails.com/cve/CVE-2004-2481/,,Bypass,2004-12-31,2017-07-11,4.6,None,Local,Low,Not required,Partial,Partial,Partial,"MyProxy 6.58 allows remote authenticated users in the Users Tab to connect to arbitrary hosts from the MyProxy server, possibly bypassing access restrictions, by connecting to the proxy and issuing a CONNECT command.","{'http://securitytracker.com/alerts/2004/Nov/1012322.html', 'http://www.osvdb.org/12138', 'http://www.securitylab.ru/vulnerability/source/210758.php', 'https://exchange.xforce.ibmcloud.com/vulnerabilities/18265'}"
CVE-2004-2480,https://www.cvedetails.com/cve/CVE-2004-2480/,,Bypass,2004-12-31,2017-07-11,5.0,None,Remote,Low,Not required,Partial,None,None,"Squid Web Proxy Cache 2.3.STABLE5 allows remote attackers to bypass security controls and access arbitrary websites via ""@@"" sequences in a URL within Internet Explorer.","{'http://archives.neohapsis.com/archives/bugtraq/2004-05/0070.html', 'http://www.securityfocus.com/bid/10315', 'https://exchange.xforce.ibmcloud.com/vulnerabilities/16153'}"
CVE-2004-2479,https://www.cvedetails.com/cve/CVE-2004-2479/,,+Info,2004-12-31,2017-10-11,5.0,None,Remote,Low,Not required,Partial,None,None,"Squid Web Proxy Cache 2.5 might allow remote attackers to obtain sensitive information via URLs containing invalid hostnames that cause DNS operations to fail, which results in references to previously used error messages.","{'http://fedoranews.org/updates/FEDORA--.shtml', 'http://www.squid-cache.org/bugs/show_bug.cgi?id=1143', 'http://www.osvdb.org/12282', 'http://www.securityfocus.com/bid/11865', 'https://secunia.com/advisories/16977', 'https://exchange.xforce.ibmcloud.com/vulnerabilities/18406', 'https://secunia.com/advisories/13408', 'https://www.redhat.com/support/errata/RHSA-2005-766.html', 'https://oval.cisecurity.org/repository/search/definition/oval%3Aorg.mitre.oval%3Adef%3A9711', 'http://securitytracker.com/id?1012466'}"
CVE-2004-2478,https://www.cvedetails.com/cve/CVE-2004-2478/,,,2004-12-31,2018-10-19,7.5,None,Remote,Low,Not required,Partial,Partial,Partial,"Unspecified vulnerability in Jetty HTTP Server, as used in (1) IBM Trading Partner Interchange before 4.2.4, (2) CA Unicenter Web Services Distributed Management (WSDM) before 3.11, and possibly other products, allows remote attackers to read arbitrary files via a .. (dot dot) in the URL.","{'https://secunia.com/advisories/22229', 'http://www.securityfocus.com/archive/1/447648/100/0/threaded', 'http://securitytracker.com/id?1016975', 'http://lists.grok.org.uk/pipermail/full-disclosure/2006-October/049846.html', 'http://securitytracker.com/id?1011545', 'http://www.vupen.com/english/advisories/2006/3873', 'http://www.osvdb.org/10490', 'http://www.securityfocus.com/bid/11330', 'https://secunia.com/advisories/12703', 'http://www-1.ibm.com/support/docview.wss?uid=swg21178665', 'https://exchange.xforce.ibmcloud.com/vulnerabilities/17600'}"
CVE-2004-2477,https://www.cvedetails.com/cve/CVE-2004-2477/,,,2004-12-31,2017-07-11,2.1,None,Local,Low,Not required,None,None,Partial,DiamondCS Process Guard Free 2.000 allows local users to disable the process guard protection system by overwriting the current Service Descriptor Table (SDT) in \device\physicalmemory with the original SDT found in ntoskrnl.exe.,"{'https://secunia.com/advisories/12033', 'https://exchange.xforce.ibmcloud.com/vulnerabilities/16654', 'http://www.securityfocus.com/bid/10675', 'http://www.securitytracker.com/alerts/2004/Jul/1010662.html', 'http://www.osvdb.org/7606', 'http://www.security.org.sg/vuln/procguard.html'}"
CVE-2004-2476,https://www.cvedetails.com/cve/CVE-2004-2476/,,DoS,2004-12-31,2021-07-23,2.6,None,Remote,High,Not required,None,None,Partial,"Microsoft Internet Explorer 6.0 allows remote attackers to cause a denial of service (infinite loop and crash) via an IFRAME with ""?"" as the file source.","{'https://exchange.xforce.ibmcloud.com/vulnerabilities/15832', 'http://www.securityfocus.com/bid/10073', 'http://archives.neohapsis.com/archives/bugtraq/2004-04/0061.html', 'http://archives.neohapsis.com/archives/bugtraq/2004-04/0080.html'}"
