cve_id,cve_href,cwe_id,vuln_type,publish_date,update_date,score,acces_level,access,complexity,authentication,confidentiality,integrity,availability,summary,refs
CVE-2004-2216,https://www.cvedetails.com/cve/CVE-2004-2216/,,DoS,2004-12-31,2017-07-11,5.0,None,Remote,Low,Not required,None,None,Partial,"Unknown vulnerability in Sun Java System Web Server 6.0 SP7 and earlier and 6.1 SP1 and earlier, and Application Server 7 Update 4 and earlier, allows remote attackers to cause a denial of service (crash) via a malformed client certificate.","{'http://sunsolve.sun.com/search/document.do?assetkey=1-26-101589-1', 'https://exchange.xforce.ibmcloud.com/vulnerabilities/17941', 'https://secunia.com/advisories/13072', 'http://www.securityfocus.com/bid/11593', 'http://sunsolve.sun.com/search/document.do?assetkey=1-26-57669-1', 'http://www.osvdb.org/11383'}"
CVE-2004-2215,https://www.cvedetails.com/cve/CVE-2004-2215/,,+Priv,2004-12-31,2017-07-11,4.6,None,Local,Low,Not required,Partial,Partial,Partial,"RXVT-Unicode 3.4 and 3.5 does not properly close file descriptors, which allows local users to access the terminals of other users and possibly gain privileges.","{'http://cvs.schmorp.de/browse/rxvt-unicode/Changes?view=markup', 'https://exchange.xforce.ibmcloud.com/vulnerabilities/17000', 'http://www.osvdb.org/8710', 'http://www.securityfocus.com/bid/10959', 'https://secunia.com/advisories/12299'}"
CVE-2004-2214,https://www.cvedetails.com/cve/CVE-2004-2214/,,Bypass,2004-12-31,2017-07-11,7.5,None,Remote,Low,Not required,Partial,Partial,Partial,Mbedthis AppWeb HTTP server before 1.1.3 allows remote attackers to bypass access restrictions via a URI with mixed case characters.,"{'http://www.mbedthis.com/products/appWeb/doc/product/newFeatures.html', 'http://www.securityfocus.com/bid/10673', 'https://secunia.com/advisories/12011', 'https://exchange.xforce.ibmcloud.com/vulnerabilities/16638', 'http://www.osvdb.org/7391'}"
CVE-2004-2213,https://www.cvedetails.com/cve/CVE-2004-2213/,,,2004-12-31,2017-07-11,5.0,None,Remote,Low,Not required,Partial,None,None,"Mbedthis AppWeb HTTP server before 1.1.3 allows remote attackers to obtain the source code for scripts via a (1) trailing dot (""."") or (2) trailing space in an HTTP request.","{'https://exchange.xforce.ibmcloud.com/vulnerabilities/16636', 'http://www.mbedthis.com/products/appWeb/doc/product/newFeatures.html', 'http://www.securityfocus.com/bid/10673', 'http://www.osvdb.org/7390', 'https://secunia.com/advisories/12011'}"
CVE-2004-2212,https://www.cvedetails.com/cve/CVE-2004-2212/,,Exec Code Sql,2004-12-31,2017-07-11,7.5,None,Remote,Low,Not required,Partial,Partial,Partial,SQL injection vulnerability in forum.asp in AliveSites Forums 2.0 allows remote attackers to execute arbitrary SQL commands via the forum_id parameter.,"{'http://www.maxpatrol.com/advdetails.asp?id=5', 'https://exchange.xforce.ibmcloud.com/vulnerabilities/17730', 'https://secunia.com/advisories/12844', 'http://www.securityfocus.com/bid/11427', 'http://www.maxpatrol.com/mp_advisory.asp', 'http://www.osvdb.org/10776'}"
CVE-2004-2211,https://www.cvedetails.com/cve/CVE-2004-2211/,,XSS,2004-12-31,2017-07-11,4.3,None,Remote,Medium,Not required,None,Partial,None,"Cross-site scripting (XSS) vulnerability in AliveSites Forums 2.0 allows remote attackers to inject arbitrary web script or HTML via the (1) forum_id, (2) method, or (3) forum_title parameters to post.asp, (4) the forum_title parameter to forum.asp, or (5) the id parameter to post.asp.","{'http://www.osvdb.org/10775', 'https://exchange.xforce.ibmcloud.com/vulnerabilities/17725', 'http://www.maxpatrol.com/advdetails.asp?id=5', 'https://secunia.com/advisories/12844', 'http://www.securityfocus.com/bid/11427', 'http://www.maxpatrol.com/mp_advisory.asp'}"
CVE-2004-2210,https://www.cvedetails.com/cve/CVE-2004-2210/,,XSS,2004-12-31,2008-09-05,4.3,None,Remote,Medium,Not required,None,Partial,None,"Multiple cross-site scripting (XSS) vulnerabilities in Express-Web Content Management System (CMS) allow remote attackers to steal cookie-based authentication information and possibly perform other exploits via the (1) n, (2) b, (3) e, or (4) a parameters to default.asp, (5) the Referer header in an HTTP request to login.asp, or (6) the email parameter to subscribe/default.asp.","{'http://www.maxpatrol.com/advdetails.asp?id=12', 'http://www.maxpatrol.com/mp_advisory.asp', 'http://www.securityfocus.com/bid/11426'}"
CVE-2004-2209,https://www.cvedetails.com/cve/CVE-2004-2209/,,Exec Code Sql,2004-12-31,2008-09-05,7.5,None,Remote,Low,Not required,Partial,Partial,Partial,SQL injection vulnerability in Ideal Science IdealBB 1.4.9 through 1.5.3 allows remote attackers to execute arbitrary SQL commands via unknown vectors.,"{'http://www.maxpatrol.com/mp_advisory.asp', 'http://www.securityfocus.com/bid/11424', 'http://www.maxpatrol.com/advdetails.asp?id=14'}"
CVE-2004-2208,https://www.cvedetails.com/cve/CVE-2004-2208/,,Http R.Spl.,2004-12-31,2008-09-05,5.0,None,Remote,Low,Not required,None,Partial,None,CRLF injection vulnerability in Ideal Science IdealBB 1.4.9 through 1.5.3 allows remote attackers to conduct HTTP response splitting attacks via unknown vectors.,"{'http://www.maxpatrol.com/mp_advisory.asp', 'http://www.securityfocus.com/bid/11424', 'http://www.maxpatrol.com/advdetails.asp?id=14'}"
CVE-2004-2207,https://www.cvedetails.com/cve/CVE-2004-2207/,,XSS,2004-12-31,2008-09-05,4.3,None,Remote,Medium,Not required,None,Partial,None,Cross-site scripting (XSS) vulnerability in Ideal Science IdealBB 1.4.9 through 1.5.3 allows remote attackers to inject arbitrary web script or HTML via unknown vectors.,"{'http://www.maxpatrol.com/mp_advisory.asp', 'http://www.securityfocus.com/bid/11424', 'http://www.maxpatrol.com/advdetails.asp?id=14'}"
CVE-2004-2206,https://www.cvedetails.com/cve/CVE-2004-2206/,,Exec Code Sql,2004-12-31,2017-07-11,7.5,None,Remote,Low,Not required,Partial,Partial,Partial,SQL injection vulnerability in NatterChat 1.12 allows remote attackers to execute arbitrary SQL commands via unknown vectors.,"{'http://www.securityfocus.com/bid/11423', 'http://www.securitytracker.com/alerts/2004/Oct/1011692.html', 'http://www.maxpatrol.com/advdetails.asp?id=13', 'https://exchange.xforce.ibmcloud.com/vulnerabilities/17726', 'http://www.maxpatrol.com/mp_advisory.asp', 'http://www.osvdb.org/10759'}"
CVE-2004-2205,https://www.cvedetails.com/cve/CVE-2004-2205/,,,2004-12-31,2017-07-11,7.2,None,Local,Low,Not required,Complete,Complete,Complete,Unknown vulnerability in Veritas Cluster Server 1.0.1 through 4.0 allows local users to gain root access via unspecified vectors.,"{'http://www.osvdb.org/10757', 'http://www.securityfocus.com/bid/11421', 'https://exchange.xforce.ibmcloud.com/vulnerabilities/17719', 'http://securitytracker.com/id?1011693', 'http://seer.support.veritas.com/docs/271040.htm', 'https://secunia.com/advisories/12833'}"
CVE-2004-2204,https://www.cvedetails.com/cve/CVE-2004-2204/,,,2004-12-31,2017-07-11,7.2,None,Local,Low,Not required,Complete,Complete,Complete,"Macromedia ColdFusion MX 6.0 and 6.1 application server, when running with the CreateObject function or CFOBJECT tag enabled, allows local users to conduct unauthorized activities and obtain administrative passwords by creating CFML scripts that use CreateObject or CFOBJECT.","{'http://www.securityfocus.com/archive/1/377213', 'http://www.osvdb.org/10718', 'https://www.macromedia.com/devnet/security/security_zone/mpsb04-10.html', 'https://exchange.xforce.ibmcloud.com/vulnerabilities/17567', 'https://secunia.com/advisories/12693', 'http://www.securityfocus.com/bid/11364'}"
CVE-2004-2203,https://www.cvedetails.com/cve/CVE-2004-2203/,,,2004-12-31,2017-07-11,7.5,None,Remote,Low,Not required,Partial,Partial,Partial,"Ansel 1.2 through 2.0 uses insecure default permissions, which allows remote attackers to gain access to web readable directories.","{'http://securitytracker.com/id?1011775', 'http://www.osvdb.org/10898', 'https://exchange.xforce.ibmcloud.com/vulnerabilities/17767', 'http://www.securityfocus.com/bid/11420'}"
CVE-2004-2202,https://www.cvedetails.com/cve/CVE-2004-2202/,,Exec Code Sql Bypass,2004-12-31,2017-07-11,7.5,None,Remote,Low,Not required,Partial,Partial,Partial,"Multiple SQL injection vulnerabilities in DUware DUclassified 4.0 through 4.2 allows remote attackers to bypass authentication and execute other commands on the server's underlying database via the (1) cat_id or (2) sub_id parameters in adDetail.asp, or (2) the password parameter in the login form.","{'http://www.osvdb.org/10668', 'http://www.securitytracker.com/alerts/2004/Oct/1011596.html', 'https://exchange.xforce.ibmcloud.com/vulnerabilities/17685', 'http://www.securityfocus.com/bid/11363', 'http://www.osvdb.org/10669'}"
CVE-2004-2201,https://www.cvedetails.com/cve/CVE-2004-2201/,,Exec Code Sql,2004-12-31,2017-07-11,7.5,None,Remote,Low,Not required,Partial,Partial,Partial,"SQL injection vulnerability in DUware DUforum 3.0 through 3.1 allows remote attackers to execute arbitrary SQL commands via the FOR_ID parameter in messages.asp, (2) MSG_ID parameter in messageDetail.asp, or (3) password parameter in the login form.","{'http://www.osvdb.org/10664', 'http://www.osvdb.org/10666', 'http://www.securitytracker.com/alerts/2004/Oct/1011595.html', 'http://www.securityfocus.com/bid/11363', 'https://exchange.xforce.ibmcloud.com/vulnerabilities/17680', 'http://www.osvdb.org/10665'}"
CVE-2004-2200,https://www.cvedetails.com/cve/CVE-2004-2200/,,XSS,2004-12-31,2017-07-11,4.3,None,Remote,Medium,Not required,None,Partial,None,Cross-site scripting (XSS) vulnerability in DUware DUforum 3.0 through 3.1 allows remote attackers to inject arbitrary web script or HTML via via the message text.,"{'http://www.securitytracker.com/alerts/2004/Oct/1011595.html', 'https://exchange.xforce.ibmcloud.com/vulnerabilities/17681', 'http://www.securityfocus.com/bid/11363', 'http://www.osvdb.org/10667'}"
CVE-2004-2199,https://www.cvedetails.com/cve/CVE-2004-2199/,,XSS,2004-12-31,2017-07-11,4.3,None,Remote,Medium,Not required,None,Partial,None,Cross-site scripting (XSS) vulnerability in DUware DUclassified 4.0 allows remote attackers to inject arbitrary web script or HTML via the message text.,"{'https://exchange.xforce.ibmcloud.com/vulnerabilities/17686', 'http://www.securityfocus.com/bid/11363', 'http://www.securitytracker.com/alerts/2004/Oct/1011596.html'}"
CVE-2004-2198,https://www.cvedetails.com/cve/CVE-2004-2198/,,,2004-12-31,2017-07-11,6.4,None,Remote,Low,Not required,Partial,Partial,None,"account.asp in DUware DUclassmate 1.0 through 1.1 allows remote attackers to change the passwords for arbitrary users by modifying the MM_recordId parameter on the ""My Account"" page.","{'https://exchange.xforce.ibmcloud.com/vulnerabilities/17682', 'http://www.securitytracker.com/alerts/2004/Oct/1011597.html', 'http://www.osvdb.org/10663', 'http://www.securityfocus.com/bid/11363'}"
CVE-2004-2197,https://www.cvedetails.com/cve/CVE-2004-2197/,,,2004-12-31,2017-07-11,7.2,None,Local,Low,Not required,Complete,Complete,Complete,"kdocker.cpp in kdocker 0.1 through 0.8 does not properly check the ownership of files, which could allow local users to execute arbitrary programs.","{'https://secunia.com/advisories/12828', 'http://securitytracker.com/id?1011688', 'http://www.osvdb.org/10729', 'http://www.securityfocus.com/bid/11419', 'http://cvs.sourceforge.net/viewcvs.py/kdocker/kdocker/src/kdocker.cpp?r1=1.10&r2=1.11&sortby=log', 'https://exchange.xforce.ibmcloud.com/vulnerabilities/17718', 'https://sourceforge.net/forum/forum.php?forum_id=414631'}"
CVE-2004-2196,https://www.cvedetails.com/cve/CVE-2004-2196/,,,2004-12-31,2017-07-11,5.0,None,Remote,Low,Not required,Partial,None,None,"Zanfi CMS lite 1.1 allows remote attackers to obtain the full path of the web server via direct requests without required arguments to (1) adm_pages.php, (2) corr_pages.php, (3) del_block.php, (4) del_page.php, (5) footer.php, (6) home.php, and others.","{'http://www.osvdb.org/10677', 'http://securitytracker.com/id?1011612', 'https://exchange.xforce.ibmcloud.com/vulnerabilities/17687', 'http://www.securityfocus.com/archive/1/378053', 'http://www.osvdb.org/10680', 'http://www.osvdb.org/10679', 'http://www.osvdb.org/10678', 'http://www.osvdb.org/10681', 'http://www.zanfi.nl/index1.php?flag=cmslite', 'https://secunia.com/advisories/12792', 'http://www.osvdb.org/10682'}"
CVE-2004-2195,https://www.cvedetails.com/cve/CVE-2004-2195/,,Exec Code File Inclusion,2004-12-31,2017-07-11,5.0,None,Remote,Low,Not required,None,Partial,None,PHP remote file inclusion vulnerability in index.php in Zanfi CMS lite 1.1 allows remote attackers to execute arbitrary PHP code via the inc parameter.,"{'http://securitytracker.com/id?1011612', 'https://exchange.xforce.ibmcloud.com/vulnerabilities/17691', 'http://www.securityfocus.com/archive/1/378053', 'http://www.osvdb.org/10676', 'http://www.securityfocus.com/bid/11362', 'https://secunia.com/advisories/12792'}"
CVE-2004-2194,https://www.cvedetails.com/cve/CVE-2004-2194/,,DoS,2004-12-31,2008-09-05,5.0,None,Remote,Low,Not required,None,None,Partial,MailEnable Professional Edition before 1.53 and Enterprise Edition before 1.02 allows remote attackers to cause a denial of service (crash) via malformed (1) SMTP or (2) IMAP commands.,"{'http://www.securityfocus.com/bid/11418', 'http://www.mailenable.com/enterprisehistory.asp', 'http://www.mailenable.com/professionalhistory.asp'}"
CVE-2004-2193,https://www.cvedetails.com/cve/CVE-2004-2193/,,XSS,2004-12-31,2017-07-11,4.3,None,Remote,Medium,Not required,None,Partial,None,Cross-site scripting (XSS) vulnerability in trade.php for CJOverkill 4.0.3 allows remote attackers to inject arbitrary web script or HTML via the (1) tms[0] or (2) url parameters.,"{'http://www.derkeiler.com/Mailing-Lists/Full-Disclosure/2004-10/0306.html', 'http://www.osvdb.org/10640', 'http://www.securityfocus.com/bid/11359', 'http://bbs.icefire.org/viewtopic.php?t=573', 'https://exchange.xforce.ibmcloud.com/vulnerabilities/17675', 'http://securitytracker.com/id?1011604', 'https://secunia.com/advisories/12786'}"
CVE-2004-2192,https://www.cvedetails.com/cve/CVE-2004-2192/,,Exec Code Sql,2004-12-31,2017-07-11,7.5,None,Remote,Low,Not required,Partial,Partial,Partial,SQL injection vulnerability in tttadmin/settings.php in Turbo Traffic Trader PHP 1.0 allows remote attackers to execute arbitrary SQL commands via the ttt_admin parameter.,"{'http://www.osvdb.org/10639', 'https://exchange.xforce.ibmcloud.com/vulnerabilities/17676', 'http://securitytracker.com/id?1011609', 'https://secunia.com/advisories/12785', 'http://www.securityfocus.com/bid/11358', 'http://archives.neohapsis.com/archives/fulldisclosure/2004-10/0296.html'}"
CVE-2004-2191,https://www.cvedetails.com/cve/CVE-2004-2191/,,XSS,2004-12-31,2017-07-11,4.3,None,Remote,Medium,Not required,None,Partial,None,Cross-site scripting (XSS) vulnerability in ttt-webmaster.php in Turbo Traffic Trader PHP 1.0 allows remote attackers to inject arbitrary web script or HTML via the (1) msg[0] or (2) siteurl parameters.,"{'http://www.osvdb.org/displayvuln.php?osvdb_id=10638', 'https://exchange.xforce.ibmcloud.com/vulnerabilities/17673', 'http://securitytracker.com/id?1011609', 'https://secunia.com/advisories/12785', 'http://www.securityfocus.com/bid/11358', 'http://archives.neohapsis.com/archives/fulldisclosure/2004-10/0296.html'}"
CVE-2004-2190,https://www.cvedetails.com/cve/CVE-2004-2190/,,Dir. Trav.,2004-12-31,2008-09-05,5.0,None,Remote,Low,Not required,Partial,None,None,Directory traversal vulnerability in Unzoo 4.4-2 has unknown impact and attack vectors.,"{'http://www.securityfocus.com/bid/11417', 'https://secunia.com/advisories/12857', 'http://securitytracker.com/id?1011673', 'http://www.derkeiler.com/Mailing-Lists/Full-Disclosure/2004-10/0466.html'}"
CVE-2004-2189,https://www.cvedetails.com/cve/CVE-2004-2189/,,Exec Code Sql,2004-12-31,2008-09-05,7.5,None,Remote,Low,Not required,Partial,Partial,Partial,SQL injection vulnerability in DMXReady Site Chassis Manager allows remote attackers to execute arbitrary SQL commands via unknown vectors.,"{'http://www.maxpatrol.com/mp_advisory.asp', 'http://www.securityfocus.com/bid/11434'}"
CVE-2004-2188,https://www.cvedetails.com/cve/CVE-2004-2188/,,XSS,2004-12-31,2008-09-10,4.3,None,Remote,Medium,Not required,None,Partial,None,Cross-site scripting (XSS) vulnerability in DMXReady Site Chassis Manager allows remote attackers to inject arbitrary web script or HTML via unknown vectors.,"{'http://www.maxpatrol.com/advdetails.asp?id=10', 'http://www.maxpatrol.com/mp_advisory.asp', 'http://www.securityfocus.com/bid/11434'}"
CVE-2004-2187,https://www.cvedetails.com/cve/CVE-2004-2187/,,,2004-12-31,2008-09-05,5.0,None,Remote,Low,Not required,None,Partial,None,"Unknown vulnerability in ImagePage for MediaWiki 1.3.5, related to ""filename validation,"" has unknown impact and attack vectors.","{'https://sourceforge.net/project/shownotes.php?release_id=275099', 'http://www.securityfocus.com/bid/11416'}"
CVE-2004-2186,https://www.cvedetails.com/cve/CVE-2004-2186/,,Exec Code Sql,2004-12-31,2008-09-05,7.5,None,Remote,Low,Not required,Partial,Partial,Partial,SQL injection vulnerability in MediaWiki 1.3.5 allows remote attackers to execute arbitrary SQL commands via SpecialMaintenance.,"{'https://sourceforge.net/project/shownotes.php?release_id=275099', 'http://www.securityfocus.com/bid/11416'}"
CVE-2004-2185,https://www.cvedetails.com/cve/CVE-2004-2185/,,Exec Code XSS,2004-12-31,2008-09-05,6.8,None,Remote,Medium,Not required,Partial,Partial,Partial,"Multiple cross-site scripting (XSS) vulnerabilities in MediaWiki 1.3.5 allow remote attackers to execute arbitrary scripts and/or SQL queries via (1) the UnicodeConverter extension, (2) raw page views, (3) SpecialIpblocklist, (4) SpecialEmailuser, (5) SpecialMaintenance, and (6) ImagePage.","{'https://sourceforge.net/project/shownotes.php?release_id=275099', 'http://www.securityfocus.com/bid/11416'}"
CVE-2004-2184,https://www.cvedetails.com/cve/CVE-2004-2184/,,Dir. Trav.,2004-12-31,2017-07-11,6.4,None,Remote,Low,Not required,Partial,Partial,None,"Directory traversal vulnerability in Digicraft Yak! server 2.0 through 2.1.2 allows remote attackers to read or write arbitrary files via ""../"" or ""..\"" sequences in commands such as (1) dir or (2) put.","{'http://aluigi.altervista.org/adv/yak-adv.txt', 'https://marc.info/?l=full-disclosure&m=109788315103778&w=2', 'https://secunia.com/advisories/12849', 'http://www.osvdb.org/10763', 'http://www.securityfocus.com/bid/11433', 'http://securitytracker.com/id?1011708', 'http://www.securityfocus.com/archive/1/378533', 'https://exchange.xforce.ibmcloud.com/vulnerabilities/17740'}"
CVE-2004-2183,https://www.cvedetails.com/cve/CVE-2004-2183/,,Exec Code,2004-12-31,2008-09-05,7.5,None,Remote,Low,Not required,Partial,Partial,Partial,Unknown vulnerability in WeHelpBUS 0.1 allows remote attackers to execute arbitrary shell commands via the query string.,"{'https://sourceforge.net/project/shownotes.php?release_id=275295', 'http://www.securityfocus.com/bid/11431'}"
CVE-2004-2182,https://www.cvedetails.com/cve/CVE-2004-2182/,CWE-287,,2004-12-31,2008-09-05,7.5,None,Remote,Low,Not required,Partial,Partial,Partial,Session fixation vulnerability in Macromedia JRun 4.0 allows remote attackers to hijack user sessions by pre-setting the user session ID information used by the session server.,"{'http://www.securityfocus.com/bid/11414', 'https://www.macromedia.com/devnet/security/security_zone/mpsb04-08.html'}"
CVE-2004-2181,https://www.cvedetails.com/cve/CVE-2004-2181/,,Exec Code Sql,2004-12-31,2009-06-25,7.5,None,Remote,Low,Not required,Partial,Partial,Partial,"Multiple SQL injection vulnerabilities in WowBB Forum 1.61 allow remote attackers to execute arbitrary SQL commands via the (1) sort_by or (2) page parameters to view_user.php, or the (3) forum_id parameter to view_topic.php.  NOTE: the sort_by vector was later reported to be present in WowBB 1.65.","{'http://www.maxpatrol.com/advdetails.asp?id=7', 'https://pridels0.blogspot.com/2005/11/wowbb-165-sql-vuln.html', 'http://www.securityfocus.com/bid/11429'}"
CVE-2004-2180,https://www.cvedetails.com/cve/CVE-2004-2180/,,XSS,2004-12-31,2008-09-05,4.3,None,Remote,Medium,Not required,None,Partial,None,"Multiple cross-site scripting (XSS) vulnerabilities in WowBB Forum 1.61 allow remote attackers to inject arbitrary web script or HTML via the (1) country parameter to view_user.php, (2) show parameter to view_forum.php, (3) letter parameter to view_user.php, (4) highlight parameter to view_topic.php, (5) show parameter to index.php, (6) q parameter to search.php, (7) Referer header to admin.php, or the (8) user_email parameter to login.php.","{'http://www.maxpatrol.com/advdetails.asp?id=7', 'http://www.securityfocus.com/bid/11429'}"
CVE-2004-2179,https://www.cvedetails.com/cve/CVE-2004-2179/,,DoS,2004-12-31,2008-09-05,5.0,None,Remote,Low,Not required,None,None,Partial,"asycpict.dll, as used in Microsoft products such as Front Page 97 and 98, allows remote attackers to cause a denial of service (hang) via a JPEG image with maximum height and width values.","{'http://www.securityfocus.com/bid/11412', 'http://www.securityfocus.com/archive/1/378619', 'http://www.securityfocus.com/archive/1/378431'}"
CVE-2004-2178,https://www.cvedetails.com/cve/CVE-2004-2178/,,Exec Code Sql,2004-12-31,2008-09-05,7.5,None,Remote,Low,Not required,Partial,Partial,Partial,SQL injection vulnerability in DevoyBB Web Forum 1.0.0 allows remote attackers to execute arbitrary SQL commands via unknown vectors.,"{'http://www.maxpatrol.com/advdetails.asp?id=11', 'http://www.securityfocus.com/bid/11428', 'https://sourceforge.net/project/shownotes.php?release_id=273104'}"
CVE-2004-2177,https://www.cvedetails.com/cve/CVE-2004-2177/,,XSS,2004-12-31,2008-09-05,4.3,None,Remote,Medium,Not required,None,Partial,None,Cross-site scripting (XSS) vulnerability in DevoyBB Web Forum 1.0.0 allows remote attackers to inject arbitrary web script or HTML via unknown vectors.,"{'http://www.maxpatrol.com/advdetails.asp?id=11', 'http://www.securityfocus.com/bid/11428', 'https://sourceforge.net/project/shownotes.php?release_id=273104'}"
CVE-2004-2176,https://www.cvedetails.com/cve/CVE-2004-2176/,,Bypass,2004-12-31,2008-09-05,4.6,None,Local,Low,Not required,Partial,Partial,Partial,"The Internet Connection Firewall (ICF) in Microsoft Windows XP SP2 is configured by default to trust sessmgr.exe, which allows local users to use sessmgr.exe to create a local listening port that bypasses the ICF access controls.","{'http://www.securityfocus.com/archive/1/378508', 'http://www.securityfocus.com/bid/11410'}"
CVE-2004-2175,https://www.cvedetails.com/cve/CVE-2004-2175/,,Exec Code Sql,2004-12-31,2017-07-11,7.5,None,Remote,Low,Not required,Partial,Partial,Partial,Multiple SQL injection vulnerabilities in ReviewPost PHP Pro allow remote attackers to execute arbitrary SQL commands via the (1) product parameter to showproduct.php or (2) cat parameter to showcat.php.,"{'https://secunia.com/advisories/10786/', 'http://www.securityfocus.com/archive/1/352598', 'https://www.zone-h.org/en/advisories/read/id=3864/', 'http://www.securityfocus.com/bid/9574', 'https://exchange.xforce.ibmcloud.com/vulnerabilities/15035'}"
CVE-2004-2174,https://www.cvedetails.com/cve/CVE-2004-2174/,,XSS,2004-12-31,2017-07-11,4.3,None,Remote,Medium,Not required,None,Partial,None,Cross-site scripting (XSS) vulnerability in Custva.asp in EarlyImpact ProductCart allows remote attackers to inject arbitrary Javascript via the redirectUrl parameter.,"{'http://www.s-quadra.com/advisories/Adv-20040216.txt', 'http://www.earlyimpact.com/productcart/support/updates/ReadMe_ProductCart_Security_Patch_013004.txt', 'http://securitytracker.com/alerts/2004/Feb/1009085.html', 'http://archives.neohapsis.com/archives/fulldisclosure/2004-02/0871.html', 'https://exchange.xforce.ibmcloud.com/vulnerabilities/15234', 'http://www.osvdb.org/3980', 'https://secunia.com/advisories/10898', 'http://www.securityfocus.com/bid/9669', 'http://archives.neohapsis.com/archives/bugtraq/2004-02/0503.html'}"
CVE-2004-2173,https://www.cvedetails.com/cve/CVE-2004-2173/,,Exec Code Sql,2004-12-31,2017-07-11,7.5,None,Remote,Low,Not required,Partial,Partial,Partial,SQL injection vulnerability in advSearch_h.asp in EarlyImpact ProductCart allows remote attackers to execute arbitrary SQL commands via the priceUntil parameter.,"{'http://www.osvdb.org/3981', 'http://www.s-quadra.com/advisories/Adv-20040216.txt', 'http://www.earlyimpact.com/productcart/support/updates/ReadMe_ProductCart_Security_Patch_013004.txt', 'http://securitytracker.com/alerts/2004/Feb/1009085.html', 'http://archives.neohapsis.com/archives/fulldisclosure/2004-02/0871.html', 'https://secunia.com/advisories/10898', 'http://www.securityfocus.com/bid/9669', 'http://www.securityfocus.com/archive/1/354288', 'http://archives.neohapsis.com/archives/bugtraq/2004-02/0503.html', 'https://exchange.xforce.ibmcloud.com/vulnerabilities/15233'}"
CVE-2004-2172,https://www.cvedetails.com/cve/CVE-2004-2172/,,,2004-12-31,2017-07-11,5.0,None,Remote,Low,Not required,Partial,None,None,"EarlyImpact ProductCart uses a weak encryption scheme to encrypt passwords, which allows remote attackers to obtain the password via a chosen plaintext attack.","{'http://www.osvdb.org/3979', 'http://www.s-quadra.com/advisories/Adv-20040216.txt', 'http://www.earlyimpact.com/productcart/support/updates/ReadMe_ProductCart_Security_Patch_013004.txt', 'http://securitytracker.com/alerts/2004/Feb/1009085.html', 'http://archives.neohapsis.com/archives/fulldisclosure/2004-02/0871.html', 'https://secunia.com/advisories/10898', 'http://www.securityfocus.com/bid/9669', 'http://www.securityfocus.com/archive/1/354288', 'https://exchange.xforce.ibmcloud.com/vulnerabilities/15231', 'http://archives.neohapsis.com/archives/bugtraq/2004-02/0503.html'}"
