cve_id,cve_href,cwe_id,vuln_type,publish_date,update_date,score,acces_level,access,complexity,authentication,confidentiality,integrity,availability,summary,refs
CVE-2005-1247,https://www.cvedetails.com/cve/CVE-2005-1247/,,DoS,2004-01-15,2008-09-05,5.0,None,Remote,Low,Not required,None,None,Partial,"webadmin.exe in Novell Nsure Audit 1.0.1 allows remote attackers to cause a denial of service via malformed ASN.1 packets in corrupt client certificates to an SSL server, as demonstrated using an exploit for the OpenSSL ASN.1 parsing vulnerability.","{'http://www.derkeiler.com/Mailing-Lists/securityfocus/bugtraq/2004-01/0126.html', 'http://support.novell.com/cgi-bin/search/searchtid.cgi?/10097379.htm', 'http://archives.neohapsis.com/archives/vulnwatch/2005-q2/0021.html', 'http://www.cirt.dk/advisories/cirt-31-advisory.pdf'}"
CVE-2005-0441,https://www.cvedetails.com/cve/CVE-2005-0441/,,Exec Code Overflow,2004-12-22,2017-07-11,10.0,None,Remote,Low,Not required,Complete,Complete,Complete,"Multiple stack-based buffer overflows in Sybase Adaptive Server Enterprise (ASE) 12.x before 12.5.3 ESD#1 allow remote authenticated users to execute arbitrary code via the (1) attrib_valid function, (2) covert function, (3) declare statement, or (4) a crafted query plan, or remote authenticated users with database owner or ""sa"" role privileges to execute arbitrary code via (5) a crafted install java statement.","{'https://marc.info/?l=bugtraq&m=111272918117194&w=2', 'https://exchange.xforce.ibmcloud.com/vulnerabilities/19979', 'http://www.securityfocus.com/bid/12080', 'https://exchange.xforce.ibmcloud.com/vulnerabilities/19354', 'https://exchange.xforce.ibmcloud.com/vulnerabilities/19978', 'http://www.ngssoftware.com/advisories/sybase-ase.txt', 'http://www.securityfocus.com/archive/1/393851', 'http://www.sybase.com/detail/1,6904,1033894,00.html', 'https://exchange.xforce.ibmcloud.com/vulnerabilities/19980', 'https://exchange.xforce.ibmcloud.com/vulnerabilities/19976', 'https://secunia.com/advisories/13632', 'http://www.sybase.com/detail?id=1034520', 'http://archives.neohapsis.com/archives/bugtraq/2004-12/0315.html', 'http://www.sybase.com/detail?id=1034752', 'https://exchange.xforce.ibmcloud.com/vulnerabilities/19974'}"
CVE-2005-0373,https://www.cvedetails.com/cve/CVE-2005-0373/,,Exec Code Overflow,2004-10-07,2017-07-11,7.5,None,Remote,Low,Not required,Partial,Partial,Partial,"Buffer overflow in digestmd5.c CVS release 1.170 (also referred to as digestmda5.c), as used in the DIGEST-MD5 SASL plugin for Cyrus-SASL but not in any official releases, allows remote attackers to execute arbitrary code.","{'http://www.securityfocus.com/bid/11347', 'http://www.mandriva.com/security/advisories?name=MDKSA-2005:054', 'http://www.monkey.org/openbsd/archive/ports/0407/msg00265.html', 'https://bugzilla.andrew.cmu.edu/cgi-bin/cvsweb.cgi/src/sasl/plugins/digestmd5.c.diff?r1=1.170&r2=1.171', 'https://bugzilla.andrew.cmu.edu/cgi-bin/cvsweb.cgi/src/sasl/plugins/digestmd5.c?rev=1.171&content-type=text/x-cvsweb-markup', 'https://www.gentoo.org/security/en/glsa/glsa-200410-05.xml', 'https://exchange.xforce.ibmcloud.com/vulnerabilities/17642', 'http://www.linuxcompatible.org/print42495.html'}"
CVE-2005-0192,https://www.cvedetails.com/cve/CVE-2005-0192/,,Dir. Trav.,2004-10-06,2017-12-12,2.6,None,Remote,High,Not required,Partial,None,None,Directory traversal vulnerability in the parsing of Skin file names in RealPlayer 10.5 (6.0.12.1040) and earlier allows remote attackers to read arbitrary files via a .. (dot dot) in an RJS filename.,"{'http://www.ngssoftware.com/advisories/real-03full.txt', 'https://exchange.xforce.ibmcloud.com/vulnerabilities/18984', 'http://service.real.com/help/faq/security/040928_player/EN/', 'https://marc.info/?l=bugtraq&m=109707741022291&w=2', 'https://marc.info/?l=bugtraq&m=110616302008401&w=2'}"
CVE-2005-0190,https://www.cvedetails.com/cve/CVE-2005-0190/,,Dir. Trav. Bypass,2004-09-29,2017-11-16,2.6,None,Remote,High,Not required,None,Partial,None,"Directory traversal vulnerability in RealPlayer 10.5 (6.0.12.1040) and earlier allows remote attackers to delete arbitrary files via a Real Metadata Packages (RMP) file with a FILENAME tag containing .. (dot dot) sequences in a filename that ends with a ? (question mark) and an allowed file extension (e.g. .mp3), which bypasses the check for the file extension.","{'https://secunia.com/advisories/12672/', 'https://marc.info/?l=bugtraq&m=110616160228843&w=2', 'http://service.real.com/help/faq/security/040928_player/EN/', 'https://exchange.xforce.ibmcloud.com/vulnerabilities/17551', 'http://www.ngssoftware.com/advisories/real-02full.txt', 'http://www.securityfocus.com/bid/11308', 'https://marc.info/?l=bugtraq&m=109707741022291&w=2'}"
CVE-2005-0189,https://www.cvedetails.com/cve/CVE-2005-0189/,,Exec Code Overflow,2004-10-06,2017-11-16,7.5,None,Remote,Low,Not required,Partial,Partial,Partial,Stack-based buffer overflow in the HandleAction function in RealPlayer 10.5 (6.0.12.1040) and earlier allows remote attackers to execute arbitrary code via a long ShowPreferences argument.,"{'http://www.securityfocus.com/bid/12311', 'http://service.real.com/help/faq/security/040928_player/EN/', 'https://www.kb.cert.org/vuls/id/698390', 'https://marc.info/?l=bugtraq&m=110616636318261&w=2', 'http://archives.neohapsis.com/archives/ntbugtraq/2005-q1/0046.html', 'https://marc.info/?l=bugtraq&m=109707741022291&w=2'}"
CVE-2005-0188,https://www.cvedetails.com/cve/CVE-2005-0188/,,Exec Code,2004-10-06,2017-07-11,7.5,None,Remote,Low,Not required,Partial,Partial,Partial,Format string vulnerability in the SetBaseURL function in AtHoc toolbar allows remote attackers to execute arbitrary code via format string specifiers in an invalid URL that is recorded in the debug log.,"{'https://marc.info/?l=bugtraq&m=110616363415176&w=2', 'http://www.securityfocus.com/bid/11341', 'https://exchange.xforce.ibmcloud.com/vulnerabilities/17628', 'https://marc.info/?l=bugtraq&m=109710974324742&w=2', 'http://www.ngssoftware.com/advisories/athoc-01full.txt'}"
CVE-2005-0068,https://www.cvedetails.com/cve/CVE-2005-0068/,,DoS,2004-12-22,2008-09-05,5.0,None,Remote,Low,Not required,None,None,Partial,"The original design of ICMP does not require authentication for host-generated ICMP error messages, which makes it easier for attackers to forge ICMP error messages for specific TCP connections and cause a denial of service, as demonstrated using (1) blind connection-reset attacks with forged ""Destination Unreachable"" messages, (2) blind throughput-reduction attacks with forged ""Source Quench"" messages, or (3) blind throughput-reduction attacks with forged ICMP messages that cause the Path MTU to be reduced.  NOTE: CVE-2004-0790, CVE-2004-0791, and CVE-2004-1060 have been SPLIT based on different attacks; CVE-2005-0065, CVE-2005-0066, CVE-2005-0067, and CVE-2005-0068 are related identifiers that are SPLIT based on the underlying vulnerability.  While CVE normally SPLITs based on vulnerability, the attack-based identifiers exist due to the variety and number of affected implementations and solutions that address the attacks instead of the underlying vulnerabilities.","{'http://www.securityfocus.com/bid/13124', 'http://www.gont.com.ar/drafts/icmp-attacks-against-tcp.html'}"
CVE-2005-0067,https://www.cvedetails.com/cve/CVE-2005-0067/,,DoS,2004-12-22,2008-09-05,5.0,None,Remote,Low,Not required,None,None,Partial,"The original design of TCP does not require that port numbers be assigned randomly (aka ""Port randomization""), which makes it easier for attackers to forge ICMP error messages for specific TCP connections and cause a denial of service, as demonstrated using (1) blind connection-reset attacks with forged ""Destination Unreachable"" messages, (2) blind throughput-reduction attacks with forged ""Source Quench"" messages, or (3) blind throughput-reduction attacks with forged ICMP messages that cause the Path MTU to be reduced.  NOTE: CVE-2004-0790, CVE-2004-0791, and CVE-2004-1060 have been SPLIT based on different attacks; CVE-2005-0065, CVE-2005-0066, CVE-2005-0067, and CVE-2005-0068 are related identifiers that are SPLIT based on the underlying vulnerability.  While CVE normally SPLITs based on vulnerability, the attack-based identifiers exist due to the variety and number of affected implementations and solutions that address the attacks instead of the underlying vulnerabilities.","{'http://www.securityfocus.com/bid/13124', 'http://www.gont.com.ar/drafts/icmp-attacks-against-tcp.html'}"
CVE-2005-0066,https://www.cvedetails.com/cve/CVE-2005-0066/,,DoS,2004-12-22,2008-09-05,5.0,None,Remote,Low,Not required,None,None,Partial,"The original design of TCP does not check that the TCP Acknowledgement number in an ICMP error message generated by an intermediate router is within the range of possible values for data that has already been acknowledged (aka ""TCP acknowledgement number checking""), which makes it easier for attackers to forge ICMP error messages for specific TCP connections and cause a denial of service, as demonstrated using (1) blind connection-reset attacks with forged ""Destination Unreachable"" messages, (2) blind throughput-reduction attacks with forged ""Source Quench"" messages, or (3) blind throughput-reduction attacks with forged ICMP messages that cause the Path MTU to be reduced.  NOTE: CVE-2004-0790, CVE-2004-0791, and CVE-2004-1060 have been SPLIT based on different attacks; CVE-2005-0065, CVE-2005-0066, CVE-2005-0067, and CVE-2005-0068 are related identifiers that are SPLIT based on the underlying vulnerability.  While CVE normally SPLITs based on vulnerability, the attack-based identifiers exist due to the variety and number of affected implementations and solutions that address the attacks instead of the underlying vulnerabilities.","{'http://www.securityfocus.com/bid/13124', 'http://www.gont.com.ar/drafts/icmp-attacks-against-tcp.html'}"
CVE-2004-2760,https://www.cvedetails.com/cve/CVE-2004-2760/,CWE-16,,2004-12-31,2009-01-29,6.8,None,Remote,Medium,Not required,Partial,Partial,Partial,"sshd in OpenSSH 3.5p1, when PermitRootLogin is disabled, immediately closes the TCP connection after a root login attempt with the correct password, but leaves the connection open after an attempt with an incorrect password, which makes it easier for remote attackers to guess the password by observing the connection state, a different vulnerability than CVE-2003-0190.  NOTE: it could be argued that in most environments, this does not cross privilege boundaries without requiring leverage of a separate vulnerability.","{'http://securityreason.com/securityalert/4100', 'http://archive.cert.uni-stuttgart.de/bugtraq/2004/04/msg00162.html', 'http://www.securityfocus.com/archive/1/360198'}"
CVE-2004-2759,https://www.cvedetails.com/cve/CVE-2004-2759/,,,2004-12-31,2017-08-08,2.1,None,Local,Low,Not required,Partial,None,None,"Shared Sun StorEdge QFS and SAM-QFS file systems, as used in Utilization Suite 4.0 through 4.1 and Performance Suite 4.0 through 4.1, might allow local users to read portions of deleted files by accessing data within sparse files.","{'http://www.securityfocus.com/bid/11559', 'https://exchange.xforce.ibmcloud.com/vulnerabilities/17901', 'http://sunsolve.sun.com/search/document.do?assetkey=1-66-200184-1', 'http://sunsolve.sun.com/search/document.do?assetkey=1-26-101527-1'}"
CVE-2004-2758,https://www.cvedetails.com/cve/CVE-2004-2758/,,DoS,2004-12-31,2017-08-08,7.5,None,Remote,Low,Not required,Partial,Partial,Partial,"Multiple unspecified vulnerabilities in the H.323 protocol implementation for Sun SunForum 3.2 and 3D 1.0 allow remote attackers to cause a denial of service (segmentation fault and process crash), as demonstrated by the NISCC/OUSPG PROTOS test suite for the H.225 protocol.","{'https://www.kb.cert.org/vuls/id/749342', 'http://sunsolve.sun.com/search/document.do?assetkey=1-26-101429-1', 'https://exchange.xforce.ibmcloud.com/vulnerabilities/14173', 'http://sunsolve.sun.com/search/document.do?assetkey=1-66-200181-1', 'https://www.cert.org/advisories/CA-2004-01.html', 'http://www.uniras.gov.uk/vuls/2004/006489/h323.htm', 'https://secunia.com/advisories/10665', 'http://sunsolve.sun.com/search/document.do?assetkey=1-26-57476-1', 'http://securitytracker.com/id?1008749', 'http://sunsolve.sun.com/search/document.do?assetkey=1-77-1000135.1-1'}"
CVE-2004-2757,https://www.cvedetails.com/cve/CVE-2004-2757/,CWE-79,XSS,2004-12-31,2017-07-29,4.3,None,Remote,Medium,Not required,None,Partial,None,Cross-site scripting (XSS) vulnerability in the failed login page in Novell iChain before 2.2 build 2.2.113 and 2.3 First Customer Ship (FCS) allows remote attackers to inject arbitrary web script or HTML via url parameter.,"{'https://secunia.com/advisories/10653', 'http://support.novell.com/cgi-bin/search/searchtid.cgi?/10080762.htm', 'http://www.securityfocus.com/bid/9412', 'https://exchange.xforce.ibmcloud.com/vulnerabilities/14873'}"
CVE-2004-2756,https://www.cvedetails.com/cve/CVE-2004-2756/,CWE-79,XSS,2004-12-31,2008-09-05,4.3,None,Remote,Medium,Not required,None,Partial,None,"Cross-site scripting (XSS) vulnerability in viewtopic.php in Xoops 2.x, possibly 2 through 2.0.5, allows remote attackers to inject arbitrary web script or HTML via the (1) forum and (2) topic_id parameters.","{'http://www.securityfocus.com/bid/9497', 'http://securitytracker.com/id?1008849'}"
CVE-2004-2755,https://www.cvedetails.com/cve/CVE-2004-2755/,CWE-79,XSS,2004-12-31,2017-07-29,4.3,None,Remote,Medium,Not required,None,Partial,None,"Cross-site scripting (XSS) vulnerability in Symantec Web Security 2.5, 3.0.0, and 3.0.1 before build 62 allows remote attackers to inject arbitrary web script or HTML via the query string in blocked URLs that are listed in (1) error or (2) block page messages.","{'https://exchange.xforce.ibmcloud.com/vulnerabilities/14825', 'http://www.securityfocus.com/bid/9418', 'http://www.securitytracker.com/alerts/2004/Jan/1008711.html', 'http://securityresponse.symantec.com/avcenter/security/Content/2004.01.13.html', 'https://secunia.com/advisories/10618', 'http://www.osvdb.org/6754'}"
CVE-2004-2754,https://www.cvedetails.com/cve/CVE-2004-2754/,CWE-89,Exec Code Sql,2004-12-31,2008-09-05,7.5,None,Remote,Low,Not required,Partial,Partial,Partial,"SQL injection vulnerability in SSI.php in YaBB SE 1.5.4, 1.5.3, and possibly other versions before 1.5.5 allows remote attackers to execute arbitrary SQL commands via the ID_MEMBER parameter to the (1) recentTopics and (2) welcome functions.","{'https://sourceforge.net/project/shownotes.php?release_id=210608&group_id=57105', 'http://securityreason.com/securityalert/3371', 'http://www.yabbse.org/community/index.php?thread=27122', 'http://www.securityfocus.com/bid/9449', 'http://www.osvdb.org/3618', 'http://www.securityfocus.com/archive/1/350244', 'http://www.securitytracker.com/id?1008764'}"
CVE-2004-2753,https://www.cvedetails.com/cve/CVE-2004-2753/,,DoS,2004-12-31,2017-07-29,5.6,None,Local,Low,Not required,Partial,None,Complete,"Unspecified vulnerability in SharedX in HP-UX B.11.00, B.11.11, and B.11.22 allows local users to access unspecified files or cause a denial of service via unknown vectors related to handling of ""files in a potentially insecure manner.""","{'https://exchange.xforce.ibmcloud.com/vulnerabilities/14838', 'http://www.securityfocus.com/bid/9420', 'http://www.securitytracker.com/id?1008712', 'http://www1.itrc.hp.com/service/cki/docDisplay.do?docId=HPSBUX0401-307', 'https://secunia.com/advisories/10657', 'http://www.ciac.org/ciac/bulletins/o-058.shtml'}"
CVE-2004-2752,https://www.cvedetails.com/cve/CVE-2004-2752/,CWE-79,XSS,2004-12-31,2008-09-05,4.3,None,Remote,Medium,Not required,None,Partial,None,"Cross-site scripting (XSS) vulnerability in the Downloads module in PostNuke up to 0.726, and possibly later versions, allows remote attackers to inject arbitrary HTML and web script via the ttitle parameter in a viewdownloaddetails action.","{'http://www.gulftech.org/01032004.php', 'http://securitytracker.com/id?1008629', 'http://www.derkeiler.com/Mailing-Lists/securityfocus/bugtraq/2004-01/0015.html'}"
CVE-2004-2751,https://www.cvedetails.com/cve/CVE-2004-2751/,CWE-89,Exec Code Sql,2004-12-31,2017-07-29,6.8,None,Remote,Medium,Not required,Partial,Partial,Partial,"SQL injection vulnerability in the members_list module in PostNuke 0.726, and possibly earlier, allows remote attackers to execute arbitrary SQL commands via the sortby parameter.","{'http://www.osvdb.org/3334', 'http://lists.postnuke.com/pipermail/postnuke-security/2004q1/000001.html', 'http://www.derkeiler.com/Mailing-Lists/securityfocus/bugtraq/2004-01/0015.html', 'http://www.gulftech.org/01032004.php', 'http://securitytracker.com/id?1008629', 'http://archives.neohapsis.com/archives/vulnwatch/2003-q1/0117.html', 'https://exchange.xforce.ibmcloud.com/vulnerabilities/11500', 'http://community.postnuke.com/Article2535.htm'}"
CVE-2004-2750,https://www.cvedetails.com/cve/CVE-2004-2750/,CWE-22,Dir. Trav.,2004-12-31,2008-09-05,5.0,None,Remote,Low,Not required,Partial,None,None,Directory traversal vulnerability in browser.php in JBrowser 1.0 through 2.1 allows remote attackers to read arbitrary files via the directory parameter.  NOTE: the provenance of this information is unknown; the details are obtained solely from third party information.,"{'http://www.securityfocus.com/bid/9535', 'http://securitytracker.com/id?1008909'}"
CVE-2004-2749,https://www.cvedetails.com/cve/CVE-2004-2749/,CWE-22,XSS Dir. Trav.,2004-12-31,2017-07-29,4.3,None,Remote,Medium,Not required,Partial,None,None,"Directory traversal vulnerability in wra/public/wralogin in 2Wire Gateway, possibly as used in HomePortal and other product lines, allows remote attackers to read arbitrary files via a .. (dot dot) in the return parameter.  NOTE: this issue was reported as XSS, but this might be a terminology error.","{'https://secunia.com/advisories/10666', 'http://www.osvdb.org/3683', 'http://www.securityfocus.com/bid/9463', 'https://exchange.xforce.ibmcloud.com/vulnerabilities/14894', 'http://securitytracker.com/id?1008798', 'http://archives.neohapsis.com/archives/bugtraq/2004-01/0179.html'}"
CVE-2004-2748,https://www.cvedetails.com/cve/CVE-2004-2748/,CWE-200,+Info,2004-12-31,2018-10-19,4.3,None,Remote,Medium,Not required,Partial,None,None,"viewreport.pl in NetIQ WebTrends Reporting Center Enterprise Edition 6.1a allows remote attackers to determine the installation path via an invalid profileid parameter, which leaks the pathname in an error message.","{'http://www.securityfocus.com/archive/1/350419/30/21610/threaded', 'https://secunia.com/advisories/10689', 'http://www.securitytracker.com/id?1008799', 'http://www.osvdb.org/3680', 'http://securityreason.com/securityalert/3354', 'http://www.securityfocus.com/bid/9460'}"
CVE-2004-2747,https://www.cvedetails.com/cve/CVE-2004-2747/,CWE-22,Dir. Trav.,2004-12-31,2018-10-19,4.0,None,Remote,Low,???,Partial,None,None,"Directory traversal vulnerability in Pablo Software Solutions Quick 'n Easy FTP Server 1.77, and possibly earlier versions, allows remote authenticated users to determine the existence of arbitrary files via a .. (dot dot) in the DEL command, which triggers different error messages depending on whether the file exists or not.","{'http://www.securityfocus.com/bid/9443', 'http://www.securitytracker.com/id?1008756', 'http://www.osvdb.org/3574', 'https://secunia.com/advisories/10661', 'http://www.securityfocus.com/archive/1/350224/30/21640/threaded'}"
CVE-2004-2746,https://www.cvedetails.com/cve/CVE-2004-2746/,CWE-89,Exec Code Sql,2004-12-31,2018-10-19,7.5,None,Remote,Low,Not required,Partial,Partial,Partial,SQL injection vulnerability in adminlogin.asp in XTREME ASP Photo Gallery 2.0 allows remote attackers to execute arbitrary SQL commands via the (1) username and (2) password parameters.,"{'https://exchange.xforce.ibmcloud.com/vulnerabilities/14860', 'http://www.tripbit.org/advisories/TA-150104.txt', 'https://secunia.com/advisories/10659', 'http://www.securityfocus.com/archive/1/350028/30/21640/threaded', 'http://www.securityfocus.com/bid/9438', 'http://securityreason.com/securityalert/3346', 'http://securitytracker.com/id?1008745', 'http://www.osvdb.org/3585', 'http://www.pensacolawebdesigns.com/xtremeasp/readmore.asp'}"
CVE-2004-2745,https://www.cvedetails.com/cve/CVE-2004-2745/,CWE-22,Dir. Trav.,2004-12-31,2018-10-19,7.8,None,Remote,Low,Not required,Complete,None,None,Directory traversal vulnerability in Anteco Visual Technologies OwnServer 1.0 and earlier allows remote attackers to read arbitrary files via a .. (dot dot) in a URL.,"{'http://www.securityfocus.com/bid/9461', 'http://www.securitytracker.com/id?1008800', 'http://www.securityfocus.com/archive/1/350421/30/21610/threaded', 'http://securityreason.com/securityalert/3329'}"
CVE-2004-2744,https://www.cvedetails.com/cve/CVE-2004-2744/,,,2004-12-31,2017-07-29,5.0,None,Remote,Low,Not required,Partial,None,None,"Unspecified vulnerability in Tincan Limited PHPlist before 2.8.12 has unknown impact and attack vectors, related to a ""security update release.""","{'https://secunia.com/advisories/12994', 'http://www.osvdb.org/11172', 'https://sourceforge.net/project/shownotes.php?release_id=277981', 'https://exchange.xforce.ibmcloud.com/vulnerabilities/17883', 'http://securitytracker.com/id?1011958'}"
CVE-2004-2743,https://www.cvedetails.com/cve/CVE-2004-2743/,CWE-264,,2004-12-31,2017-07-29,6.4,None,Remote,Low,Not required,Partial,Partial,None,upload.cgi in Mega Upload Progress Bar before 1.45 allows remote attackers to copy or overwrite arbitrary files via unspecified parameters related to names of uploaded files.,"{'https://secunia.com/advisories/12993', 'https://sourceforge.net/project/shownotes.php?release_id=277989', 'http://www.securityfocus.com/bid/11547', 'https://exchange.xforce.ibmcloud.com/vulnerabilities/17882', 'http://securitytracker.com/id?1011960', 'http://www.osvdb.org/11171', 'http://www.raditha.com/blog/archives/000547.html'}"
CVE-2004-2742,https://www.cvedetails.com/cve/CVE-2004-2742/,CWE-79,XSS,2004-12-31,2017-07-29,4.3,None,Remote,Medium,Not required,None,Partial,None,"Cross-site scripting (XSS) vulnerability in the report viewer in Crystal Enterprise 8.5, 9, and 10 allows remote attackers to inject arbitrary web script or HTML via script in the URL to a report (RPT) file.","{'http://support.businessobjects.com/library/kbase/articles/c2016559.asp', 'http://www.osvdb.org/12596', 'http://securitytracker.com/id?1012703', 'https://exchange.xforce.ibmcloud.com/vulnerabilities/18684', 'http://www.securityfocus.com/bid/12107', 'https://secunia.com/advisories/13644'}"
CVE-2004-2741,https://www.cvedetails.com/cve/CVE-2004-2741/,CWE-79,XSS,2004-12-31,2017-07-29,4.3,None,Remote,Medium,Not required,None,Partial,None,"Cross-site scripting (XSS) vulnerability in the ""help window"" (help.php) in Horde Application Framework 2.2.6 allows remote attackers to inject arbitrary web script or HTML via the (1) module, (2) topic, or (3) module parameters.","{'https://secunia.com/advisories/12992', 'http://securitytracker.com/id?1011959', 'http://cvs.horde.org/diff.php/horde/templates/help/index.inc?r1=1.9.2.4&r2=1.9.2.5&ty=u', 'http://www.securityfocus.com/bid/11546', 'http://lists.horde.org/archives/announce/2004/000107.html', 'https://exchange.xforce.ibmcloud.com/vulnerabilities/17881', 'http://www.osvdb.org/11164'}"
CVE-2004-2740,https://www.cvedetails.com/cve/CVE-2004-2740/,CWE-94,File Inclusion,2004-12-31,2017-07-29,4.3,None,Remote,Medium,Not required,None,Partial,None,PHP remote file inclusion vulnerability in authform.inc.php in PHProjekt 4.2.3 and earlier allows remote attackers to include arbitrary PHP code via a URL in the path_pre parameter.,"{'https://secunia.com/advisories/13660', 'http://www.securityfocus.com/bid/12116', 'http://securitytracker.com/id?1012708', 'https://www.gentoo.org/security/en/glsa/glsa-200412-27.xml', 'http://www.osvdb.org/12613', 'http://www.phprojekt.com/modules.php?op=modload&name=News&file=article&sid=193', 'https://exchange.xforce.ibmcloud.com/vulnerabilities/18683'}"
CVE-2004-2739,https://www.cvedetails.com/cve/CVE-2004-2739/,CWE-264,,2004-12-31,2017-07-29,7.5,None,Remote,Low,Not required,Partial,Partial,Partial,The setup routine (setup.php) in PHProjekt 4.2.1 and earlier allows remote attackers to modify system configuration via unknown attack vectors.,"{'http://www.securityfocus.com/bid/11797', 'http://www.novell.com/linux/security/advisories/2004_04_sr.html', 'http://www.phprojekt.com/modules.php?op=modload&name=News&file=article&sid=189&mode=thread&order=0', 'https://exchange.xforce.ibmcloud.com/vulnerabilities/18320', 'http://securitytracker.com/id?1012369', 'http://www.osvdb.org/12174', 'https://www.gentoo.org/security/en/glsa/glsa-200412-06.xml', 'https://secunia.com/advisories/13355'}"
CVE-2004-2738,https://www.cvedetails.com/cve/CVE-2004-2738/,CWE-79,XSS,2004-12-31,2017-07-29,4.3,None,Remote,Medium,Not required,None,Partial,None,Cross-site scripting (XSS) vulnerability in check_user_id.php in ZeroBoard 4.1pl4 and earlier allows remote attackers to inject arbitrary web script or HTML via the user_id parameter.,"{'https://exchange.xforce.ibmcloud.com/vulnerabilities/18680', 'https://secunia.com/advisories/13649', 'http://www.securityfocus.com/bid/12103', 'http://lists.grok.org.uk/pipermail/full-disclosure/2004-December/030224.html', 'https://marc.info/?l=bugtraq&m=110391024404947&w=2', 'http://securitytracker.com/id?1012677', 'http://www.osvdb.org/12582'}"
