cve_id,cve_href,cwe_id,vuln_type,publish_date,update_date,score,acces_level,access,complexity,authentication,confidentiality,integrity,availability,summary,refs
CVE-2004-1968,https://www.cvedetails.com/cve/CVE-2004-1968/,,,2004-04-26,2017-07-11,5.0,None,Remote,Low,Not required,Partial,None,None,The readmsg action in myhome.php in Open Bulletin Board (OpenBB) 1.0.6 and earlier allows remote attackers to read arbitrary messages by modifying the id parameter.,"{'https://marc.info/?l=bugtraq&m=108301983206107&w=2', 'http://securitytracker.com/id?1009935', 'https://exchange.xforce.ibmcloud.com/vulnerabilities/15970', 'http://www.securityfocus.com/bid/10217', 'https://secunia.com/advisories/11481'}"
CVE-2004-1967,https://www.cvedetails.com/cve/CVE-2004-1967/,,Exec Code CSRF,2004-04-25,2017-07-11,7.5,None,Remote,Low,Not required,Partial,Partial,Partial,"Cross-site request forgery (CSRF) vulnerabilities in (1) cp_forums.php, (2) cp_usergroup.php, (3) cp_ipbans.php, (4) myhome.php, (5) post.php, or (6) moderator.php in Open Bulletin Board (OpenBB) 1.0.6 and earlier allow remote attackers to execute arbitrary code by including the code in an image tag or a link.","{'https://marc.info/?l=bugtraq&m=108301983206107&w=2', 'http://securitytracker.com/id?1009935', 'https://secunia.com/advisories/11481', 'https://exchange.xforce.ibmcloud.com/vulnerabilities/15967'}"
CVE-2004-1966,https://www.cvedetails.com/cve/CVE-2004-1966/,,Exec Code Sql,2004-12-31,2017-07-11,7.5,None,Remote,Low,Not required,Partial,Partial,Partial,"Multiple SQL injection vulnerabilities in Open Bulletin Board (OpenBB) 1.0.6 and earlier allow remote attackers to execute arbitrary SQL commands via the (1) FID parameter in board.php, (2) sortorder, perpage, or id parameters in member.php, (3) forums parameter in search.php, or (4) PID or FID parameters in post.php.","{'https://marc.info/?l=bugtraq&m=108301983206107&w=2', 'http://securitytracker.com/id?1009935', 'http://www.securityfocus.com/bid/10214', 'https://exchange.xforce.ibmcloud.com/vulnerabilities/15964', 'https://secunia.com/advisories/11481'}"
CVE-2004-1965,https://www.cvedetails.com/cve/CVE-2004-1965/,,XSS,2004-04-25,2017-07-11,4.3,None,Remote,Medium,Not required,None,Partial,None,"Multiple cross-site scripting (XSS) vulnerabilities in Open Bulletin Board (OpenBB) 1.0.6 and earlier allows remote attackers to inject arbitrary web script or HTML via the (1) redirect parameter to member.php, (2) to parameter to myhome.php (3) TID parameter to post.php, or (4) redirect parameter to index.php.","{'https://marc.info/?l=bugtraq&m=108301983206107&w=2', 'http://securitytracker.com/id?1009935', 'http://www.securityfocus.com/bid/10214', 'https://exchange.xforce.ibmcloud.com/vulnerabilities/15966', 'https://secunia.com/advisories/11481'}"
CVE-2004-1964,https://www.cvedetails.com/cve/CVE-2004-1964/,,XSS,2004-04-23,2017-07-11,4.3,None,Remote,Medium,Not required,None,Partial,None,Cross-site scripting (XSS) vulnerability in nqt.php in Network Query Tool (NQT) 1.6 allows remote attackers to inject arbitrary web script or HTML via the portNum parameter.,"{'https://marc.info/?l=bugtraq&m=108276405108267&w=2', 'https://exchange.xforce.ibmcloud.com/vulnerabilities/15929', 'http://www.securityfocus.com/bid/10205', 'https://secunia.com/advisories/11479', 'http://www.waraxe.us/index.php?modname=sa&id=24'}"
CVE-2004-1963,https://www.cvedetails.com/cve/CVE-2004-1963/,,+Info,2004-04-23,2017-07-11,5.0,None,Remote,Low,Not required,Partial,None,None,"nqt.php in Network Query Tool (NQT) 1.6 allows remote attackers to obtain sensitive information via a string in the portNum parameter, which reveals the full path in an error message.","{'http://www.waraxe.us/index.php?modname=sa&id=24', 'https://secunia.com/advisories/11479', 'https://exchange.xforce.ibmcloud.com/vulnerabilities/15957', 'https://marc.info/?l=bugtraq&m=108276405108267&w=2'}"
CVE-2004-1962,https://www.cvedetails.com/cve/CVE-2004-1962/,,Sql Bypass,2004-12-31,2017-07-11,7.5,None,Remote,Low,Not required,Partial,Partial,Partial,"SQL injection vulnerability in index.php in Protector System 1.15b1 allows remote attackers to bypass SQL injection filters by using ""/**/"" sequences in the targeted fields.","{'http://www.waraxe.us/index.php?modname=sa&id=25', 'http://www.securityfocus.com/bid/10206', 'http://protector.warcenter.se/article-53--0-0.html', 'https://exchange.xforce.ibmcloud.com/vulnerabilities/15969', 'http://www.securityfocus.com/archive/1/361300/2004-04-21/2004-04-27/0'}"
CVE-2004-1961,https://www.cvedetails.com/cve/CVE-2004-1961/,,Exec Code Sql Bypass,2004-04-23,2016-12-20,7.5,None,Remote,Low,Not required,Partial,Partial,Partial,"blocker.php in Protector System 1.15b1 allows remote attackers to bypass SQL injection protection and execute limited SQL commands via URL-encoded ""'"" characters (""%27"").","{'http://www.waraxe.us/index.php?modname=sa&id=25', 'http://www.securityfocus.com/archive/1/361300/2004-04-21/2004-04-27/0', 'http://www.securityfocus.com/bid/10206', 'http://protector.warcenter.se/article-53--0-0.html'}"
CVE-2004-1960,https://www.cvedetails.com/cve/CVE-2004-1960/,,XSS,2004-12-31,2017-07-11,4.3,None,Remote,Medium,Not required,None,Partial,None,Cross-site scripting (XSS) vulnerability in blocker_query.php in Protector System 1.15b1 allows remote attackers to inject arbitrary web script or HTML via the (1) target or (2) portNum parameters.,"{'http://www.waraxe.us/index.php?modname=sa&id=25', 'http://www.securityfocus.com/bid/10206', 'http://protector.warcenter.se/article-53--0-0.html', 'http://www.securityfocus.com/archive/1/361300/2004-04-21/2004-04-27/0', 'https://exchange.xforce.ibmcloud.com/vulnerabilities/15965'}"
CVE-2004-1959,https://www.cvedetails.com/cve/CVE-2004-1959/,,,2004-04-23,2017-07-11,5.0,None,Remote,Low,Not required,Partial,None,None,"blocker_query.php in Protector System 1.15b1 for PHP-Nuke allows remote attackers to gain sensitive information via a string in the portNum parameter, which reveals the full path in an error message.","{'https://exchange.xforce.ibmcloud.com/vulnerabilities/15963', 'http://www.waraxe.us/index.php?modname=sa&id=25', 'http://www.securityfocus.com/bid/10206', 'http://protector.warcenter.se/article-53--0-0.html', 'https://marc.info/?l=bugtraq&m=108276299810121&w=2'}"
CVE-2004-1958,https://www.cvedetails.com/cve/CVE-2004-1958/,,Dir. Trav.,2004-12-31,2017-07-11,5.0,None,Remote,Low,Not required,None,Partial,None,Directory traversal vulnerability in manifest.ini in Unreal engine allows remote attackers to overwrite arbitrary files via .. (dot dot) sequences in a UMOD (Unreal MOD) file.,"{'https://marc.info/?l=bugtraq&m=108267310519459&w=2', 'http://aluigi.altervista.org/adv/umod-adv.txt', 'http://www.securityfocus.com/bid/10196', 'https://exchange.xforce.ibmcloud.com/vulnerabilities/15942'}"
CVE-2004-1957,https://www.cvedetails.com/cve/CVE-2004-1957/,,XSS,2004-04-21,2017-07-11,2.6,None,Remote,High,Not required,None,Partial,None,"Multiple cross-site scripting (XSS) vulnerabilities in PostNuke 0.726 allows remote attackers to inject arbitrary web script or HTML via the (1) lid and query parameters to the Downloads module, (2) query parameter to the Web_links module, or (3) hlpfile parameter to openwindow.php.","{'http://www.waraxe.us/index.php?modname=sa&id=22', 'http://www.securityfocus.com/bid/10191', 'https://exchange.xforce.ibmcloud.com/vulnerabilities/15934', 'https://marc.info/?l=bugtraq&m=108258902000472&w=2'}"
CVE-2004-1956,https://www.cvedetails.com/cve/CVE-2004-1956/,,,2004-04-21,2017-07-11,5.0,None,Remote,Low,Not required,Partial,None,None,"PostNuke 0.7.2.6 allows remote attackers to gain information via a direct HTTP request to files in the (1) includes/blocks directory, (2) pnadodb directory, (3) NS-NewUser module, (4) NS-Your_Account, (5) NS-LostPassword module, or (6) NS-User module which reveals the path to the web server in a PHP error message.","{'https://exchange.xforce.ibmcloud.com/vulnerabilities/15933', 'http://www.waraxe.us/index.php?modname=sa&id=22', 'http://www.securityfocus.com/bid/10191', 'https://marc.info/?l=bugtraq&m=108258902000472&w=2'}"
CVE-2004-1955,https://www.cvedetails.com/cve/CVE-2004-1955/,,Exec Code Sql,2004-12-31,2017-07-11,7.5,None,Remote,Low,Not required,Partial,Partial,Partial,SQL injection vulnerability in modules.php in phProfession 2.5 allows remote attackers to execute arbitrary SQL code via the offset parameter.,"{'http://www.osvdb.org/5625', 'http://www.waraxe.us/index.php?modname=sa&id=21', 'https://secunia.com/advisories/11465', 'https://marc.info/?l=bugtraq&m=108258931430060&w=2', 'https://exchange.xforce.ibmcloud.com/vulnerabilities/15932', 'http://www.securityfocus.com/bid/10190'}"
CVE-2004-1954,https://www.cvedetails.com/cve/CVE-2004-1954/,,XSS,2004-04-21,2017-07-11,4.3,None,Remote,Medium,Not required,None,Partial,None,Cross-site scripting (XSS) vulnerability in modules.php in phProfession 2.5 allows remote attackers to inject arbitrary web script or HTML via the jcode parameter.,"{'http://www.waraxe.us/index.php?modname=sa&id=21', 'https://secunia.com/advisories/11465', 'https://exchange.xforce.ibmcloud.com/vulnerabilities/15931', 'https://marc.info/?l=bugtraq&m=108258931430060&w=2', 'http://www.osvdb.org/5624', 'http://www.securityfocus.com/bid/10190'}"
CVE-2004-1953,https://www.cvedetails.com/cve/CVE-2004-1953/,,,2004-12-31,2017-07-11,5.0,None,Remote,Low,Not required,Partial,None,None,"phProfession 2.5 allows remote attackers to gain sensitive information via a direct HTTP request to upload.php, which reveals the path in a PHP error message.","{'https://exchange.xforce.ibmcloud.com/vulnerabilities/15930', 'http://www.waraxe.us/index.php?modname=sa&id=21', 'https://secunia.com/advisories/11465', 'http://www.osvdb.org/5623', 'https://marc.info/?l=bugtraq&m=108258931430060&w=2', 'http://www.securityfocus.com/bid/10190'}"
CVE-2004-1952,https://www.cvedetails.com/cve/CVE-2004-1952/,,Exec Code +Priv Sql,2004-04-23,2017-07-11,7.5,None,Remote,Low,Not required,Partial,Partial,Partial,SQL injection vulnerability in Advanced Guestbook 2.2 allows remote attackers to execute arbitrary SQL commands and gain privileges via the password.,"{'https://marc.info/?l=bugtraq&m=108258046402890&w=2', 'http://www.securityfocus.com/bid/10209', 'http://archives.neohapsis.com/archives/bugtraq/2005-02/0138.html', 'https://exchange.xforce.ibmcloud.com/vulnerabilities/15892'}"
CVE-2004-1951,https://www.cvedetails.com/cve/CVE-2004-1951/,,,2004-12-31,2017-07-11,5.0,None,Remote,Low,Not required,None,Partial,None,"xine 1.x alpha, 1.x beta, and 1.0rc through 1.0rc3a, and xine-ui 0.9.21 to 0.9.23 allows remote attackers to overwrite arbitrary files via the (1) audio.sun_audio_device or (2) dxr3.devicename options in an MRL link.","{'http://www.xinehq.de/index.php/security/XSA-2004-2', 'http://www.xinehq.de/index.php/security/XSA-2004-1', 'https://security.gentoo.org/glsa/glsa-200404-20.xml', 'https://secunia.com/advisories/11433', 'https://exchange.xforce.ibmcloud.com/vulnerabilities/15939', 'http://www.osvdb.org/5594', 'http://www.slackware.com/security/viewer.php?l=slackware-security&y=2004&m=slackware-security.372791', 'http://www.securityfocus.com/bid/10193', 'http://www.osvdb.org/5739'}"
CVE-2004-1950,https://www.cvedetails.com/cve/CVE-2004-1950/,,,2004-04-19,2017-07-11,5.0,None,Remote,Low,Not required,None,Partial,None,"phpBB 2.0.8a and earlier trusts the IP address that is in the X-Forwarded-For in the HTTP header, which allows remote attackers to spoof IP addresses.","{'https://marc.info/?l=bugtraq&m=108239864203144&w=2', 'https://marc.info/?l=bugtraq&m=108241122908409&w=2', 'https://exchange.xforce.ibmcloud.com/vulnerabilities/15909', 'http://www.securityfocus.com/bid/10170', 'https://secunia.com/advisories/11434'}"
CVE-2004-1949,https://www.cvedetails.com/cve/CVE-2004-1949/,,Sql,2004-12-31,2017-07-11,7.5,None,Remote,Low,Not required,Partial,Partial,Partial,SQL injection vulnerability in PostNuke 7.2.6 and earlier allows remote attackers to execute arbitrary SQL via (1) the sif parameter to index.php in the Comments module or (2) timezoneoffset parameter to changeinfo.php in the Your_Account module.,"{'http://www.osvdb.org/5368', 'https://secunia.com/advisories/11386', 'https://exchange.xforce.ibmcloud.com/vulnerabilities/15875', 'https://marc.info/?l=bugtraq&m=108256503718978&w=2', 'http://lists.grok.org.uk/pipermail/full-disclosure/2004-April/020154.html', 'http://news.postnuke.com/Article2580.html', 'https://exchange.xforce.ibmcloud.com/vulnerabilities/15869', 'http://www.securityfocus.com/bid/10146', 'http://securitytracker.com/id?1009801', 'http://www.osvdb.org/5369'}"
CVE-2004-1948,https://www.cvedetails.com/cve/CVE-2004-1948/,,+Info,2004-04-20,2017-07-11,4.6,None,Local,Low,Not required,Partial,Partial,Partial,"NcFTP client 3.1.6 and 3.1.7, when the username and password are included in an FTP URL that is provided on the command line, allows local users to obtain sensitive information via ""ps aux,"" which displays the URL in the process list.","{'https://marc.info/?l=bugtraq&m=108247943201685&w=2', 'http://www.securityfocus.com/bid/10182', 'https://exchange.xforce.ibmcloud.com/vulnerabilities/15919', 'https://secunia.com/advisories/11438', 'http://www.osvdb.org/5595'}"
CVE-2004-1947,https://www.cvedetails.com/cve/CVE-2004-1947/,,Exec Code +Info,2004-04-19,2017-07-11,5.0,None,Remote,Low,Not required,Partial,None,None,The AVXSCANONLINE.AvxScanOnlineCtrl.1 ActiveX control in BitDefender Scan Online allows remote attackers to (1) obtain sensitive information such as system drives and contents or (2) use the RequestFile method to download and execute arbitrary code via an object codebase that uses bitdefender.cab.,"{'http://securitytracker.com/id?1009862', 'http://www.securityfocus.com/bid/10175', 'https://marc.info/?l=bugtraq&m=108248367901616&w=2', 'http://www.osvdb.org/5549', 'https://marc.info/?l=bugtraq&m=108240639427412&w=2', 'https://exchange.xforce.ibmcloud.com/vulnerabilities/15911', 'https://secunia.com/advisories/11427', 'http://www.securityfocus.com/bid/10174'}"
CVE-2004-1946,https://www.cvedetails.com/cve/CVE-2004-1946/,,Exec Code,2004-04-19,2017-07-11,4.6,None,Local,Low,Not required,Partial,Partial,Partial,"Format string vulnerability in the PRINT_ERROR function in common.c for Cherokee Web Server 0.4.16 and earlier allows local users to execute arbitrary code via format string specifiers in the -C command line argument.  NOTE: it is not clear whether this issue could be exploited remotely, or if Cherokee is running at escalated privileges. Therefore it might not be a vulnerability.","{'https://exchange.xforce.ibmcloud.com/vulnerabilities/15924', 'http://www.nosystem.com.ar/advisories/advisory-03.txt', 'https://marc.info/?l=bugtraq&m=108249818308672&w=2'}"
CVE-2004-1945,https://www.cvedetails.com/cve/CVE-2004-1945/,,Exec Code Overflow,2004-04-20,2017-07-11,7.5,None,Remote,Low,Not required,Partial,Partial,Partial,Buffer overflow in Kinesphere eXchange POP3 allows remote attackers to execute arbitrary code via a long MAIL FROM field.,"{'https://secunia.com/advisories/11449', 'https://marc.info/?l=bugtraq&m=108247921402458&w=2', 'https://exchange.xforce.ibmcloud.com/vulnerabilities/15922', 'http://www.osvdb.org/5593', 'http://www.securityfocus.com/bid/10180', 'http://securitytracker.com/id?1009882', 'https://marc.info/?l=bugtraq&m=108568462428096&w=2'}"
CVE-2004-1944,https://www.cvedetails.com/cve/CVE-2004-1944/,,DoS,2004-04-14,2017-07-11,5.0,None,Remote,Low,Not required,None,None,Partial,Eudora 6.1 and 6.0.3 for Windows allows remote attackers to cause a denial of service (crash) via a deeply nested multipart MIME message.,"{'http://lists.grok.org.uk/pipermail/full-disclosure/2004-April/020075.html', 'https://marc.info/?l=bugtraq&m=108241694627321&w=2', 'http://www.securityfocus.com/bid/10137', 'https://secunia.com/advisories/11360', 'https://exchange.xforce.ibmcloud.com/vulnerabilities/15857'}"
CVE-2004-1943,https://www.cvedetails.com/cve/CVE-2004-1943/,,Exec Code File Inclusion,2004-04-19,2017-07-11,7.5,None,Remote,Low,Not required,Partial,Partial,Partial,PHP remote file inclusion vulnerability in album_portal.php in phpBB modified by Przemo 1.8 allows remote attackers to execute arbitrary PHP code via the phpbb_root_path parameter.,"{'http://www.securityfocus.com/bid/10177', 'https://marc.info/?l=bugtraq&m=108244738102532&w=2', 'https://exchange.xforce.ibmcloud.com/vulnerabilities/15916'}"
CVE-2004-1942,https://www.cvedetails.com/cve/CVE-2004-1942/,,,2004-04-19,2017-07-11,7.5,None,Remote,Low,Not required,Partial,Partial,Partial,"The Solaris 9 patches 113579-02 through 113579-05, and 114342-02 through 114342-05, prevent ypserv and ypxfrd from properly restricting access to secure NIS maps, which allows local users to use ypcat or ypmatch to extract the contents of a secure map such as passwd.adjunct.byname.","{'http://www.securityfocus.com/bid/10261', 'https://marc.info/?l=bugtraq&m=108241638500417&w=2', 'https://exchange.xforce.ibmcloud.com/vulnerabilities/15908', 'http://sunsolve.sun.com/search/document.do?assetkey=1-26-57554-1', 'http://www.ciac.org/ciac/bulletins/o-144.shtml'}"
CVE-2004-1941,https://www.cvedetails.com/cve/CVE-2004-1941/,,DoS,2004-04-19,2017-07-11,5.0,None,Remote,Low,Not required,None,None,Partial,Fastream NETFile FTP/Web Server 6.5.1.980 allows remote attackers to cause a denial of service via a username that does not exist.,"{'https://exchange.xforce.ibmcloud.com/vulnerabilities/15899', 'https://secunia.com/advisories/11428', 'https://marc.info/?l=bugtraq&m=108239249613861&w=2', 'http://www.securityfocus.com/bid/10169', 'http://www.osvdb.org/5548', 'http://securitytracker.com/id?1009868', 'https://www.autistici.org/fdonato/advisory/FastreamNETFileFWServer6.5.1.980-adv.txt'}"
CVE-2004-1940,https://www.cvedetails.com/cve/CVE-2004-1940/,,DoS,2004-12-31,2017-07-11,5.0,None,Remote,Low,Not required,None,None,Partial,sipclient.cpp in KPhone 4.0.1 and earlier allows remote attackers to cause a denial of service (crash) via a STUN response packet with a large attrLen value that causes an out-of-bounds read.,"{'http://www.securiteam.com/unixfocus/5PP0B1FCLY.html', 'http://www.wirlab.net/kphone/changes-4.0.2.html', 'http://www.securityfocus.com/bid/10159', 'https://marc.info/?l=bugtraq&m=108244325924859&w=2', 'https://exchange.xforce.ibmcloud.com/vulnerabilities/15874'}"
CVE-2004-1939,https://www.cvedetails.com/cve/CVE-2004-1939/,,XSS,2004-04-14,2017-07-11,4.3,None,Remote,Medium,Not required,None,Partial,None,Cross-site scripting (XSS) vulnerability in Zaep AntiSpam 2.0 allows remote attackers to inject arbitrary web script or HTML via double encoded slashes (%252F) in the key parameter.,"{'https://secunia.com/advisories/11388', 'http://www.securiteam.com/windowsntfocus/5EP0I15CKK.html', 'https://exchange.xforce.ibmcloud.com/vulnerabilities/15858', 'https://marc.info/?l=bugtraq&m=108241507812681&w=2', 'http://www.securityfocus.com/bid/10139'}"
CVE-2004-1938,https://www.cvedetails.com/cve/CVE-2004-1938/,,Exec Code Sql,2004-04-19,2017-07-11,7.5,None,Remote,Low,Not required,Partial,Partial,Partial,"SQL injection vulnerability in userlogin.php in Phorum 3.4.7 allows remote attackers to execute arbitrary SQL commands via doubly hex-encoded characters such as ""%2527"", which is translated to ""'"", as demonstrated using the phorum_uriauth parameter to list.php.","{'http://www.securityfocus.com/bid/10173', 'https://exchange.xforce.ibmcloud.com/vulnerabilities/15894', 'https://marc.info/?l=bugtraq&m=108239796512897&w=2', 'http://www.waraxe.us/index.php?modname=sa&id=19', 'https://secunia.com/advisories/11407'}"
CVE-2004-1937,https://www.cvedetails.com/cve/CVE-2004-1937/,,Dir. Trav.,2004-12-31,2017-07-11,5.0,None,Remote,Low,Not required,Partial,None,None,"Multiple directory traversal vulnerabilities in Nuked-KlaN 1.4b and 1.5b allow remote attackers to read or include arbitrary files via .. sequences in (1) the user_langue parameter to index.php or (2) the langue parameter to update.php, or modify arbitrary GLOBAL variables by causing globals.php to be loaded before conf.inc.php via (3) .. sequences in the file parameter with the page parameter set to globals, or (4) ../globals.php in the user_langue parameter, as demonstrated by modifying $nuked[prefix] in the Suggest module.","{'https://exchange.xforce.ibmcloud.com/vulnerabilities/15844', 'https://exchange.xforce.ibmcloud.com/vulnerabilities/15843', 'https://www.phpsecure.info/v2/tutos/frog/Nuked-KlaN.txt', 'https://secunia.com/advisories/11341', 'https://marc.info/?l=bugtraq&m=108222826225823&w=2', 'http://www.securityfocus.com/bid/10104'}"
CVE-2004-1936,https://www.cvedetails.com/cve/CVE-2004-1936/,,Bypass,2004-04-14,2017-07-11,7.5,None,Remote,Low,Not required,Partial,Partial,Partial,ZoneAlarm Pro 4.5.538.001 and possibly other versions allows remote attackers to bypass e-mail protection via attachments whose names contain certain non-English characters.,"{'http://www.securityfocus.com/bid/10148', 'https://marc.info/?l=bugtraq&m=108206751931251&w=2', 'https://exchange.xforce.ibmcloud.com/vulnerabilities/15884', 'https://marc.info/?l=bugtraq&m=108248415509417&w=2'}"
CVE-2004-1935,https://www.cvedetails.com/cve/CVE-2004-1935/,,XSS,2004-04-15,2017-07-11,4.3,None,Remote,Medium,Not required,None,Partial,None,"Cross-site scripting (XSS) vulnerability in SCT Campus Pipeline allows remote attackers to inject arbitrary web script or HTML via onload, onmouseover, and other Javascript events in an e-mail attachment.","{'https://marc.info/?l=bugtraq&m=108207280917231&w=2', 'https://secunia.com/advisories/11396', 'https://exchange.xforce.ibmcloud.com/vulnerabilities/15878', 'http://www.securityfocus.com/bid/10154'}"
CVE-2004-1934,https://www.cvedetails.com/cve/CVE-2004-1934/,,Exec Code File Inclusion,2004-04-15,2017-07-11,7.5,None,Remote,Low,Not required,Partial,Partial,Partial,PHP remote file inclusion vulnerability in affich.php in Gemitel 3.50 allows remote attackers to execute arbitrary PHP code via the base parameter.,"{'https://secunia.com/advisories/11393', 'http://www.osvdb.org/5396', 'http://www.securityfocus.com/bid/10156', 'http://securitytracker.com/id?1009824', 'https://exchange.xforce.ibmcloud.com/vulnerabilities/15887', 'https://marc.info/?l=bugtraq&m=108206642725505&w=2'}"
CVE-2004-1933,https://www.cvedetails.com/cve/CVE-2004-1933/,,Bypass,2004-04-12,2017-07-11,2.1,None,Local,Low,Not required,Partial,None,None,"Citadel/UX 5.00 through 6.14 installs the database directory and files with world-read permissions, which could allow local users to bypass access controls and read unauthorized messages.","{'http://www.securityfocus.com/bid/10102', 'https://exchange.xforce.ibmcloud.com/vulnerabilities/15850', 'https://marc.info/?l=bugtraq&m=108180024428804&w=2'}"
CVE-2004-1932,https://www.cvedetails.com/cve/CVE-2004-1932/,,Exec Code Sql,2004-04-12,2017-07-11,7.5,None,Remote,Low,Not required,Partial,Partial,Partial,SQL injection vulnerability in (1) auth.php and (2) admin.php in PHP-Nuke 6.x through 7.2 allows remote attackers to execute arbitrary SQL code and create an administrator account via base64-encoded SQL in the admin parameter.,"{'https://exchange.xforce.ibmcloud.com/vulnerabilities/15835', 'https://marc.info/?l=bugtraq&m=108180334918576&w=2', 'http://www.waraxe.us/index.php?modname=sa&id=18'}"
CVE-2004-1930,https://www.cvedetails.com/cve/CVE-2004-1930/,,XSS,2004-04-12,2017-07-11,4.3,None,Remote,Medium,Not required,None,Partial,None,"Cross-site scripting (XSS) vulnerability in the cookiedecode function in mainfile.php for PHP-Nuke 6.x through 7.2, when themes are used, allows remote attackers to inject arbitrary web script or HTML via a base64-encoded user parameter or cookie.","{'http://www.waraxe.us/index.php?modname=sa&id=16', 'https://exchange.xforce.ibmcloud.com/vulnerabilities/15842', 'https://marc.info/?l=bugtraq&m=108182759214035&w=2', 'https://secunia.com/advisories/11347', 'http://www.securityfocus.com/bid/10128'}"
CVE-2004-1929,https://www.cvedetails.com/cve/CVE-2004-1929/,,Sql Bypass,2004-04-13,2017-07-11,7.5,None,Remote,Low,Not required,Partial,Partial,Partial,SQL injection vulnerability in the bblogin function in functions.php in PHP-Nuke 6.x through 7.2 allows remote attackers to bypass authentication and gain access by injecting base64-encoded SQL code into the user parameter.,"{'http://www.waraxe.us/index.php?modname=sa&id=17', 'https://exchange.xforce.ibmcloud.com/vulnerabilities/15839', 'https://secunia.com/advisories/11347', 'https://marc.info/?l=bugtraq&m=108180111826852&w=2', 'http://www.securityfocus.com/bid/10135'}"
CVE-2004-1928,https://www.cvedetails.com/cve/CVE-2004-1928/,CWE-20,,2004-04-12,2017-07-11,7.5,None,Remote,Low,Not required,Partial,Partial,Partial,The image upload feature in Tiki CMS/Groupware (TikiWiki) 1.8.1 and earlier allows remote attackers to upload and possibly execute arbitrary files via the img/wiki_up URL.,"{'https://secunia.com/advisories/11344', 'https://marc.info/?l=bugtraq&m=108180073206947&w=2', 'http://www.securityfocus.com/bid/10100', 'https://exchange.xforce.ibmcloud.com/vulnerabilities/15849', 'http://tikiwiki.org/tiki-read_article.php?articleId=66'}"
CVE-2004-1927,https://www.cvedetails.com/cve/CVE-2004-1927/,CWE-22,Dir. Trav.,2004-04-11,2017-07-11,5.0,None,Remote,Low,Not required,Partial,None,None,Directory traversal vulnerability in the map feature (tiki-map.phtml) in Tiki CMS/Groupware (TikiWiki) 1.8.1 and earlier allows remote attackers to determine the existence of arbitrary files via .. (dot dot) sequences in the mapfile parameter.,"{'https://secunia.com/advisories/11344', 'https://marc.info/?l=bugtraq&m=108180073206947&w=2', 'http://www.securityfocus.com/bid/10100', 'http://tikiwiki.org/tiki-read_article.php?articleId=66', 'https://exchange.xforce.ibmcloud.com/vulnerabilities/15848'}"
